Name: “Table 1 of 1 on page 11 of 12”,Name: “Table 1 of 1 on page 11 of 12”,Name: “Table 1 of 1 on page 11 of 12”,Name: “Table 1 of 1 on page 11 of 12”,Name: “Table 1 of 1 on page 11 of 12”,Name: “Table 1 of 1 on page 11 of 12”,Name: “Table 1 of 1 on page 11 of 12”,Name: “Table 1 of 1 on page 11 of 12”,Name: “Table 1 of 1 on page 11 of 12”,Name: “Table 1 of 1 on page 11 of 12”,Name: “Table 1 of 1 on page 11 of 12”,Name: “Table 1 of 1 on page 11 of 12”,Name: “Table 1 of 1 on page 11 of 12”,Name: “Table 1 of 1 on page 11 of 12”,Name: “Table 1 of 1 on page 11 of 12”,Name: “Table 1 of 1 on page 11 of 12”
Table: 11,Table: 11,Table: 11,Table: 11,Table: 11,Table: 11,Table: 11,Table: 11,Table: 11,Table: 11,Table: 11,Table: 11,Table: 11,Table: 11,Table: 11,Table: 11
,,,,,,,,,,,,,,,
,,,,,V IRGINIA A SSOCIATION OF,V IRGINIA A SSOCIATION OF,V IRGINIA A SSOCIATION OF,V IRGINIA A SSOCIATION OF,V IRGINIA A SSOCIATION OF,V IRGINIA A SSOCIATION OF,V IRGINIA A SSOCIATION OF,,,,
,,,,,F OREST H EALTH P ROFESSIONALS,F OREST H EALTH P ROFESSIONALS,F OREST H EALTH P ROFESSIONALS,F OREST H EALTH P ROFESSIONALS,F OREST H EALTH P ROFESSIONALS,F OREST H EALTH P ROFESSIONALS,F OREST H EALTH P ROFESSIONALS,,,,
Virginia Association,Virginia Association,Virginia Association,Virginia Association,Virginia Association,Virginia Association,Virginia Association,,Because,Because,this,meeting,offers,full,pesticide,recertification
,,,,,,,,"credits, as well as ISA and SAF credits, it is popular among","credits, as well as ISA and SAF credits, it is popular among","credits, as well as ISA and SAF credits, it is popular among","credits, as well as ISA and SAF credits, it is popular among","credits, as well as ISA and SAF credits, it is popular among","credits, as well as ISA and SAF credits, it is popular among","credits, as well as ISA and SAF credits, it is popular among","credits, as well as ISA and SAF credits, it is popular among"
of Forest Health,of Forest Health,of Forest Health,of Forest Health,of Forest Health,of Forest Health,,,those VDOF foresters who know about it. I make an effort,those VDOF foresters who know about it. I make an effort,those VDOF foresters who know about it. I make an effort,those VDOF foresters who know about it. I make an effort,those VDOF foresters who know about it. I make an effort,those VDOF foresters who know about it. I make an effort,those VDOF foresters who know about it. I make an effort,those VDOF foresters who know about it. I make an effort
,,,,,,,,every year to support the costs of registration for 10 to 20 of,every year to support the costs of registration for 10 to 20 of,every year to support the costs of registration for 10 to 20 of,every year to support the costs of registration for 10 to 20 of,every year to support the costs of registration for 10 to 20 of,every year to support the costs of registration for 10 to 20 of,every year to support the costs of registration for 10 to 20 of,every year to support the costs of registration for 10 to 20 of
Professionals (VAFHP) –,Professionals (VAFHP) –,Professionals (VAFHP) –,Professionals (VAFHP) –,Professionals (VAFHP) –,Professionals (VAFHP) –,Professionals (VAFHP) –,Professionals (VAFHP) –,our foresters to attend this meeting. Since I can pay registration,our foresters to attend this meeting. Since I can pay registration,our foresters to attend this meeting. Since I can pay registration,our foresters to attend this meeting. Since I can pay registration,our foresters to attend this meeting. Since I can pay registration,our foresters to attend this meeting. Since I can pay registration,our foresters to attend this meeting. Since I can pay registration,our foresters to attend this meeting. Since I can pay registration
,,,,,,,,"but not lodging or per diem, it usually requires that the","but not lodging or per diem, it usually requires that the","but not lodging or per diem, it usually requires that the","but not lodging or per diem, it usually requires that the","but not lodging or per diem, it usually requires that the","but not lodging or per diem, it usually requires that the","but not lodging or per diem, it usually requires that the","but not lodging or per diem, it usually requires that the"
What’s this?,What’s this?,What’s this?,What’s this?,What’s this?,,,,,,,,,,,
,,,,,,,,attending foresters are able to commute to the meeting. This,attending foresters are able to commute to the meeting. This,attending foresters are able to commute to the meeting. This,attending foresters are able to commute to the meeting. This,attending foresters are able to commute to the meeting. This,attending foresters are able to commute to the meeting. This,attending foresters are able to commute to the meeting. This,attending foresters are able to commute to the meeting. This
While a number of you have attended this meeting in the,While a number of you have attended this meeting in the,While a number of you have attended this meeting in the,While a number of you have attended this meeting in the,While a number of you have attended this meeting in the,While a number of you have attended this meeting in the,While a number of you have attended this meeting in the,While a number of you have attended this meeting in the,"means many folks in the south, southwest and eastern parts","means many folks in the south, southwest and eastern parts","means many folks in the south, southwest and eastern parts","means many folks in the south, southwest and eastern parts","means many folks in the south, southwest and eastern parts","means many folks in the south, southwest and eastern parts","means many folks in the south, southwest and eastern parts","means many folks in the south, southwest and eastern parts"
"past, many others are unfamiliar with it. The VAFHP began","past, many others are unfamiliar with it. The VAFHP began","past, many others are unfamiliar with it. The VAFHP began","past, many others are unfamiliar with it. The VAFHP began","past, many others are unfamiliar with it. The VAFHP began","past, many others are unfamiliar with it. The VAFHP began","past, many others are unfamiliar with it. The VAFHP began","past, many others are unfamiliar with it. The VAFHP began",of Virginia have not had an opportunity to attend or may,of Virginia have not had an opportunity to attend or may,of Virginia have not had an opportunity to attend or may,of Virginia have not had an opportunity to attend or may,of Virginia have not had an opportunity to attend or may,of Virginia have not had an opportunity to attend or may,of Virginia have not had an opportunity to attend or may,of Virginia have not had an opportunity to attend or may
as,the,Association,of,Virginia,Gypsy,Moth,Managers,not have even been aware of it. As a recent member of the,not have even been aware of it. As a recent member of the,not have even been aware of it. As a recent member of the,not have even been aware of it. As a recent member of the,not have even been aware of it. As a recent member of the,not have even been aware of it. As a recent member of the,not have even been aware of it. As a recent member of the,not have even been aware of it. As a recent member of the
"(AVGMM) in 1991, a relatively small group of county gypsy","(AVGMM) in 1991, a relatively small group of county gypsy","(AVGMM) in 1991, a relatively small group of county gypsy","(AVGMM) in 1991, a relatively small group of county gypsy","(AVGMM) in 1991, a relatively small group of county gypsy","(AVGMM) in 1991, a relatively small group of county gypsy","(AVGMM) in 1991, a relatively small group of county gypsy","(AVGMM) in 1991, a relatively small group of county gypsy","VAFHP steering committee, I have been pushing to have the","VAFHP steering committee, I have been pushing to have the","VAFHP steering committee, I have been pushing to have the","VAFHP steering committee, I have been pushing to have the","VAFHP steering committee, I have been pushing to have the","VAFHP steering committee, I have been pushing to have the","VAFHP steering committee, I have been pushing to have the","VAFHP steering committee, I have been pushing to have the"
moth,coordinators,and,and,other,representatives,in,"industry,",meeting in alternate locations every couple years so that we,meeting in alternate locations every couple years so that we,meeting in alternate locations every couple years so that we,meeting in alternate locations every couple years so that we,meeting in alternate locations every couple years so that we,meeting in alternate locations every couple years so that we,meeting in alternate locations every couple years so that we,meeting in alternate locations every couple years so that we
government and academia with a primary interest in gypsy,government and academia with a primary interest in gypsy,government and academia with a primary interest in gypsy,government and academia with a primary interest in gypsy,government and academia with a primary interest in gypsy,government and academia with a primary interest in gypsy,government and academia with a primary interest in gypsy,government and academia with a primary interest in gypsy,cover other geographic locations within the Commonwealth,cover other geographic locations within the Commonwealth,cover other geographic locations within the Commonwealth,cover other geographic locations within the Commonwealth,cover other geographic locations within the Commonwealth,cover other geographic locations within the Commonwealth,cover other geographic locations within the Commonwealth,cover other geographic locations within the Commonwealth
moth. This two-day meeting was typically held in Luray in,moth. This two-day meeting was typically held in Luray in,moth. This two-day meeting was typically held in Luray in,moth. This two-day meeting was typically held in Luray in,moth. This two-day meeting was typically held in Luray in,moth. This two-day meeting was typically held in Luray in,moth. This two-day meeting was typically held in Luray in,moth. This two-day meeting was typically held in Luray in,–,for,example,"Fredericksburg,","Fredericksburg,","Williamsburg,","Williamsburg,","Richmond,"
February and generally consisted of 30 to 40 people. In part,February and generally consisted of 30 to 40 people. In part,February and generally consisted of 30 to 40 people. In part,February and generally consisted of 30 to 40 people. In part,February and generally consisted of 30 to 40 people. In part,February and generally consisted of 30 to 40 people. In part,February and generally consisted of 30 to 40 people. In part,February and generally consisted of 30 to 40 people. In part,Portsmouth or Roanoke. I believe this would greatly increase,Portsmouth or Roanoke. I believe this would greatly increase,Portsmouth or Roanoke. I believe this would greatly increase,Portsmouth or Roanoke. I believe this would greatly increase,Portsmouth or Roanoke. I believe this would greatly increase,Portsmouth or Roanoke. I believe this would greatly increase,Portsmouth or Roanoke. I believe this would greatly increase,Portsmouth or Roanoke. I believe this would greatly increase
because many of the gypsy moth manager positions began to,because many of the gypsy moth manager positions began to,because many of the gypsy moth manager positions began to,because many of the gypsy moth manager positions began to,because many of the gypsy moth manager positions began to,because many of the gypsy moth manager positions began to,because many of the gypsy moth manager positions began to,because many of the gypsy moth manager positions began to,the visibility of this group and make it a true statewide,the visibility of this group and make it a true statewide,the visibility of this group and make it a true statewide,the visibility of this group and make it a true statewide,the visibility of this group and make it a true statewide,the visibility of this group and make it a true statewide,the visibility of this group and make it a true statewide,the visibility of this group and make it a true statewide
"change and focus more on other pest issues, such as emerald","change and focus more on other pest issues, such as emerald","change and focus more on other pest issues, such as emerald","change and focus more on other pest issues, such as emerald","change and focus more on other pest issues, such as emerald","change and focus more on other pest issues, such as emerald","change and focus more on other pest issues, such as emerald","change and focus more on other pest issues, such as emerald","meeting. In addition, it would allow for a different group of","meeting. In addition, it would allow for a different group of","meeting. In addition, it would allow for a different group of","meeting. In addition, it would allow for a different group of","meeting. In addition, it would allow for a different group of","meeting. In addition, it would allow for a different group of","meeting. In addition, it would allow for a different group of","meeting. In addition, it would allow for a different group of"
"ash borer and invasive plants, it was decided to make the","ash borer and invasive plants, it was decided to make the","ash borer and invasive plants, it was decided to make the","ash borer and invasive plants, it was decided to make the","ash borer and invasive plants, it was decided to make the","ash borer and invasive plants, it was decided to make the","ash borer and invasive plants, it was decided to make the","ash borer and invasive plants, it was decided to make the",foresters to attend the meeting for a change. Most who attend,foresters to attend the meeting for a change. Most who attend,foresters to attend the meeting for a change. Most who attend,foresters to attend the meeting for a change. Most who attend,foresters to attend the meeting for a change. Most who attend,foresters to attend the meeting for a change. Most who attend,foresters to attend the meeting for a change. Most who attend,foresters to attend the meeting for a change. Most who attend
meeting more inclusive of other forest health topics and to,meeting more inclusive of other forest health topics and to,meeting more inclusive of other forest health topics and to,meeting more inclusive of other forest health topics and to,meeting more inclusive of other forest health topics and to,meeting more inclusive of other forest health topics and to,meeting more inclusive of other forest health topics and to,meeting more inclusive of other forest health topics and to,"say they thoroughly enjoy the program, the catered lunch and","say they thoroughly enjoy the program, the catered lunch and","say they thoroughly enjoy the program, the catered lunch and","say they thoroughly enjoy the program, the catered lunch and","say they thoroughly enjoy the program, the catered lunch and","say they thoroughly enjoy the program, the catered lunch and","say they thoroughly enjoy the program, the catered lunch and","say they thoroughly enjoy the program, the catered lunch and"
"attract a larger audience. Beginning in 2007, the meeting","attract a larger audience. Beginning in 2007, the meeting","attract a larger audience. Beginning in 2007, the meeting","attract a larger audience. Beginning in 2007, the meeting","attract a larger audience. Beginning in 2007, the meeting","attract a larger audience. Beginning in 2007, the meeting","attract a larger audience. Beginning in 2007, the meeting","attract a larger audience. Beginning in 2007, the meeting","the social interaction. More importantly, they learn a lot and","the social interaction. More importantly, they learn a lot and","the social interaction. More importantly, they learn a lot and","the social interaction. More importantly, they learn a lot and","the social interaction. More importantly, they learn a lot and","the social interaction. More importantly, they learn a lot and","the social interaction. More importantly, they learn a lot and","the social interaction. More importantly, they learn a lot and"
"morphed into the VAFHP and moved to Charlottesville,","morphed into the VAFHP and moved to Charlottesville,","morphed into the VAFHP and moved to Charlottesville,","morphed into the VAFHP and moved to Charlottesville,","morphed into the VAFHP and moved to Charlottesville,","morphed into the VAFHP and moved to Charlottesville,","morphed into the VAFHP and moved to Charlottesville,","morphed into the VAFHP and moved to Charlottesville,","get their recertification credits, too! Look for announcements","get their recertification credits, too! Look for announcements","get their recertification credits, too! Look for announcements","get their recertification credits, too! Look for announcements","get their recertification credits, too! Look for announcements","get their recertification credits, too! Look for announcements","get their recertification credits, too! Look for announcements","get their recertification credits, too! Look for announcements"
where it was held again in 2008. The last two meetings have,where it was held again in 2008. The last two meetings have,where it was held again in 2008. The last two meetings have,where it was held again in 2008. The last two meetings have,where it was held again in 2008. The last two meetings have,where it was held again in 2008. The last two meetings have,where it was held again in 2008. The last two meetings have,where it was held again in 2008. The last two meetings have,"soon regarding our upcoming meeting February 7-8, 2011,","soon regarding our upcoming meeting February 7-8, 2011,","soon regarding our upcoming meeting February 7-8, 2011,","soon regarding our upcoming meeting February 7-8, 2011,","soon regarding our upcoming meeting February 7-8, 2011,","soon regarding our upcoming meeting February 7-8, 2011,","soon regarding our upcoming meeting February 7-8, 2011,","soon regarding our upcoming meeting February 7-8, 2011,"
been in Staunton. Meeting attendance during the last few,been in Staunton. Meeting attendance during the last few,been in Staunton. Meeting attendance during the last few,been in Staunton. Meeting attendance during the last few,been in Staunton. Meeting attendance during the last few,been in Staunton. Meeting attendance during the last few,been in Staunton. Meeting attendance during the last few,been in Staunton. Meeting attendance during the last few,"in Williamsburg. You can check out the website, still under","in Williamsburg. You can check out the website, still under","in Williamsburg. You can check out the website, still under","in Williamsburg. You can check out the website, still under","in Williamsburg. You can check out the website, still under","in Williamsburg. You can check out the website, still under","in Williamsburg. You can check out the website, still under","in Williamsburg. You can check out the website, still under"
years has hovered around 100 people or more.,years has hovered around 100 people or more.,years has hovered around 100 people or more.,years has hovered around 100 people or more.,years has hovered around 100 people or more.,years has hovered around 100 people or more.,,,"development, at the following link: http://www.vafhp.org/.","development, at the following link: http://www.vafhp.org/.","development, at the following link: http://www.vafhp.org/.","development, at the following link: http://www.vafhp.org/.","development, at the following link: http://www.vafhp.org/.","development, at the following link: http://www.vafhp.org/.","development, at the following link: http://www.vafhp.org/.","development, at the following link: http://www.vafhp.org/."
,,,,,,,,,,,,“Space isn’t remote at all.,“Space isn’t remote at all.,“Space isn’t remote at all.,“Space isn’t remote at all.
,,,,,,,,,,It’s only an hour’s drive away if your car,It’s only an hour’s drive away if your car,It’s only an hour’s drive away if your car,It’s only an hour’s drive away if your car,It’s only an hour’s drive away if your car,It’s only an hour’s drive away if your car
,,,,,,,,,,,could go straight upwards.”,could go straight upwards.”,could go straight upwards.”,could go straight upwards.”,could go straight upwards.”
,,,,,,,,,,,,,,"Fred Hoyle, 1970","Fred Hoyle, 1970"
,,,,,,,,,,,,,,,11
