Name: “Table 1 of 1 on page 9 of 12”,Name: “Table 1 of 1 on page 9 of 12”,Name: “Table 1 of 1 on page 9 of 12”,Name: “Table 1 of 1 on page 9 of 12”,Name: “Table 1 of 1 on page 9 of 12”,Name: “Table 1 of 1 on page 9 of 12”,Name: “Table 1 of 1 on page 9 of 12”,Name: “Table 1 of 1 on page 9 of 12”,Name: “Table 1 of 1 on page 9 of 12”,Name: “Table 1 of 1 on page 9 of 12”
Table: 9,Table: 9,Table: 9,Table: 9,Table: 9,Table: 9,Table: 9,Table: 9,Table: 9,Table: 9
,,,,,,,,,
"population at James River State Park is similarly isolated, it is","population at James River State Park is similarly isolated, it is","population at James River State Park is similarly isolated, it is","population at James River State Park is similarly isolated, it is","population at James River State Park is similarly isolated, it is","population at James River State Park is similarly isolated, it is","population at James River State Park is similarly isolated, it is","population at James River State Park is similarly isolated, it is","population at James River State Park is similarly isolated, it is",repeatedly
"only about 20 miles or so from the core range of hemlock, as","only about 20 miles or so from the core range of hemlock, as","only about 20 miles or so from the core range of hemlock, as","only about 20 miles or so from the core range of hemlock, as","only about 20 miles or so from the core range of hemlock, as","only about 20 miles or so from the core range of hemlock, as","only about 20 miles or so from the core range of hemlock, as","only about 20 miles or so from the core range of hemlock, as","only about 20 miles or so from the core range of hemlock, as",due to the human traffic coming
opposed to 120 miles and a much milder climate at Sandy,opposed to 120 miles and a much milder climate at Sandy,opposed to 120 miles and a much milder climate at Sandy,opposed to 120 miles and a much milder climate at Sandy,opposed to 120 miles and a much milder climate at Sandy,opposed to 120 miles and a much milder climate at Sandy,opposed to 120 miles and a much milder climate at Sandy,opposed to 120 miles and a much milder climate at Sandy,opposed to 120 miles and a much milder climate at Sandy,"through all day long. Like the lady bugs, they seem to prefer"
Point. Walking towards this population through a typical,Point. Walking towards this population through a typical,Point. Walking towards this population through a typical,Point. Walking towards this population through a typical,Point. Walking towards this population through a typical,Point. Walking towards this population through a typical,Point. Walking towards this population through a typical,Point. Walking towards this population through a typical,Point. Walking towards this population through a typical,south or west-facing sides of buildings and bright surfaces.
"flatwoods stand of loblolly pine, you would never guess it","flatwoods stand of loblolly pine, you would never guess it","flatwoods stand of loblolly pine, you would never guess it","flatwoods stand of loblolly pine, you would never guess it","flatwoods stand of loblolly pine, you would never guess it","flatwoods stand of loblolly pine, you would never guess it","flatwoods stand of loblolly pine, you would never guess it","flatwoods stand of loblolly pine, you would never guess it","flatwoods stand of loblolly pine, you would never guess it","They are more active during sunny, warm weather. Although"
was there until you stumble upon it. The ground suddenly,was there until you stumble upon it. The ground suddenly,was there until you stumble upon it. The ground suddenly,was there until you stumble upon it. The ground suddenly,was there until you stumble upon it. The ground suddenly,was there until you stumble upon it. The ground suddenly,was there until you stumble upon it. The ground suddenly,was there until you stumble upon it. The ground suddenly,was there until you stumble upon it. The ground suddenly,"they spend the winter indoors, they often find hiding places"
"grades steeply downward towards a creek, and you enter a","grades steeply downward towards a creek, and you enter a","grades steeply downward towards a creek, and you enter a","grades steeply downward towards a creek, and you enter a","grades steeply downward towards a creek, and you enter a","grades steeply downward towards a creek, and you enter a","grades steeply downward towards a creek, and you enter a","grades steeply downward towards a creek, and you enter a","grades steeply downward towards a creek, and you enter a",and may go unnoticed until warm conditions raise their
"shady forest stand with abundant beech trees and, yes, a very","shady forest stand with abundant beech trees and, yes, a very","shady forest stand with abundant beech trees and, yes, a very","shady forest stand with abundant beech trees and, yes, a very","shady forest stand with abundant beech trees and, yes, a very","shady forest stand with abundant beech trees and, yes, a very","shady forest stand with abundant beech trees and, yes, a very","shady forest stand with abundant beech trees and, yes, a very","shady forest stand with abundant beech trees and, yes, a very",activity levels and they begin to walk and fly about more
viable stand of hemlocks from small saplings to large trees,viable stand of hemlocks from small saplings to large trees,viable stand of hemlocks from small saplings to large trees,viable stand of hemlocks from small saplings to large trees,viable stand of hemlocks from small saplings to large trees,viable stand of hemlocks from small saplings to large trees,viable stand of hemlocks from small saplings to large trees,viable stand of hemlocks from small saplings to large trees,viable stand of hemlocks from small saplings to large trees,noticeably.
up to 12 to 18 inches in diameter.,up to 12 to 18 inches in diameter.,up to 12 to 18 inches in diameter.,up to 12 to 18 inches in diameter.,up to 12 to 18 inches in diameter.,up to 12 to 18 inches in diameter.,,,,
,,,,,,,,,"While some angry calls continue to come in, the best we can"
I plan on visiting the Channels and Sandy Point this fall with,I plan on visiting the Channels and Sandy Point this fall with,I plan on visiting the Channels and Sandy Point this fall with,I plan on visiting the Channels and Sandy Point this fall with,I plan on visiting the Channels and Sandy Point this fall with,I plan on visiting the Channels and Sandy Point this fall with,I plan on visiting the Channels and Sandy Point this fall with,I plan on visiting the Channels and Sandy Point this fall with,I plan on visiting the Channels and Sandy Point this fall with,"tell folks is to vacuum liberally, caulk all obvious entry points"
Scott Salom to evaluate potential release sites and options.,Scott Salom to evaluate potential release sites and options.,Scott Salom to evaluate potential release sites and options.,Scott Salom to evaluate potential release sites and options.,Scott Salom to evaluate potential release sites and options.,Scott Salom to evaluate potential release sites and options.,Scott Salom to evaluate potential release sites and options.,Scott Salom to evaluate potential release sites and options.,Scott Salom to evaluate potential release sites and options.,"and/or seal your home as best you can, and avoid using"
Scott is a professor of forest entomology at Virginia Tech,Scott is a professor of forest entomology at Virginia Tech,Scott is a professor of forest entomology at Virginia Tech,Scott is a professor of forest entomology at Virginia Tech,Scott is a professor of forest entomology at Virginia Tech,Scott is a professor of forest entomology at Virginia Tech,Scott is a professor of forest entomology at Virginia Tech,Scott is a professor of forest entomology at Virginia Tech,Scott is a professor of forest entomology at Virginia Tech,"pesticides in interior parts of the house, which won’t solve"
whose lab has pioneered the rearing and release of Laricobius,whose lab has pioneered the rearing and release of Laricobius,whose lab has pioneered the rearing and release of Laricobius,whose lab has pioneered the rearing and release of Laricobius,whose lab has pioneered the rearing and release of Laricobius,whose lab has pioneered the rearing and release of Laricobius,whose lab has pioneered the rearing and release of Laricobius,whose lab has pioneered the rearing and release of Laricobius,whose lab has pioneered the rearing and release of Laricobius,the problem and will only expose people to insecticides
nigrinus across the range of HWA. They are working on,nigrinus across the range of HWA. They are working on,nigrinus across the range of HWA. They are working on,nigrinus across the range of HWA. They are working on,nigrinus across the range of HWA. They are working on,nigrinus across the range of HWA. They are working on,nigrinus across the range of HWA. They are working on,nigrinus across the range of HWA. They are working on,nigrinus across the range of HWA. They are working on,"unnecessarily. In this respect, BMSB is a mirror image of the"
rearing and releasing a new species of Laricobius from Japan,rearing and releasing a new species of Laricobius from Japan,rearing and releasing a new species of Laricobius from Japan,rearing and releasing a new species of Laricobius from Japan,rearing and releasing a new species of Laricobius from Japan,rearing and releasing a new species of Laricobius from Japan,rearing and releasing a new species of Laricobius from Japan,rearing and releasing a new species of Laricobius from Japan,rearing and releasing a new species of Laricobius from Japan,lady bug problem.
"that looks even more promising than L. nigrinus, although it","that looks even more promising than L. nigrinus, although it","that looks even more promising than L. nigrinus, although it","that looks even more promising than L. nigrinus, although it","that looks even more promising than L. nigrinus, although it","that looks even more promising than L. nigrinus, although it","that looks even more promising than L. nigrinus, although it","that looks even more promising than L. nigrinus, although it","that looks even more promising than L. nigrinus, although it",
"is not yet ready for distribution. While it is difficult to say, at","is not yet ready for distribution. While it is difficult to say, at","is not yet ready for distribution. While it is difficult to say, at","is not yet ready for distribution. While it is difficult to say, at","is not yet ready for distribution. While it is difficult to say, at","is not yet ready for distribution. While it is difficult to say, at","is not yet ready for distribution. While it is difficult to say, at","is not yet ready for distribution. While it is difficult to say, at","is not yet ready for distribution. While it is difficult to say, at","A footnote to this story: As with the ladybug issue, VDOF"
"present, whether the beetles have been successful at limiting","present, whether the beetles have been successful at limiting","present, whether the beetles have been successful at limiting","present, whether the beetles have been successful at limiting","present, whether the beetles have been successful at limiting","present, whether the beetles have been successful at limiting","present, whether the beetles have been successful at limiting","present, whether the beetles have been successful at limiting","present, whether the beetles have been successful at limiting",and other natural resource agencies are once again on
"the impact of HWA, this effort remains our best hope of","the impact of HWA, this effort remains our best hope of","the impact of HWA, this effort remains our best hope of","the impact of HWA, this effort remains our best hope of","the impact of HWA, this effort remains our best hope of","the impact of HWA, this effort remains our best hope of","the impact of HWA, this effort remains our best hope of","the impact of HWA, this effort remains our best hope of","the impact of HWA, this effort remains our best hope of",the receiving end of accusations by a small proportion of
doing so.,,,,,,,,,the public who believe that we are releasing BMSB from
,,,,,,,,,"helicopters. I don’t know how these rumors get started, but"
Brown Marmorated,Brown Marmorated,Brown Marmorated,Brown Marmorated,Brown Marmorated,Brown Marmorated,Brown Marmorated,,,they are pervasive and can be applied to almost any natural
,,,,,,,,,resource agency in any state where you have a lady bug or
Stink Bug (BMSB),Stink Bug (BMSB),Stink Bug (BMSB),Stink Bug (BMSB),Stink Bug (BMSB),Stink Bug (BMSB),,,,stinkbug problem. I suppose stories like this have always
,,,,,,,,,been popular among a segment of the population. All we
The BMSB problem was first discovered in the U.S. near,The BMSB problem was first discovered in the U.S. near,The BMSB problem was first discovered in the U.S. near,The BMSB problem was first discovered in the U.S. near,The BMSB problem was first discovered in the U.S. near,The BMSB problem was first discovered in the U.S. near,The BMSB problem was first discovered in the U.S. near,The BMSB problem was first discovered in the U.S. near,The BMSB problem was first discovered in the U.S. near,can do is politely inform the public otherwise and use the
"Allentown,","PA,",in,1998,but,probably,existed,at,least,"facts we have at our disposal to dispel these myths. However,"
"several years earlier. Since BMSB is native to China, Japan","several years earlier. Since BMSB is native to China, Japan","several years earlier. Since BMSB is native to China, Japan","several years earlier. Since BMSB is native to China, Japan","several years earlier. Since BMSB is native to China, Japan","several years earlier. Since BMSB is native to China, Japan","several years earlier. Since BMSB is native to China, Japan","several years earlier. Since BMSB is native to China, Japan","several years earlier. Since BMSB is native to China, Japan",there will always be some who hold onto these ideas no
"and Korea, they likely arrived through shipping from one","and Korea, they likely arrived through shipping from one","and Korea, they likely arrived through shipping from one","and Korea, they likely arrived through shipping from one","and Korea, they likely arrived through shipping from one","and Korea, they likely arrived through shipping from one","and Korea, they likely arrived through shipping from one","and Korea, they likely arrived through shipping from one","and Korea, they likely arrived through shipping from one",matter what we tell them.
"of those countries. Since their arrival, they have spread","of those countries. Since their arrival, they have spread","of those countries. Since their arrival, they have spread","of those countries. Since their arrival, they have spread","of those countries. Since their arrival, they have spread","of those countries. Since their arrival, they have spread","of those countries. Since their arrival, they have spread","of those countries. Since their arrival, they have spread","of those countries. Since their arrival, they have spread",
to more than 20 states including most of the East Coast,to more than 20 states including most of the East Coast,to more than 20 states including most of the East Coast,to more than 20 states including most of the East Coast,to more than 20 states including most of the East Coast,to more than 20 states including most of the East Coast,to more than 20 states including most of the East Coast,to more than 20 states including most of the East Coast,to more than 20 states including most of the East Coast,
states. These insects become household pests during the,states. These insects become household pests during the,states. These insects become household pests during the,states. These insects become household pests during the,states. These insects become household pests during the,states. These insects become household pests during the,states. These insects become household pests during the,states. These insects become household pests during the,states. These insects become household pests during the,
fall through winter as days become shorter and nighttime,fall through winter as days become shorter and nighttime,fall through winter as days become shorter and nighttime,fall through winter as days become shorter and nighttime,fall through winter as days become shorter and nighttime,fall through winter as days become shorter and nighttime,fall through winter as days become shorter and nighttime,fall through winter as days become shorter and nighttime,fall through winter as days become shorter and nighttime,
temperatures drop. While they don’t bite or get into stored,temperatures drop. While they don’t bite or get into stored,temperatures drop. While they don’t bite or get into stored,temperatures drop. While they don’t bite or get into stored,temperatures drop. While they don’t bite or get into stored,temperatures drop. While they don’t bite or get into stored,temperatures drop. While they don’t bite or get into stored,temperatures drop. While they don’t bite or get into stored,temperatures drop. While they don’t bite or get into stored,
"food, their large numbers and foul smell when disturbed can","food, their large numbers and foul smell when disturbed can","food, their large numbers and foul smell when disturbed can","food, their large numbers and foul smell when disturbed can","food, their large numbers and foul smell when disturbed can","food, their large numbers and foul smell when disturbed can","food, their large numbers and foul smell when disturbed can","food, their large numbers and foul smell when disturbed can","food, their large numbers and foul smell when disturbed can",
"be a considerable nuisance. In this respect, they present a","be a considerable nuisance. In this respect, they present a","be a considerable nuisance. In this respect, they present a","be a considerable nuisance. In this respect, they present a","be a considerable nuisance. In this respect, they present a","be a considerable nuisance. In this respect, they present a","be a considerable nuisance. In this respect, they present a","be a considerable nuisance. In this respect, they present a","be a considerable nuisance. In this respect, they present a",
"very similar problem as the multi-colored Asian lady beetle,","very similar problem as the multi-colored Asian lady beetle,","very similar problem as the multi-colored Asian lady beetle,","very similar problem as the multi-colored Asian lady beetle,","very similar problem as the multi-colored Asian lady beetle,","very similar problem as the multi-colored Asian lady beetle,","very similar problem as the multi-colored Asian lady beetle,","very similar problem as the multi-colored Asian lady beetle,","very similar problem as the multi-colored Asian lady beetle,",
"which, strangely enough, has been noticeably less abundant","which, strangely enough, has been noticeably less abundant","which, strangely enough, has been noticeably less abundant","which, strangely enough, has been noticeably less abundant","which, strangely enough, has been noticeably less abundant","which, strangely enough, has been noticeably less abundant","which, strangely enough, has been noticeably less abundant","which, strangely enough, has been noticeably less abundant","which, strangely enough, has been noticeably less abundant",
"the last year or two. Unlike the lady beetles or lady bugs,","the last year or two. Unlike the lady beetles or lady bugs,","the last year or two. Unlike the lady beetles or lady bugs,","the last year or two. Unlike the lady beetles or lady bugs,","the last year or two. Unlike the lady beetles or lady bugs,","the last year or two. Unlike the lady beetles or lady bugs,","the last year or two. Unlike the lady beetles or lady bugs,","the last year or two. Unlike the lady beetles or lady bugs,","the last year or two. Unlike the lady beetles or lady bugs,",
"however, which are predators of other pest insects, such as","however, which are predators of other pest insects, such as","however, which are predators of other pest insects, such as","however, which are predators of other pest insects, such as","however, which are predators of other pest insects, such as","however, which are predators of other pest insects, such as","however, which are predators of other pest insects, such as","however, which are predators of other pest insects, such as","however, which are predators of other pest insects, such as",
"aphids, BMSB is becoming an important pest of a number of","aphids, BMSB is becoming an important pest of a number of","aphids, BMSB is becoming an important pest of a number of","aphids, BMSB is becoming an important pest of a number of","aphids, BMSB is becoming an important pest of a number of","aphids, BMSB is becoming an important pest of a number of","aphids, BMSB is becoming an important pest of a number of","aphids, BMSB is becoming an important pest of a number of","aphids, BMSB is becoming an important pest of a number of",
fruit and vegetable crops. Their piercing-sucking mouthparts,fruit and vegetable crops. Their piercing-sucking mouthparts,fruit and vegetable crops. Their piercing-sucking mouthparts,fruit and vegetable crops. Their piercing-sucking mouthparts,fruit and vegetable crops. Their piercing-sucking mouthparts,fruit and vegetable crops. Their piercing-sucking mouthparts,fruit and vegetable crops. Their piercing-sucking mouthparts,fruit and vegetable crops. Their piercing-sucking mouthparts,fruit and vegetable crops. Their piercing-sucking mouthparts,
can cause blemishing and tissue distortion of fruits and,can cause blemishing and tissue distortion of fruits and,can cause blemishing and tissue distortion of fruits and,can cause blemishing and tissue distortion of fruits and,can cause blemishing and tissue distortion of fruits and,can cause blemishing and tissue distortion of fruits and,can cause blemishing and tissue distortion of fruits and,can cause blemishing and tissue distortion of fruits and,can cause blemishing and tissue distortion of fruits and,
"vegetables, in some cases making the crop difficult to sell.","vegetables, in some cases making the crop difficult to sell.","vegetables, in some cases making the crop difficult to sell.","vegetables, in some cases making the crop difficult to sell.","vegetables, in some cases making the crop difficult to sell.","vegetables, in some cases making the crop difficult to sell.","vegetables, in some cases making the crop difficult to sell.","vegetables, in some cases making the crop difficult to sell.","vegetables, in some cases making the crop difficult to sell.",
"Here in Charlottesville, I first noticed these buggers last year","Here in Charlottesville, I first noticed these buggers last year","Here in Charlottesville, I first noticed these buggers last year","Here in Charlottesville, I first noticed these buggers last year","Here in Charlottesville, I first noticed these buggers last year","Here in Charlottesville, I first noticed these buggers last year","Here in Charlottesville, I first noticed these buggers last year","Here in Charlottesville, I first noticed these buggers last year","Here in Charlottesville, I first noticed these buggers last year",
as they began to invade our office building and calls began,as they began to invade our office building and calls began,as they began to invade our office building and calls began,as they began to invade our office building and calls began,as they began to invade our office building and calls began,as they began to invade our office building and calls began,as they began to invade our office building and calls began,as they began to invade our office building and calls began,as they began to invade our office building and calls began,
coming in from homeowners dealing with them for the first,coming in from homeowners dealing with them for the first,coming in from homeowners dealing with them for the first,coming in from homeowners dealing with them for the first,coming in from homeowners dealing with them for the first,coming in from homeowners dealing with them for the first,coming in from homeowners dealing with them for the first,coming in from homeowners dealing with them for the first,coming in from homeowners dealing with them for the first,
"time. This year, the problem seems to be noticeably worse","time. This year, the problem seems to be noticeably worse","time. This year, the problem seems to be noticeably worse","time. This year, the problem seems to be noticeably worse","time. This year, the problem seems to be noticeably worse","time. This year, the problem seems to be noticeably worse","time. This year, the problem seems to be noticeably worse","time. This year, the problem seems to be noticeably worse","time. This year, the problem seems to be noticeably worse",
than last year. The stairwell near my side of the building at,than last year. The stairwell near my side of the building at,than last year. The stairwell near my side of the building at,than last year. The stairwell near my side of the building at,than last year. The stairwell near my side of the building at,than last year. The stairwell near my side of the building at,than last year. The stairwell near my side of the building at,than last year. The stairwell near my side of the building at,than last year. The stairwell near my side of the building at,One of the symptoms
