"HQ often has dozens of them on the walls and ceiling, and","HQ often has dozens of them on the walls and ceiling, and","HQ often has dozens of them on the walls and ceiling, and","HQ often has dozens of them on the walls and ceiling, and","HQ often has dozens of them on the walls and ceiling, and","HQ often has dozens of them on the walls and ceiling, and","HQ often has dozens of them on the walls and ceiling, and","HQ often has dozens of them on the walls and ceiling, and","HQ often has dozens of them on the walls and ceiling, and",
there is a noticeable stench as they are probably disturbed,there is a noticeable stench as they are probably disturbed,there is a noticeable stench as they are probably disturbed,there is a noticeable stench as they are probably disturbed,there is a noticeable stench as they are probably disturbed,there is a noticeable stench as they are probably disturbed,there is a noticeable stench as they are probably disturbed,there is a noticeable stench as they are probably disturbed,there is a noticeable stench as they are probably disturbed,of an approaching nervous breakdown
,,,,,,,,,"is the belief that one’s work is terribly important,"
,,,,,,,and that to take a holiday would bring all kinds of disaster.,and that to take a holiday would bring all kinds of disaster.,and that to take a holiday would bring all kinds of disaster.
,,,,,,,,,"Bertrand Russell, 1930"
,,,,,,,,,9
