Name: “Table 1 of 1 on page 2 of 12”,Name: “Table 1 of 1 on page 2 of 12”,Name: “Table 1 of 1 on page 2 of 12”,Name: “Table 1 of 1 on page 2 of 12”,Name: “Table 1 of 1 on page 2 of 12”,Name: “Table 1 of 1 on page 2 of 12”,Name: “Table 1 of 1 on page 2 of 12”,Name: “Table 1 of 1 on page 2 of 12”,Name: “Table 1 of 1 on page 2 of 12”,Name: “Table 1 of 1 on page 2 of 12”,Name: “Table 1 of 1 on page 2 of 12”,Name: “Table 1 of 1 on page 2 of 12”,Name: “Table 1 of 1 on page 2 of 12”
Table: 2,Table: 2,Table: 2,Table: 2,Table: 2,Table: 2,Table: 2,Table: 2,Table: 2,Table: 2,Table: 2,Table: 2,Table: 2
,,,,,,,,,,,,
VDOF Research Program,VDOF Research Program,VDOF Research Program,VDOF Research Program,VDOF Research Program,VDOF Research Program,VDOF Research Program,VDOF Research Program,VDOF Research Program,,,,
Welcome to the first issue of the Virginia Department of Forestry’s Forest,Welcome to the first issue of the Virginia Department of Forestry’s Forest,Welcome to the first issue of the Virginia Department of Forestry’s Forest,Welcome to the first issue of the Virginia Department of Forestry’s Forest,Welcome to the first issue of the Virginia Department of Forestry’s Forest,Welcome to the first issue of the Virginia Department of Forestry’s Forest,Welcome to the first issue of the Virginia Department of Forestry’s Forest,Welcome to the first issue of the Virginia Department of Forestry’s Forest,Welcome to the first issue of the Virginia Department of Forestry’s Forest,Welcome to the first issue of the Virginia Department of Forestry’s Forest,Welcome to the first issue of the Virginia Department of Forestry’s Forest,Welcome to the first issue of the Virginia Department of Forestry’s Forest,
Research Review. The VDOF has a 50-year history of scientific research,Research Review. The VDOF has a 50-year history of scientific research,Research Review. The VDOF has a 50-year history of scientific research,Research Review. The VDOF has a 50-year history of scientific research,Research Review. The VDOF has a 50-year history of scientific research,Research Review. The VDOF has a 50-year history of scientific research,Research Review. The VDOF has a 50-year history of scientific research,Research Review. The VDOF has a 50-year history of scientific research,Research Review. The VDOF has a 50-year history of scientific research,Research Review. The VDOF has a 50-year history of scientific research,Research Review. The VDOF has a 50-year history of scientific research,Research Review. The VDOF has a 50-year history of scientific research,
"related to the health and sustainability of Virginia’s forests. In fact, more","related to the health and sustainability of Virginia’s forests. In fact, more","related to the health and sustainability of Virginia’s forests. In fact, more","related to the health and sustainability of Virginia’s forests. In fact, more","related to the health and sustainability of Virginia’s forests. In fact, more","related to the health and sustainability of Virginia’s forests. In fact, more","related to the health and sustainability of Virginia’s forests. In fact, more","related to the health and sustainability of Virginia’s forests. In fact, more","related to the health and sustainability of Virginia’s forests. In fact, more","related to the health and sustainability of Virginia’s forests. In fact, more","related to the health and sustainability of Virginia’s forests. In fact, more","related to the health and sustainability of Virginia’s forests. In fact, more",
than 120 research reports have been published and are available on our,than 120 research reports have been published and are available on our,than 120 research reports have been published and are available on our,than 120 research reports have been published and are available on our,than 120 research reports have been published and are available on our,than 120 research reports have been published and are available on our,than 120 research reports have been published and are available on our,than 120 research reports have been published and are available on our,than 120 research reports have been published and are available on our,than 120 research reports have been published and are available on our,than 120 research reports have been published and are available on our,than 120 research reports have been published and are available on our,
Web site. The goal of this publication will be to periodically familiarize,Web site. The goal of this publication will be to periodically familiarize,Web site. The goal of this publication will be to periodically familiarize,Web site. The goal of this publication will be to periodically familiarize,Web site. The goal of this publication will be to periodically familiarize,Web site. The goal of this publication will be to periodically familiarize,Web site. The goal of this publication will be to periodically familiarize,Web site. The goal of this publication will be to periodically familiarize,Web site. The goal of this publication will be to periodically familiarize,Web site. The goal of this publication will be to periodically familiarize,Web site. The goal of this publication will be to periodically familiarize,Web site. The goal of this publication will be to periodically familiarize,
readers with our ongoing research projects and findings.,readers with our ongoing research projects and findings.,readers with our ongoing research projects and findings.,readers with our ongoing research projects and findings.,readers with our ongoing research projects and findings.,readers with our ongoing research projects and findings.,readers with our ongoing research projects and findings.,readers with our ongoing research projects and findings.,readers with our ongoing research projects and findings.,,,,
The program is divided into four primary subject areas: tree genetics,The program is divided into four primary subject areas: tree genetics,The program is divided into four primary subject areas: tree genetics,The program is divided into four primary subject areas: tree genetics,The program is divided into four primary subject areas: tree genetics,The program is divided into four primary subject areas: tree genetics,The program is divided into four primary subject areas: tree genetics,The program is divided into four primary subject areas: tree genetics,The program is divided into four primary subject areas: tree genetics,The program is divided into four primary subject areas: tree genetics,The program is divided into four primary subject areas: tree genetics,The program is divided into four primary subject areas: tree genetics,
and restoration; forest growth and yield measurement and projection;,and restoration; forest growth and yield measurement and projection;,and restoration; forest growth and yield measurement and projection;,and restoration; forest growth and yield measurement and projection;,and restoration; forest growth and yield measurement and projection;,and restoration; forest growth and yield measurement and projection;,and restoration; forest growth and yield measurement and projection;,and restoration; forest growth and yield measurement and projection;,and restoration; forest growth and yield measurement and projection;,and restoration; forest growth and yield measurement and projection;,and restoration; forest growth and yield measurement and projection;,and restoration; forest growth and yield measurement and projection;,
"pine silviculture, and hardwood silviculture. Studies designed to address","pine silviculture, and hardwood silviculture. Studies designed to address","pine silviculture, and hardwood silviculture. Studies designed to address","pine silviculture, and hardwood silviculture. Studies designed to address","pine silviculture, and hardwood silviculture. Studies designed to address","pine silviculture, and hardwood silviculture. Studies designed to address","pine silviculture, and hardwood silviculture. Studies designed to address","pine silviculture, and hardwood silviculture. Studies designed to address","pine silviculture, and hardwood silviculture. Studies designed to address","pine silviculture, and hardwood silviculture. Studies designed to address","pine silviculture, and hardwood silviculture. Studies designed to address","pine silviculture, and hardwood silviculture. Studies designed to address",
specific,information,information,needs,or,biological,biological,systems,are,installed,and,and,
monitored across the state – often for periods of years or even decades.,monitored across the state – often for periods of years or even decades.,monitored across the state – often for periods of years or even decades.,monitored across the state – often for periods of years or even decades.,monitored across the state – often for periods of years or even decades.,monitored across the state – often for periods of years or even decades.,monitored across the state – often for periods of years or even decades.,monitored across the state – often for periods of years or even decades.,monitored across the state – often for periods of years or even decades.,monitored across the state – often for periods of years or even decades.,monitored across the state – often for periods of years or even decades.,monitored across the state – often for periods of years or even decades.,"Jerre Creighton, research program"
The program staff is assisted in these efforts by other VDOF staff in,The program staff is assisted in these efforts by other VDOF staff in,The program staff is assisted in these efforts by other VDOF staff in,The program staff is assisted in these efforts by other VDOF staff in,The program staff is assisted in these efforts by other VDOF staff in,The program staff is assisted in these efforts by other VDOF staff in,The program staff is assisted in these efforts by other VDOF staff in,The program staff is assisted in these efforts by other VDOF staff in,The program staff is assisted in these efforts by other VDOF staff in,The program staff is assisted in these efforts by other VDOF staff in,The program staff is assisted in these efforts by other VDOF staff in,The program staff is assisted in these efforts by other VDOF staff in,manager
"regions and counties where the studies are located, so the projects and","regions and counties where the studies are located, so the projects and","regions and counties where the studies are located, so the projects and","regions and counties where the studies are located, so the projects and","regions and counties where the studies are located, so the projects and","regions and counties where the studies are located, so the projects and","regions and counties where the studies are located, so the projects and","regions and counties where the studies are located, so the projects and","regions and counties where the studies are located, so the projects and","regions and counties where the studies are located, so the projects and","regions and counties where the studies are located, so the projects and","regions and counties where the studies are located, so the projects and",
results you will read about are truly the result of a department-wide,results you will read about are truly the result of a department-wide,results you will read about are truly the result of a department-wide,results you will read about are truly the result of a department-wide,results you will read about are truly the result of a department-wide,results you will read about are truly the result of a department-wide,results you will read about are truly the result of a department-wide,results you will read about are truly the result of a department-wide,results you will read about are truly the result of a department-wide,results you will read about are truly the result of a department-wide,results you will read about are truly the result of a department-wide,results you will read about are truly the result of a department-wide,
effort.,,,,,,,,,,,,
"In addition, the research program leverages our resources through","In addition, the research program leverages our resources through","In addition, the research program leverages our resources through","In addition, the research program leverages our resources through","In addition, the research program leverages our resources through","In addition, the research program leverages our resources through","In addition, the research program leverages our resources through","In addition, the research program leverages our resources through","In addition, the research program leverages our resources through","In addition, the research program leverages our resources through","In addition, the research program leverages our resources through","In addition, the research program leverages our resources through",
memberships,in,a,number,number,of,regional,and,international,research,research,research,
"cooperatives,",such,such,as,the,Tree,Improvement,Improvement,Cooperative,Cooperative,at,NC,
State; the Forest Nutrition Cooperative housed at Virginia Tech and,State; the Forest Nutrition Cooperative housed at Virginia Tech and,State; the Forest Nutrition Cooperative housed at Virginia Tech and,State; the Forest Nutrition Cooperative housed at Virginia Tech and,State; the Forest Nutrition Cooperative housed at Virginia Tech and,State; the Forest Nutrition Cooperative housed at Virginia Tech and,State; the Forest Nutrition Cooperative housed at Virginia Tech and,State; the Forest Nutrition Cooperative housed at Virginia Tech and,State; the Forest Nutrition Cooperative housed at Virginia Tech and,State; the Forest Nutrition Cooperative housed at Virginia Tech and,State; the Forest Nutrition Cooperative housed at Virginia Tech and,State; the Forest Nutrition Cooperative housed at Virginia Tech and,
North Carolina State universities; the Loblolly Pine Growth and Yield,North Carolina State universities; the Loblolly Pine Growth and Yield,North Carolina State universities; the Loblolly Pine Growth and Yield,North Carolina State universities; the Loblolly Pine Growth and Yield,North Carolina State universities; the Loblolly Pine Growth and Yield,North Carolina State universities; the Loblolly Pine Growth and Yield,North Carolina State universities; the Loblolly Pine Growth and Yield,North Carolina State universities; the Loblolly Pine Growth and Yield,North Carolina State universities; the Loblolly Pine Growth and Yield,North Carolina State universities; the Loblolly Pine Growth and Yield,North Carolina State universities; the Loblolly Pine Growth and Yield,North Carolina State universities; the Loblolly Pine Growth and Yield,
Cooperative,at,Virginia,Virginia,"Tech,",and,the,Longleaf,Alliance,at,Auburn,Auburn,
"University. Collaborations with scientists with organizations, such as the","University. Collaborations with scientists with organizations, such as the","University. Collaborations with scientists with organizations, such as the","University. Collaborations with scientists with organizations, such as the","University. Collaborations with scientists with organizations, such as the","University. Collaborations with scientists with organizations, such as the","University. Collaborations with scientists with organizations, such as the","University. Collaborations with scientists with organizations, such as the","University. Collaborations with scientists with organizations, such as the","University. Collaborations with scientists with organizations, such as the","University. Collaborations with scientists with organizations, such as the","University. Collaborations with scientists with organizations, such as the",
"American Chestnut Foundation, the Institute for Advanced Learning and","American Chestnut Foundation, the Institute for Advanced Learning and","American Chestnut Foundation, the Institute for Advanced Learning and","American Chestnut Foundation, the Institute for Advanced Learning and","American Chestnut Foundation, the Institute for Advanced Learning and","American Chestnut Foundation, the Institute for Advanced Learning and","American Chestnut Foundation, the Institute for Advanced Learning and","American Chestnut Foundation, the Institute for Advanced Learning and","American Chestnut Foundation, the Institute for Advanced Learning and","American Chestnut Foundation, the Institute for Advanced Learning and","American Chestnut Foundation, the Institute for Advanced Learning and","American Chestnut Foundation, the Institute for Advanced Learning and",
"Research at Danville, and various other universities, further enhance the","Research at Danville, and various other universities, further enhance the","Research at Danville, and various other universities, further enhance the","Research at Danville, and various other universities, further enhance the","Research at Danville, and various other universities, further enhance the","Research at Danville, and various other universities, further enhance the","Research at Danville, and various other universities, further enhance the","Research at Danville, and various other universities, further enhance the","Research at Danville, and various other universities, further enhance the","Research at Danville, and various other universities, further enhance the","Research at Danville, and various other universities, further enhance the","Research at Danville, and various other universities, further enhance the",
"overall VDOF program. Industries, such as MeadWestvaco and BASF,","overall VDOF program. Industries, such as MeadWestvaco and BASF,","overall VDOF program. Industries, such as MeadWestvaco and BASF,","overall VDOF program. Industries, such as MeadWestvaco and BASF,","overall VDOF program. Industries, such as MeadWestvaco and BASF,","overall VDOF program. Industries, such as MeadWestvaco and BASF,","overall VDOF program. Industries, such as MeadWestvaco and BASF,","overall VDOF program. Industries, such as MeadWestvaco and BASF,","overall VDOF program. Industries, such as MeadWestvaco and BASF,","overall VDOF program. Industries, such as MeadWestvaco and BASF,","overall VDOF program. Industries, such as MeadWestvaco and BASF,","overall VDOF program. Industries, such as MeadWestvaco and BASF,","Wayne Bowman, research forester"
"have also shared data, study sites and resources.","have also shared data, study sites and resources.","have also shared data, study sites and resources.","have also shared data, study sites and resources.","have also shared data, study sites and resources.","have also shared data, study sites and resources.","have also shared data, study sites and resources.","have also shared data, study sites and resources.",,,,,
"In this issue, you will find a number of articles reporting on study installations, progress and results from","In this issue, you will find a number of articles reporting on study installations, progress and results from","In this issue, you will find a number of articles reporting on study installations, progress and results from","In this issue, you will find a number of articles reporting on study installations, progress and results from","In this issue, you will find a number of articles reporting on study installations, progress and results from","In this issue, you will find a number of articles reporting on study installations, progress and results from","In this issue, you will find a number of articles reporting on study installations, progress and results from","In this issue, you will find a number of articles reporting on study installations, progress and results from","In this issue, you will find a number of articles reporting on study installations, progress and results from","In this issue, you will find a number of articles reporting on study installations, progress and results from","In this issue, you will find a number of articles reporting on study installations, progress and results from","In this issue, you will find a number of articles reporting on study installations, progress and results from","In this issue, you will find a number of articles reporting on study installations, progress and results from"
around the state. We hope you will find this material useful. Please feel free to contact the research,around the state. We hope you will find this material useful. Please feel free to contact the research,around the state. We hope you will find this material useful. Please feel free to contact the research,around the state. We hope you will find this material useful. Please feel free to contact the research,around the state. We hope you will find this material useful. Please feel free to contact the research,around the state. We hope you will find this material useful. Please feel free to contact the research,around the state. We hope you will find this material useful. Please feel free to contact the research,around the state. We hope you will find this material useful. Please feel free to contact the research,around the state. We hope you will find this material useful. Please feel free to contact the research,around the state. We hope you will find this material useful. Please feel free to contact the research,around the state. We hope you will find this material useful. Please feel free to contact the research,around the state. We hope you will find this material useful. Please feel free to contact the research,around the state. We hope you will find this material useful. Please feel free to contact the research
program staff at any time with any questions or suggestions you may have:,program staff at any time with any questions or suggestions you may have:,program staff at any time with any questions or suggestions you may have:,program staff at any time with any questions or suggestions you may have:,program staff at any time with any questions or suggestions you may have:,program staff at any time with any questions or suggestions you may have:,program staff at any time with any questions or suggestions you may have:,program staff at any time with any questions or suggestions you may have:,program staff at any time with any questions or suggestions you may have:,program staff at any time with any questions or suggestions you may have:,program staff at any time with any questions or suggestions you may have:,program staff at any time with any questions or suggestions you may have:,program staff at any time with any questions or suggestions you may have:
,,,,,,www.dof virginia.gov,www.dof virginia.gov,www.dof virginia.gov,www.dof virginia.gov,,,
,,,,,,,"Jerre Creighton, research program manager, Central Office","Jerre Creighton, research program manager, Central Office","Jerre Creighton, research program manager, Central Office","Jerre Creighton, research program manager, Central Office","Jerre Creighton, research program manager, Central Office","Jerre Creighton, research program manager, Central Office"
,,,,,,,,(434) 977-6555; jerre.creighton@dof.virginia.gov,(434) 977-6555; jerre.creighton@dof.virginia.gov,(434) 977-6555; jerre.creighton@dof.virginia.gov,(434) 977-6555; jerre.creighton@dof.virginia.gov,(434) 977-6555; jerre.creighton@dof.virginia.gov
,,,,"Wayne Bowman, research forester, Appomattox-Buckingham State Forest","Wayne Bowman, research forester, Appomattox-Buckingham State Forest","Wayne Bowman, research forester, Appomattox-Buckingham State Forest","Wayne Bowman, research forester, Appomattox-Buckingham State Forest","Wayne Bowman, research forester, Appomattox-Buckingham State Forest","Wayne Bowman, research forester, Appomattox-Buckingham State Forest","Wayne Bowman, research forester, Appomattox-Buckingham State Forest","Wayne Bowman, research forester, Appomattox-Buckingham State Forest","Wayne Bowman, research forester, Appomattox-Buckingham State Forest"
,,,,,,,,(434) 983-2175; wayne.bowman@dof.virginia.gov,(434) 983-2175; wayne.bowman@dof.virginia.gov,(434) 983-2175; wayne.bowman@dof.virginia.gov,(434) 983-2175; wayne.bowman@dof.virginia.gov,(434) 983-2175; wayne.bowman@dof.virginia.gov
,,,,,,,,,,,,
