Forest,Forest
"the state, particularly sycamore anthracnose (Discula platani).","other tree species, such as maple, beech, birch, tulip poplar","other tree species, such as maple, beech, birch, tulip poplar","other tree species, such as maple, beech, birch, tulip poplar","other tree species, such as maple, beech, birch, tulip poplar","other tree species, such as maple, beech, birch, tulip poplar","other tree species, such as maple, beech, birch, tulip poplar","other tree species, such as maple, beech, birch, tulip poplar","other tree species, such as maple, beech, birch, tulip poplar","other tree species, such as maple, beech, birch, tulip poplar"
"In many severe instances, spring leaves were decimated but","and pine, will gradually replace much of the mature oak that","and pine, will gradually replace much of the mature oak that","and pine, will gradually replace much of the mature oak that","and pine, will gradually replace much of the mature oak that","and pine, will gradually replace much of the mature oak that","and pine, will gradually replace much of the mature oak that","and pine, will gradually replace much of the mature oak that","and pine, will gradually replace much of the mature oak that","and pine, will gradually replace much of the mature oak that"
quickly replaced. This may deplete starch reserves and lead,is lost.,,,,,,,,
"to decline or mortality in some trees, particularly if the winter",,,,,,,,,
"season is severe. In addition, the bacteria that causes fire",Wavy Leaf Basket Grass,Wavy Leaf Basket Grass,Wavy Leaf Basket Grass,Wavy Leaf Basket Grass,Wavy Leaf Basket Grass,Wavy Leaf Basket Grass,,,
"blight in pears, apple, crabapple, hawthorn and other species",,,,,,,,,
"of Rosaceae, was very widespread among ornamentals of",Wavy leaf basket grass (WLBG) is a relatively recent emerging,Wavy leaf basket grass (WLBG) is a relatively recent emerging,Wavy leaf basket grass (WLBG) is a relatively recent emerging,Wavy leaf basket grass (WLBG) is a relatively recent emerging,Wavy leaf basket grass (WLBG) is a relatively recent emerging,Wavy leaf basket grass (WLBG) is a relatively recent emerging,Wavy leaf basket grass (WLBG) is a relatively recent emerging,Wavy leaf basket grass (WLBG) is a relatively recent emerging,Wavy leaf basket grass (WLBG) is a relatively recent emerging
"these species. Generally, leaf diseases can be controlled",weed problem that has been documented in several areas of,weed problem that has been documented in several areas of,weed problem that has been documented in several areas of,weed problem that has been documented in several areas of,weed problem that has been documented in several areas of,weed problem that has been documented in several areas of,weed problem that has been documented in several areas of,weed problem that has been documented in several areas of,weed problem that has been documented in several areas of
"by applying a fungicide to emergent foliage in the spring,","northern Virginia and is widespread in central Maryland, but","northern Virginia and is widespread in central Maryland, but","northern Virginia and is widespread in central Maryland, but","northern Virginia and is widespread in central Maryland, but","northern Virginia and is widespread in central Maryland, but","northern Virginia and is widespread in central Maryland, but","northern Virginia and is widespread in central Maryland, but","northern Virginia and is widespread in central Maryland, but","northern Virginia and is widespread in central Maryland, but"
although multiple applications throughout the summer may,nowhere else in the U.S. to date. It’s a shade-loving grass,nowhere else in the U.S. to date. It’s a shade-loving grass,nowhere else in the U.S. to date. It’s a shade-loving grass,nowhere else in the U.S. to date. It’s a shade-loving grass,nowhere else in the U.S. to date. It’s a shade-loving grass,nowhere else in the U.S. to date. It’s a shade-loving grass,nowhere else in the U.S. to date. It’s a shade-loving grass,nowhere else in the U.S. to date. It’s a shade-loving grass,nowhere else in the U.S. to date. It’s a shade-loving grass
be necessary to prevent infections from developing later in,"that often grows with Japanese stiltgrass, which it eventually","that often grows with Japanese stiltgrass, which it eventually","that often grows with Japanese stiltgrass, which it eventually","that often grows with Japanese stiltgrass, which it eventually","that often grows with Japanese stiltgrass, which it eventually","that often grows with Japanese stiltgrass, which it eventually","that often grows with Japanese stiltgrass, which it eventually","that often grows with Japanese stiltgrass, which it eventually","that often grows with Japanese stiltgrass, which it eventually"
"the year. Fire blight, on the other hand, cannot be controlled",dominates. It thickly carpets the forest floor and outcompetes,dominates. It thickly carpets the forest floor and outcompetes,dominates. It thickly carpets the forest floor and outcompetes,dominates. It thickly carpets the forest floor and outcompetes,dominates. It thickly carpets the forest floor and outcompetes,dominates. It thickly carpets the forest floor and outcompetes,dominates. It thickly carpets the forest floor and outcompetes,dominates. It thickly carpets the forest floor and outcompetes,dominates. It thickly carpets the forest floor and outcompetes
with traditional fungicides since it is caused by a bacterium,and inhibits native flora. Sticky seed-heads promote spread,and inhibits native flora. Sticky seed-heads promote spread,and inhibits native flora. Sticky seed-heads promote spread,and inhibits native flora. Sticky seed-heads promote spread,and inhibits native flora. Sticky seed-heads promote spread,and inhibits native flora. Sticky seed-heads promote spread,and inhibits native flora. Sticky seed-heads promote spread,and inhibits native flora. Sticky seed-heads promote spread,and inhibits native flora. Sticky seed-heads promote spread
instead of a fungus. Antibiotics must be used to control fire,"by animal and human movement of seeds stuck to shoes,","by animal and human movement of seeds stuck to shoes,","by animal and human movement of seeds stuck to shoes,","by animal and human movement of seeds stuck to shoes,","by animal and human movement of seeds stuck to shoes,","by animal and human movement of seeds stuck to shoes,","by animal and human movement of seeds stuck to shoes,","by animal and human movement of seeds stuck to shoes,","by animal and human movement of seeds stuck to shoes,"
blight – but the treatment is expensive and not well tested.,clothing and fur and can be transported potentially long,clothing and fur and can be transported potentially long,clothing and fur and can be transported potentially long,clothing and fur and can be transported potentially long,clothing and fur and can be transported potentially long,clothing and fur and can be transported potentially long,clothing and fur and can be transported potentially long,clothing and fur and can be transported potentially long,clothing and fur and can be transported potentially long
Pruning fire-blight infected branches and using resistant tree,distances. While most of the major non-native invasive plants,distances. While most of the major non-native invasive plants,distances. While most of the major non-native invasive plants,distances. While most of the major non-native invasive plants,distances. While most of the major non-native invasive plants,distances. While most of the major non-native invasive plants,distances. While most of the major non-native invasive plants,distances. While most of the major non-native invasive plants,distances. While most of the major non-native invasive plants
varieties are the best method for avoiding this disease.,in Virginia have had hundreds of years to establish and become,in Virginia have had hundreds of years to establish and become,in Virginia have had hundreds of years to establish and become,in Virginia have had hundreds of years to establish and become,in Virginia have had hundreds of years to establish and become,in Virginia have had hundreds of years to establish and become,in Virginia have had hundreds of years to establish and become,in Virginia have had hundreds of years to establish and become,in Virginia have had hundreds of years to establish and become
,"very widespread, WLBG is still in the relatively early phase of","very widespread, WLBG is still in the relatively early phase of","very widespread, WLBG is still in the relatively early phase of","very widespread, WLBG is still in the relatively early phase of","very widespread, WLBG is still in the relatively early phase of","very widespread, WLBG is still in the relatively early phase of","very widespread, WLBG is still in the relatively early phase of","very widespread, WLBG is still in the relatively early phase of","very widespread, WLBG is still in the relatively early phase of"
Hemlock Woolly Adelgid,,,,,,,,,
"Significant decline continues in many areas, although trees",Continued on page 10,Continued on page 10,,,,,,,
in some areas that have supported infestations for many years,,,,,,,,,
are still hanging on. The adelgid continues to spread and has,,,,,,,,,
more-or-less permeated the entire range of hemlock,,,,,,,,,
"within Virginia, minus a few pockets here and",,,,,,,,,
,,,,,,,,,9
Wavy leaf Basket Grass,
continued,
"invasion. Currently, only 15 distinct populations have been",
"identified among seven counties, totaling approximately 220",
acres (Figure 3). These populations range in size from one,
"square foot to 80 acres. Therefore, with sufficient funding",
"and effort, Virginia has a real chance to eradicate this species",
if it acts quickly. Previous control efforts at several sites have,
been ongoing for years but have stalled out due to lack of,
funding. New USDA Forest Service Forest Health Protection,exist. This federal grant funding is being passed through from
funding will help revitalize efforts to control this species and,VDOF to Virginia Department of Conservation Division of
"survey Virginia for additional infested sites, which no doubt","Natural Heritage, who shall spearhead these efforts."
,Figure 3
10,
Yellow-Poplar Decline,Yellow-Poplar Decline,Yellow-Poplar Decline,Yellow-Poplar Decline,Yellow-Poplar Decline,Yellow-Poplar Decline,Yellow-Poplar Decline,Yellow-Poplar Decline,Yellow-Poplar Decline,,
and the Poplar Weevil in,and the Poplar Weevil in,and the Poplar Weevil in,and the Poplar Weevil in,and the Poplar Weevil in,and the Poplar Weevil in,and the Poplar Weevil in,and the Poplar Weevil in,and the Poplar Weevil in,and the Poplar Weevil in,
Southwest Virginia,Southwest Virginia,Southwest Virginia,Southwest Virginia,Southwest Virginia,Southwest Virginia,Southwest Virginia,,,,
"Recent declines in yellow-poplar in Lee, Wise and Scott","Recent declines in yellow-poplar in Lee, Wise and Scott","Recent declines in yellow-poplar in Lee, Wise and Scott","Recent declines in yellow-poplar in Lee, Wise and Scott","Recent declines in yellow-poplar in Lee, Wise and Scott","Recent declines in yellow-poplar in Lee, Wise and Scott","Recent declines in yellow-poplar in Lee, Wise and Scott","Recent declines in yellow-poplar in Lee, Wise and Scott","Recent declines in yellow-poplar in Lee, Wise and Scott","Recent declines in yellow-poplar in Lee, Wise and Scott",
counties have landowners concerned over the health of,counties have landowners concerned over the health of,counties have landowners concerned over the health of,counties have landowners concerned over the health of,counties have landowners concerned over the health of,counties have landowners concerned over the health of,counties have landowners concerned over the health of,counties have landowners concerned over the health of,counties have landowners concerned over the health of,counties have landowners concerned over the health of,
one of the most abundant and resilient hardwood trees in,one of the most abundant and resilient hardwood trees in,one of the most abundant and resilient hardwood trees in,one of the most abundant and resilient hardwood trees in,one of the most abundant and resilient hardwood trees in,one of the most abundant and resilient hardwood trees in,one of the most abundant and resilient hardwood trees in,one of the most abundant and resilient hardwood trees in,one of the most abundant and resilient hardwood trees in,one of the most abundant and resilient hardwood trees in,
Virginia’s forests. While I am not entirely certain about the,Virginia’s forests. While I am not entirely certain about the,Virginia’s forests. While I am not entirely certain about the,Virginia’s forests. While I am not entirely certain about the,Virginia’s forests. While I am not entirely certain about the,Virginia’s forests. While I am not entirely certain about the,Virginia’s forests. While I am not entirely certain about the,Virginia’s forests. While I am not entirely certain about the,Virginia’s forests. While I am not entirely certain about the,Virginia’s forests. While I am not entirely certain about the,
"reason for the declines, I suspect they may stem from past","reason for the declines, I suspect they may stem from past","reason for the declines, I suspect they may stem from past","reason for the declines, I suspect they may stem from past","reason for the declines, I suspect they may stem from past","reason for the declines, I suspect they may stem from past","reason for the declines, I suspect they may stem from past","reason for the declines, I suspect they may stem from past","reason for the declines, I suspect they may stem from past","reason for the declines, I suspect they may stem from past",
insect infestations that previously went unnoticed.,insect infestations that previously went unnoticed.,insect infestations that previously went unnoticed.,insect infestations that previously went unnoticed.,insect infestations that previously went unnoticed.,insect infestations that previously went unnoticed.,insect infestations that previously went unnoticed.,insect infestations that previously went unnoticed.,insect infestations that previously went unnoticed.,,
"Yellow-poplar, or tulip poplar, is the most common hardwood","Yellow-poplar, or tulip poplar, is the most common hardwood","Yellow-poplar, or tulip poplar, is the most common hardwood","Yellow-poplar, or tulip poplar, is the most common hardwood","Yellow-poplar, or tulip poplar, is the most common hardwood","Yellow-poplar, or tulip poplar, is the most common hardwood","Yellow-poplar, or tulip poplar, is the most common hardwood","Yellow-poplar, or tulip poplar, is the most common hardwood","Yellow-poplar, or tulip poplar, is the most common hardwood","Yellow-poplar, or tulip poplar, is the most common hardwood",
tree in Virginia and one of the most important timber species,tree in Virginia and one of the most important timber species,tree in Virginia and one of the most important timber species,tree in Virginia and one of the most important timber species,tree in Virginia and one of the most important timber species,tree in Virginia and one of the most important timber species,tree in Virginia and one of the most important timber species,tree in Virginia and one of the most important timber species,tree in Virginia and one of the most important timber species,tree in Virginia and one of the most important timber species,
"in far southwest Virginia. Its rapid growth, straight trunk","in far southwest Virginia. Its rapid growth, straight trunk","in far southwest Virginia. Its rapid growth, straight trunk","in far southwest Virginia. Its rapid growth, straight trunk","in far southwest Virginia. Its rapid growth, straight trunk","in far southwest Virginia. Its rapid growth, straight trunk","in far southwest Virginia. Its rapid growth, straight trunk","in far southwest Virginia. Its rapid growth, straight trunk","in far southwest Virginia. Its rapid growth, straight trunk","in far southwest Virginia. Its rapid growth, straight trunk",
"and wood properties, along with its abundance, make it","and wood properties, along with its abundance, make it","and wood properties, along with its abundance, make it","and wood properties, along with its abundance, make it","and wood properties, along with its abundance, make it","and wood properties, along with its abundance, make it","and wood properties, along with its abundance, make it","and wood properties, along with its abundance, make it","and wood properties, along with its abundance, make it","and wood properties, along with its abundance, make it",
an excellent tree for loggers to harvest in bulk and bring to,an excellent tree for loggers to harvest in bulk and bring to,an excellent tree for loggers to harvest in bulk and bring to,an excellent tree for loggers to harvest in bulk and bring to,an excellent tree for loggers to harvest in bulk and bring to,an excellent tree for loggers to harvest in bulk and bring to,an excellent tree for loggers to harvest in bulk and bring to,an excellent tree for loggers to harvest in bulk and bring to,an excellent tree for loggers to harvest in bulk and bring to,an excellent tree for loggers to harvest in bulk and bring to,
"the mills. Generally speaking, yellow-poplar is a resilient","the mills. Generally speaking, yellow-poplar is a resilient","the mills. Generally speaking, yellow-poplar is a resilient","the mills. Generally speaking, yellow-poplar is a resilient","the mills. Generally speaking, yellow-poplar is a resilient","the mills. Generally speaking, yellow-poplar is a resilient","the mills. Generally speaking, yellow-poplar is a resilient","the mills. Generally speaking, yellow-poplar is a resilient","the mills. Generally speaking, yellow-poplar is a resilient","the mills. Generally speaking, yellow-poplar is a resilient",
tree that does particularly well in moist cove habitats and,tree that does particularly well in moist cove habitats and,tree that does particularly well in moist cove habitats and,tree that does particularly well in moist cove habitats and,tree that does particularly well in moist cove habitats and,tree that does particularly well in moist cove habitats and,tree that does particularly well in moist cove habitats and,tree that does particularly well in moist cove habitats and,tree that does particularly well in moist cove habitats and,tree that does particularly well in moist cove habitats and,
fertile soils common to the lower slopes and valleys of,fertile soils common to the lower slopes and valleys of,fertile soils common to the lower slopes and valleys of,fertile soils common to the lower slopes and valleys of,fertile soils common to the lower slopes and valleys of,fertile soils common to the lower slopes and valleys of,fertile soils common to the lower slopes and valleys of,fertile soils common to the lower slopes and valleys of,fertile soils common to the lower slopes and valleys of,fertile soils common to the lower slopes and valleys of,
the southern Appalachians. It also has very few insect and,the southern Appalachians. It also has very few insect and,the southern Appalachians. It also has very few insect and,the southern Appalachians. It also has very few insect and,the southern Appalachians. It also has very few insect and,the southern Appalachians. It also has very few insect and,the southern Appalachians. It also has very few insect and,the southern Appalachians. It also has very few insect and,the southern Appalachians. It also has very few insect and,the southern Appalachians. It also has very few insect and,
"disease problems due to the fact that the leaves, bark and","disease problems due to the fact that the leaves, bark and","disease problems due to the fact that the leaves, bark and","disease problems due to the fact that the leaves, bark and","disease problems due to the fact that the leaves, bark and","disease problems due to the fact that the leaves, bark and","disease problems due to the fact that the leaves, bark and","disease problems due to the fact that the leaves, bark and","disease problems due to the fact that the leaves, bark and","disease problems due to the fact that the leaves, bark and",
wood contain a host of chemicals that deter them. Even an,wood contain a host of chemicals that deter them. Even an,wood contain a host of chemicals that deter them. Even an,wood contain a host of chemicals that deter them. Even an,wood contain a host of chemicals that deter them. Even an,wood contain a host of chemicals that deter them. Even an,wood contain a host of chemicals that deter them. Even an,wood contain a host of chemicals that deter them. Even an,wood contain a host of chemicals that deter them. Even an,wood contain a host of chemicals that deter them. Even an,
"invasive species like the gypsy moth, which can feed on","invasive species like the gypsy moth, which can feed on","invasive species like the gypsy moth, which can feed on","invasive species like the gypsy moth, which can feed on","invasive species like the gypsy moth, which can feed on","invasive species like the gypsy moth, which can feed on","invasive species like the gypsy moth, which can feed on","invasive species like the gypsy moth, which can feed on","invasive species like the gypsy moth, which can feed on","invasive species like the gypsy moth, which can feed on",
"more than 200 species of trees and shrubs, will completely","more than 200 species of trees and shrubs, will completely","more than 200 species of trees and shrubs, will completely","more than 200 species of trees and shrubs, will completely","more than 200 species of trees and shrubs, will completely","more than 200 species of trees and shrubs, will completely","more than 200 species of trees and shrubs, will completely","more than 200 species of trees and shrubs, will completely","more than 200 species of trees and shrubs, will completely","more than 200 species of trees and shrubs, will completely",
avoid feeding on yellow-poplar.,avoid feeding on yellow-poplar.,avoid feeding on yellow-poplar.,avoid feeding on yellow-poplar.,avoid feeding on yellow-poplar.,avoid feeding on yellow-poplar.,,,,,
"Two notable exceptions to this rule, however, are native","Two notable exceptions to this rule, however, are native","Two notable exceptions to this rule, however, are native","Two notable exceptions to this rule, however, are native","Two notable exceptions to this rule, however, are native","Two notable exceptions to this rule, however, are native","Two notable exceptions to this rule, however, are native","Two notable exceptions to this rule, however, are native","Two notable exceptions to this rule, however, are native","Two notable exceptions to this rule, however, are native",
insects known as the tulip tree scale and the poplar weevil.,insects known as the tulip tree scale and the poplar weevil.,insects known as the tulip tree scale and the poplar weevil.,insects known as the tulip tree scale and the poplar weevil.,insects known as the tulip tree scale and the poplar weevil.,insects known as the tulip tree scale and the poplar weevil.,insects known as the tulip tree scale and the poplar weevil.,insects known as the tulip tree scale and the poplar weevil.,insects known as the tulip tree scale and the poplar weevil.,insects known as the tulip tree scale and the poplar weevil.,
"The scale is a tiny sap-sucking insect that produces a brown,","The scale is a tiny sap-sucking insect that produces a brown,","The scale is a tiny sap-sucking insect that produces a brown,","The scale is a tiny sap-sucking insect that produces a brown,","The scale is a tiny sap-sucking insect that produces a brown,","The scale is a tiny sap-sucking insect that produces a brown,","The scale is a tiny sap-sucking insect that produces a brown,","The scale is a tiny sap-sucking insect that produces a brown,","The scale is a tiny sap-sucking insect that produces a brown,","The scale is a tiny sap-sucking insect that produces a brown,",
waxy covering that looks something like a tortoise shell.,waxy covering that looks something like a tortoise shell.,waxy covering that looks something like a tortoise shell.,waxy covering that looks something like a tortoise shell.,waxy covering that looks something like a tortoise shell.,waxy covering that looks something like a tortoise shell.,waxy covering that looks something like a tortoise shell.,waxy covering that looks something like a tortoise shell.,waxy covering that looks something like a tortoise shell.,waxy covering that looks something like a tortoise shell.,
Populations of these insects can occasionally reach such high,Populations of these insects can occasionally reach such high,Populations of these insects can occasionally reach such high,Populations of these insects can occasionally reach such high,Populations of these insects can occasionally reach such high,Populations of these insects can occasionally reach such high,Populations of these insects can occasionally reach such high,Populations of these insects can occasionally reach such high,Populations of these insects can occasionally reach such high,Populations of these insects can occasionally reach such high,
levels in the forest that they can damage and even kill poplar,levels in the forest that they can damage and even kill poplar,levels in the forest that they can damage and even kill poplar,levels in the forest that they can damage and even kill poplar,levels in the forest that they can damage and even kill poplar,levels in the forest that they can damage and even kill poplar,levels in the forest that they can damage and even kill poplar,levels in the forest that they can damage and even kill poplar,levels in the forest that they can damage and even kill poplar,levels in the forest that they can damage and even kill poplar,
