Forest,Forest
(breast height) during the winter and covering it with sticky,(breast height) during the winter and covering it with sticky,(breast height) during the winter and covering it with sticky,(breast height) during the winter and covering it with sticky,(breast height) during the winter and covering it with sticky,(breast height) during the winter and covering it with sticky,(breast height) during the winter and covering it with sticky,(breast height) during the winter and covering it with sticky,"For example, if caterpillars are sprayed with B.t. early and","For example, if caterpillars are sprayed with B.t. early and","For example, if caterpillars are sprayed with B.t. early and","For example, if caterpillars are sprayed with B.t. early and","For example, if caterpillars are sprayed with B.t. early and","For example, if caterpillars are sprayed with B.t. early and","For example, if caterpillars are sprayed with B.t. early and","For example, if caterpillars are sprayed with B.t. early and","For example, if caterpillars are sprayed with B.t. early and","For example, if caterpillars are sprayed with B.t. early and"
Tanglefoot. Adult moths are active in the winter and begin,Tanglefoot. Adult moths are active in the winter and begin,Tanglefoot. Adult moths are active in the winter and begin,Tanglefoot. Adult moths are active in the winter and begin,Tanglefoot. Adult moths are active in the winter and begin,Tanglefoot. Adult moths are active in the winter and begin,Tanglefoot. Adult moths are active in the winter and begin,Tanglefoot. Adult moths are active in the winter and begin,"shortly after egg hatch, defoliation can be controlled before it","shortly after egg hatch, defoliation can be controlled before it","shortly after egg hatch, defoliation can be controlled before it","shortly after egg hatch, defoliation can be controlled before it","shortly after egg hatch, defoliation can be controlled before it","shortly after egg hatch, defoliation can be controlled before it","shortly after egg hatch, defoliation can be controlled before it","shortly after egg hatch, defoliation can be controlled before it","shortly after egg hatch, defoliation can be controlled before it","shortly after egg hatch, defoliation can be controlled before it"
emerging from the ground in late November to mate and lay,emerging from the ground in late November to mate and lay,emerging from the ground in late November to mate and lay,emerging from the ground in late November to mate and lay,emerging from the ground in late November to mate and lay,emerging from the ground in late November to mate and lay,emerging from the ground in late November to mate and lay,emerging from the ground in late November to mate and lay,"gets too severe. Unfortunately, without banding, most people","gets too severe. Unfortunately, without banding, most people","gets too severe. Unfortunately, without banding, most people","gets too severe. Unfortunately, without banding, most people","gets too severe. Unfortunately, without banding, most people","gets too severe. Unfortunately, without banding, most people","gets too severe. Unfortunately, without banding, most people","gets too severe. Unfortunately, without banding, most people","gets too severe. Unfortunately, without banding, most people","gets too severe. Unfortunately, without banding, most people"
"eggs. With female moths being wingless and flightless, they","eggs. With female moths being wingless and flightless, they","eggs. With female moths being wingless and flightless, they","eggs. With female moths being wingless and flightless, they","eggs. With female moths being wingless and flightless, they","eggs. With female moths being wingless and flightless, they","eggs. With female moths being wingless and flightless, they","eggs. With female moths being wingless and flightless, they",have no idea what amount of damage they can expect year,have no idea what amount of damage they can expect year,have no idea what amount of damage they can expect year,have no idea what amount of damage they can expect year,have no idea what amount of damage they can expect year,have no idea what amount of damage they can expect year,have no idea what amount of damage they can expect year,have no idea what amount of damage they can expect year,have no idea what amount of damage they can expect year,have no idea what amount of damage they can expect year
must climb up to the tops of trees to lay their eggs following,must climb up to the tops of trees to lay their eggs following,must climb up to the tops of trees to lay their eggs following,must climb up to the tops of trees to lay their eggs following,must climb up to the tops of trees to lay their eggs following,must climb up to the tops of trees to lay their eggs following,must climb up to the tops of trees to lay their eggs following,must climb up to the tops of trees to lay their eggs following,"to year, and by the time they notice anything going on, it’s","to year, and by the time they notice anything going on, it’s","to year, and by the time they notice anything going on, it’s","to year, and by the time they notice anything going on, it’s","to year, and by the time they notice anything going on, it’s","to year, and by the time they notice anything going on, it’s","to year, and by the time they notice anything going on, it’s","to year, and by the time they notice anything going on, it’s","to year, and by the time they notice anything going on, it’s","to year, and by the time they notice anything going on, it’s"
mating. A tree that is banded captures these moths on the,mating. A tree that is banded captures these moths on the,mating. A tree that is banded captures these moths on the,mating. A tree that is banded captures these moths on the,mating. A tree that is banded captures these moths on the,mating. A tree that is banded captures these moths on the,mating. A tree that is banded captures these moths on the,mating. A tree that is banded captures these moths on the,usually too late to spray and the damage is done.,usually too late to spray and the damage is done.,usually too late to spray and the damage is done.,usually too late to spray and the damage is done.,usually too late to spray and the damage is done.,usually too late to spray and the damage is done.,usually too late to spray and the damage is done.,usually too late to spray and the damage is done.,,
way up as they get stuck on the sticky band. Banding thus,way up as they get stuck on the sticky band. Banding thus,way up as they get stuck on the sticky band. Banding thus,way up as they get stuck on the sticky band. Banding thus,way up as they get stuck on the sticky band. Banding thus,way up as they get stuck on the sticky band. Banding thus,way up as they get stuck on the sticky band. Banding thus,way up as they get stuck on the sticky band. Banding thus,,,,,,,,,,
can protect individual trees from later defoliation because,can protect individual trees from later defoliation because,can protect individual trees from later defoliation because,can protect individual trees from later defoliation because,can protect individual trees from later defoliation because,can protect individual trees from later defoliation because,can protect individual trees from later defoliation because,can protect individual trees from later defoliation because,"Therefore,",our,goal,this,winter,is,to,establish,reliable,reliable
pregnant female moths are unable to get past the banding,pregnant female moths are unable to get past the banding,pregnant female moths are unable to get past the banding,pregnant female moths are unable to get past the banding,pregnant female moths are unable to get past the banding,pregnant female moths are unable to get past the banding,pregnant female moths are unable to get past the banding,pregnant female moths are unable to get past the banding,monitoring sites that are forested or contain enough trees to,monitoring sites that are forested or contain enough trees to,monitoring sites that are forested or contain enough trees to,monitoring sites that are forested or contain enough trees to,monitoring sites that are forested or contain enough trees to,monitoring sites that are forested or contain enough trees to,monitoring sites that are forested or contain enough trees to,monitoring sites that are forested or contain enough trees to,monitoring sites that are forested or contain enough trees to,monitoring sites that are forested or contain enough trees to
,,,,,,,,band 10 to 20 oaks in areas that have seen fall cankerworm,band 10 to 20 oaks in areas that have seen fall cankerworm,band 10 to 20 oaks in areas that have seen fall cankerworm,band 10 to 20 oaks in areas that have seen fall cankerworm,band 10 to 20 oaks in areas that have seen fall cankerworm,band 10 to 20 oaks in areas that have seen fall cankerworm,band 10 to 20 oaks in areas that have seen fall cankerworm,band 10 to 20 oaks in areas that have seen fall cankerworm,band 10 to 20 oaks in areas that have seen fall cankerworm,band 10 to 20 oaks in areas that have seen fall cankerworm
,,,,,,,,activity in the past. Preferably we would return to these same,activity in the past. Preferably we would return to these same,activity in the past. Preferably we would return to these same,activity in the past. Preferably we would return to these same,activity in the past. Preferably we would return to these same,activity in the past. Preferably we would return to these same,activity in the past. Preferably we would return to these same,activity in the past. Preferably we would return to these same,activity in the past. Preferably we would return to these same,activity in the past. Preferably we would return to these same
,,,,,,,,"sites each year, or at least regularly, to repeat the process. We","sites each year, or at least regularly, to repeat the process. We","sites each year, or at least regularly, to repeat the process. We","sites each year, or at least regularly, to repeat the process. We","sites each year, or at least regularly, to repeat the process. We","sites each year, or at least regularly, to repeat the process. We","sites each year, or at least regularly, to repeat the process. We","sites each year, or at least regularly, to repeat the process. We","sites each year, or at least regularly, to repeat the process. We","sites each year, or at least regularly, to repeat the process. We"
,,,,,,,,would start by obtaining coordinates and placing flagging,would start by obtaining coordinates and placing flagging,would start by obtaining coordinates and placing flagging,would start by obtaining coordinates and placing flagging,would start by obtaining coordinates and placing flagging,would start by obtaining coordinates and placing flagging,would start by obtaining coordinates and placing flagging,would start by obtaining coordinates and placing flagging,would start by obtaining coordinates and placing flagging,would start by obtaining coordinates and placing flagging
,,,,,,,,around each tree we intend to band in the fall. Once this,around each tree we intend to band in the fall. Once this,around each tree we intend to band in the fall. Once this,around each tree we intend to band in the fall. Once this,around each tree we intend to band in the fall. Once this,around each tree we intend to band in the fall. Once this,around each tree we intend to band in the fall. Once this,around each tree we intend to band in the fall. Once this,around each tree we intend to band in the fall. Once this,around each tree we intend to band in the fall. Once this
,,,,,,,,"is done, a contractor will come out in December to apply","is done, a contractor will come out in December to apply","is done, a contractor will come out in December to apply","is done, a contractor will come out in December to apply","is done, a contractor will come out in December to apply","is done, a contractor will come out in December to apply","is done, a contractor will come out in December to apply","is done, a contractor will come out in December to apply","is done, a contractor will come out in December to apply","is done, a contractor will come out in December to apply"
,,,,,,,,the sticky bands. Moth counts will be obtained by VDOF,the sticky bands. Moth counts will be obtained by VDOF,the sticky bands. Moth counts will be obtained by VDOF,the sticky bands. Moth counts will be obtained by VDOF,the sticky bands. Moth counts will be obtained by VDOF,the sticky bands. Moth counts will be obtained by VDOF,the sticky bands. Moth counts will be obtained by VDOF,the sticky bands. Moth counts will be obtained by VDOF,the sticky bands. Moth counts will be obtained by VDOF,the sticky bands. Moth counts will be obtained by VDOF
,,,,,,,,"personnel in January and February, and the contractor will","personnel in January and February, and the contractor will","personnel in January and February, and the contractor will","personnel in January and February, and the contractor will","personnel in January and February, and the contractor will","personnel in January and February, and the contractor will","personnel in January and February, and the contractor will","personnel in January and February, and the contractor will","personnel in January and February, and the contractor will","personnel in January and February, and the contractor will"
,,,,,,,,return to remove the sticky bands in April. If we do this in,return to remove the sticky bands in April. If we do this in,return to remove the sticky bands in April. If we do this in,return to remove the sticky bands in April. If we do this in,return to remove the sticky bands in April. If we do this in,return to remove the sticky bands in April. If we do this in,return to remove the sticky bands in April. If we do this in,return to remove the sticky bands in April. If we do this in,return to remove the sticky bands in April. If we do this in,return to remove the sticky bands in April. If we do this in
,,,,,,,,"enough places over multiple counties, we will hopefully","enough places over multiple counties, we will hopefully","enough places over multiple counties, we will hopefully","enough places over multiple counties, we will hopefully","enough places over multiple counties, we will hopefully","enough places over multiple counties, we will hopefully","enough places over multiple counties, we will hopefully","enough places over multiple counties, we will hopefully","enough places over multiple counties, we will hopefully","enough places over multiple counties, we will hopefully"
,,,,,,,,have enough data to obtain a general idea of what defoliation,have enough data to obtain a general idea of what defoliation,have enough data to obtain a general idea of what defoliation,have enough data to obtain a general idea of what defoliation,have enough data to obtain a general idea of what defoliation,have enough data to obtain a general idea of what defoliation,have enough data to obtain a general idea of what defoliation,have enough data to obtain a general idea of what defoliation,have enough data to obtain a general idea of what defoliation,have enough data to obtain a general idea of what defoliation
,,,,,,,,"levels we can expect regionally. In addition, specimen oak","levels we can expect regionally. In addition, specimen oak","levels we can expect regionally. In addition, specimen oak","levels we can expect regionally. In addition, specimen oak","levels we can expect regionally. In addition, specimen oak","levels we can expect regionally. In addition, specimen oak","levels we can expect regionally. In addition, specimen oak","levels we can expect regionally. In addition, specimen oak","levels we can expect regionally. In addition, specimen oak","levels we can expect regionally. In addition, specimen oak"
,,,,,,,,trees that are banded will be protected from cankerworm,trees that are banded will be protected from cankerworm,trees that are banded will be protected from cankerworm,trees that are banded will be protected from cankerworm,trees that are banded will be protected from cankerworm,trees that are banded will be protected from cankerworm,trees that are banded will be protected from cankerworm,trees that are banded will be protected from cankerworm,trees that are banded will be protected from cankerworm,trees that are banded will be protected from cankerworm
,,,,,,,,defoliation,even,if,localized,populations,populations,populations,end,up,being
,,,,,,,,"significant. We will use government (state, county and city)","significant. We will use government (state, county and city)","significant. We will use government (state, county and city)","significant. We will use government (state, county and city)","significant. We will use government (state, county and city)","significant. We will use government (state, county and city)","significant. We will use government (state, county and city)","significant. We will use government (state, county and city)","significant. We will use government (state, county and city)","significant. We will use government (state, county and city)"
,,,,,,,,lands that are relatively out of the way and are reliable sites,lands that are relatively out of the way and are reliable sites,lands that are relatively out of the way and are reliable sites,lands that are relatively out of the way and are reliable sites,lands that are relatively out of the way and are reliable sites,lands that are relatively out of the way and are reliable sites,lands that are relatively out of the way and are reliable sites,lands that are relatively out of the way and are reliable sites,lands that are relatively out of the way and are reliable sites,lands that are relatively out of the way and are reliable sites
,,,,,,,,to return to year after year. While banding is proven to be,to return to year after year. While banding is proven to be,to return to year after year. While banding is proven to be,to return to year after year. While banding is proven to be,to return to year after year. While banding is proven to be,to return to year after year. While banding is proven to be,to return to year after year. While banding is proven to be,to return to year after year. While banding is proven to be,to return to year after year. While banding is proven to be,to return to year after year. While banding is proven to be
,,,,,,,,"somewhat effective for this purpose locally, it’s not been","somewhat effective for this purpose locally, it’s not been","somewhat effective for this purpose locally, it’s not been","somewhat effective for this purpose locally, it’s not been","somewhat effective for this purpose locally, it’s not been","somewhat effective for this purpose locally, it’s not been","somewhat effective for this purpose locally, it’s not been","somewhat effective for this purpose locally, it’s not been","somewhat effective for this purpose locally, it’s not been","somewhat effective for this purpose locally, it’s not been"
,,,,,,,,widely tested for population monitoring on the scale of five,widely tested for population monitoring on the scale of five,widely tested for population monitoring on the scale of five,widely tested for population monitoring on the scale of five,widely tested for population monitoring on the scale of five,widely tested for population monitoring on the scale of five,widely tested for population monitoring on the scale of five,widely tested for population monitoring on the scale of five,widely tested for population monitoring on the scale of five,widely tested for population monitoring on the scale of five
,,,,,,,,"counties, so this is an experiment. Stay tuned for further","counties, so this is an experiment. Stay tuned for further","counties, so this is an experiment. Stay tuned for further","counties, so this is an experiment. Stay tuned for further","counties, so this is an experiment. Stay tuned for further","counties, so this is an experiment. Stay tuned for further","counties, so this is an experiment. Stay tuned for further","counties, so this is an experiment. Stay tuned for further","counties, so this is an experiment. Stay tuned for further","counties, so this is an experiment. Stay tuned for further"
,,,,,,,,updates and results.,updates and results.,updates and results.,,,,,,,
4,,,,,,,,,,,,,,,,,
Weather,Weather,Weather,,,,,,,,,,,,
2013 was the first year I can remember in a long time where,2013 was the first year I can remember in a long time where,2013 was the first year I can remember in a long time where,2013 was the first year I can remember in a long time where,2013 was the first year I can remember in a long time where,2013 was the first year I can remember in a long time where,2013 was the first year I can remember in a long time where,moderate to even a little bit on the cool side. July felt like,moderate to even a little bit on the cool side. July felt like,moderate to even a little bit on the cool side. July felt like,moderate to even a little bit on the cool side. July felt like,moderate to even a little bit on the cool side. July felt like,moderate to even a little bit on the cool side. July felt like,moderate to even a little bit on the cool side. July felt like,moderate to even a little bit on the cool side. July felt like
we saw no extreme weather events. Other than a couple of,we saw no extreme weather events. Other than a couple of,we saw no extreme weather events. Other than a couple of,we saw no extreme weather events. Other than a couple of,we saw no extreme weather events. Other than a couple of,we saw no extreme weather events. Other than a couple of,we saw no extreme weather events. Other than a couple of,"June, August like September and September like October.","June, August like September and September like October.","June, August like September and September like October.","June, August like September and September like October.","June, August like September and September like October.","June, August like September and September like October.","June, August like September and September like October.","June, August like September and September like October."
late frosts in May that may have had an impact on this year’s,late frosts in May that may have had an impact on this year’s,late frosts in May that may have had an impact on this year’s,late frosts in May that may have had an impact on this year’s,late frosts in May that may have had an impact on this year’s,late frosts in May that may have had an impact on this year’s,late frosts in May that may have had an impact on this year’s,"All in all, except for the scarcity of the sun, it was rather","All in all, except for the scarcity of the sun, it was rather","All in all, except for the scarcity of the sun, it was rather","All in all, except for the scarcity of the sun, it was rather","All in all, except for the scarcity of the sun, it was rather","All in all, except for the scarcity of the sun, it was rather","All in all, except for the scarcity of the sun, it was rather","All in all, except for the scarcity of the sun, it was rather"
"mast crop, there were few, if any, tornadoes or hail storms; no","mast crop, there were few, if any, tornadoes or hail storms; no","mast crop, there were few, if any, tornadoes or hail storms; no","mast crop, there were few, if any, tornadoes or hail storms; no","mast crop, there were few, if any, tornadoes or hail storms; no","mast crop, there were few, if any, tornadoes or hail storms; no","mast crop, there were few, if any, tornadoes or hail storms; no","pleasant! Things started to dry out a bit during autumn, but it","pleasant! Things started to dry out a bit during autumn, but it","pleasant! Things started to dry out a bit during autumn, but it","pleasant! Things started to dry out a bit during autumn, but it","pleasant! Things started to dry out a bit during autumn, but it","pleasant! Things started to dry out a bit during autumn, but it","pleasant! Things started to dry out a bit during autumn, but it","pleasant! Things started to dry out a bit during autumn, but it"
"hurricanes or tropical systems; no micro-bursts or derecho’s,","hurricanes or tropical systems; no micro-bursts or derecho’s,","hurricanes or tropical systems; no micro-bursts or derecho’s,","hurricanes or tropical systems; no micro-bursts or derecho’s,","hurricanes or tropical systems; no micro-bursts or derecho’s,","hurricanes or tropical systems; no micro-bursts or derecho’s,","hurricanes or tropical systems; no micro-bursts or derecho’s,",also got cold early and we saw enough rain here and there,also got cold early and we saw enough rain here and there,also got cold early and we saw enough rain here and there,also got cold early and we saw enough rain here and there,also got cold early and we saw enough rain here and there,also got cold early and we saw enough rain here and there,also got cold early and we saw enough rain here and there,also got cold early and we saw enough rain here and there
and no drought or excessive flooding. We did see an unusual,and no drought or excessive flooding. We did see an unusual,and no drought or excessive flooding. We did see an unusual,and no drought or excessive flooding. We did see an unusual,and no drought or excessive flooding. We did see an unusual,and no drought or excessive flooding. We did see an unusual,and no drought or excessive flooding. We did see an unusual,that there were no major fire emergencies.,that there were no major fire emergencies.,that there were no major fire emergencies.,that there were no major fire emergencies.,that there were no major fire emergencies.,that there were no major fire emergencies.,,
