in the U.S. and South America have been approached about,in the U.S. and South America have been approached about,in the U.S. and South America have been approached about,in the U.S. and South America have been approached about,in the U.S. and South America have been approached about,in the U.S. and South America have been approached about,in the U.S. and South America have been approached about,assessing trees in a large number of diallel tests (268 test,assessing trees in a large number of diallel tests (268 test,assessing trees in a large number of diallel tests (268 test,assessing trees in a large number of diallel tests (268 test,assessing trees in a large number of diallel tests (268 test,assessing trees in a large number of diallel tests (268 test,assessing trees in a large number of diallel tests (268 test,assessing trees in a large number of diallel tests (268 test
"joining the FMRC. It is anticipated that, over the next two to","joining the FMRC. It is anticipated that, over the next two to","joining the FMRC. It is anticipated that, over the next two to","joining the FMRC. It is anticipated that, over the next two to","joining the FMRC. It is anticipated that, over the next two to","joining the FMRC. It is anticipated that, over the next two to","joining the FMRC. It is anticipated that, over the next two to","series, ~1,000 tests in the 2 nd -generation testing program) and","series, ~1,000 tests in the 2 nd -generation testing program) and","series, ~1,000 tests in the 2 nd -generation testing program) and","series, ~1,000 tests in the 2 nd -generation testing program) and","series, ~1,000 tests in the 2 nd -generation testing program) and","series, ~1,000 tests in the 2 nd -generation testing program) and","series, ~1,000 tests in the 2 nd -generation testing program) and","series, ~1,000 tests in the 2 nd -generation testing program) and"
"three years, several new members will join the Co-op.","three years, several new members will join the Co-op.","three years, several new members will join the Co-op.","three years, several new members will join the Co-op.","three years, several new members will join the Co-op.","three years, several new members will join the Co-op.","three years, several new members will join the Co-op.",in a clonal test of MeadWestvaco in South Carolina. By using,in a clonal test of MeadWestvaco in South Carolina. By using,in a clonal test of MeadWestvaco in South Carolina. By using,in a clonal test of MeadWestvaco in South Carolina. By using,in a clonal test of MeadWestvaco in South Carolina. By using,in a clonal test of MeadWestvaco in South Carolina. By using,in a clonal test of MeadWestvaco in South Carolina. By using,in a clonal test of MeadWestvaco in South Carolina. By using
,,,,,,,"family selection with a selection differential of 20 percent,","family selection with a selection differential of 20 percent,","family selection with a selection differential of 20 percent,","family selection with a selection differential of 20 percent,","family selection with a selection differential of 20 percent,","family selection with a selection differential of 20 percent,","family selection with a selection differential of 20 percent,","family selection with a selection differential of 20 percent,"
Forest Nutrition,Forest Nutrition,Forest Nutrition,Forest Nutrition,,,,forking could be reduced 12 percent to 23 percent across,forking could be reduced 12 percent to 23 percent across,forking could be reduced 12 percent to 23 percent across,forking could be reduced 12 percent to 23 percent across,forking could be reduced 12 percent to 23 percent across,forking could be reduced 12 percent to 23 percent across,forking could be reduced 12 percent to 23 percent across,forking could be reduced 12 percent to 23 percent across
Cooperative,Cooperative,Cooperative,,,,,the different regions of the Cooperative. A single-marker,the different regions of the Cooperative. A single-marker,the different regions of the Cooperative. A single-marker,the different regions of the Cooperative. A single-marker,the different regions of the Cooperative. A single-marker,the different regions of the Cooperative. A single-marker,the different regions of the Cooperative. A single-marker,the different regions of the Cooperative. A single-marker
,,,,,,,"analysis of 1,257 loci identified 11 and nine markers that","analysis of 1,257 loci identified 11 and nine markers that","analysis of 1,257 loci identified 11 and nine markers that","analysis of 1,257 loci identified 11 and nine markers that","analysis of 1,257 loci identified 11 and nine markers that","analysis of 1,257 loci identified 11 and nine markers that","analysis of 1,257 loci identified 11 and nine markers that","analysis of 1,257 loci identified 11 and nine markers that"
(www.forestnutrition.org),(www.forestnutrition.org),(www.forestnutrition.org),,,,,were significantly associated with stem forking and ramicorn,were significantly associated with stem forking and ramicorn,were significantly associated with stem forking and ramicorn,were significantly associated with stem forking and ramicorn,were significantly associated with stem forking and ramicorn,were significantly associated with stem forking and ramicorn,were significantly associated with stem forking and ramicorn,were significantly associated with stem forking and ramicorn
,,,,,,,"branching, respectively.","branching, respectively.","branching, respectively.",,,,,
A recent article 1 in Biomass and Bioenergy summarized the,A recent article 1 in Biomass and Bioenergy summarized the,A recent article 1 in Biomass and Bioenergy summarized the,A recent article 1 in Biomass and Bioenergy summarized the,A recent article 1 in Biomass and Bioenergy summarized the,A recent article 1 in Biomass and Bioenergy summarized the,A recent article 1 in Biomass and Bioenergy summarized the,,,,,,,,
potential for pine plantations in the South to provide woody,potential for pine plantations in the South to provide woody,potential for pine plantations in the South to provide woody,potential for pine plantations in the South to provide woody,potential for pine plantations in the South to provide woody,potential for pine plantations in the South to provide woody,potential for pine plantations in the South to provide woody,In a study looking at physiological variation in different,In a study looking at physiological variation in different,In a study looking at physiological variation in different,In a study looking at physiological variation in different,In a study looking at physiological variation in different,In a study looking at physiological variation in different,In a study looking at physiological variation in different,In a study looking at physiological variation in different
"biomass. In the near future, wood from the 32 million acres","biomass. In the near future, wood from the 32 million acres","biomass. In the near future, wood from the 32 million acres","biomass. In the near future, wood from the 32 million acres","biomass. In the near future, wood from the 32 million acres","biomass. In the near future, wood from the 32 million acres","biomass. In the near future, wood from the 32 million acres","loblolly pine genotypes, results provided little support of the","loblolly pine genotypes, results provided little support of the","loblolly pine genotypes, results provided little support of the","loblolly pine genotypes, results provided little support of the","loblolly pine genotypes, results provided little support of the","loblolly pine genotypes, results provided little support of the","loblolly pine genotypes, results provided little support of the","loblolly pine genotypes, results provided little support of the"
of pine plantations in the southern U.S. could be called on,of pine plantations in the southern U.S. could be called on,of pine plantations in the southern U.S. could be called on,of pine plantations in the southern U.S. could be called on,of pine plantations in the southern U.S. could be called on,of pine plantations in the southern U.S. could be called on,of pine plantations in the southern U.S. could be called on,hypothesis that more genetically homogeneous individuals,hypothesis that more genetically homogeneous individuals,hypothesis that more genetically homogeneous individuals,hypothesis that more genetically homogeneous individuals,hypothesis that more genetically homogeneous individuals,hypothesis that more genetically homogeneous individuals,hypothesis that more genetically homogeneous individuals,hypothesis that more genetically homogeneous individuals
as a source of feedstock for emerging bioenergy industries.,as a source of feedstock for emerging bioenergy industries.,as a source of feedstock for emerging bioenergy industries.,as a source of feedstock for emerging bioenergy industries.,as a source of feedstock for emerging bioenergy industries.,as a source of feedstock for emerging bioenergy industries.,as a source of feedstock for emerging bioenergy industries.,"would show greater uniformity in a plantation setting, at","would show greater uniformity in a plantation setting, at","would show greater uniformity in a plantation setting, at","would show greater uniformity in a plantation setting, at","would show greater uniformity in a plantation setting, at","would show greater uniformity in a plantation setting, at","would show greater uniformity in a plantation setting, at","would show greater uniformity in a plantation setting, at"
Intensive management of southern U.S. pine plantations,Intensive management of southern U.S. pine plantations,Intensive management of southern U.S. pine plantations,Intensive management of southern U.S. pine plantations,Intensive management of southern U.S. pine plantations,Intensive management of southern U.S. pine plantations,Intensive management of southern U.S. pine plantations,"least not in the first three years. Also, differences in biomass","least not in the first three years. Also, differences in biomass","least not in the first three years. Also, differences in biomass","least not in the first three years. Also, differences in biomass","least not in the first three years. Also, differences in biomass","least not in the first three years. Also, differences in biomass","least not in the first three years. Also, differences in biomass","least not in the first three years. Also, differences in biomass"
could,significantly,increase,the,amount,of,biomass,partitioning may be partially related to genetic differences,partitioning may be partially related to genetic differences,partitioning may be partially related to genetic differences,partitioning may be partially related to genetic differences,partitioning may be partially related to genetic differences,partitioning may be partially related to genetic differences,partitioning may be partially related to genetic differences,partitioning may be partially related to genetic differences
available to supply bioenergy firms. Studies and operational,available to supply bioenergy firms. Studies and operational,available to supply bioenergy firms. Studies and operational,available to supply bioenergy firms. Studies and operational,available to supply bioenergy firms. Studies and operational,available to supply bioenergy firms. Studies and operational,available to supply bioenergy firms. Studies and operational,"in productivity, but actual height and ground-line diameter","in productivity, but actual height and ground-line diameter","in productivity, but actual height and ground-line diameter","in productivity, but actual height and ground-line diameter","in productivity, but actual height and ground-line diameter","in productivity, but actual height and ground-line diameter","in productivity, but actual height and ground-line diameter","in productivity, but actual height and ground-line diameter"
experience,have,shown,that,total,plantation,biomass,growth rate over time was the best indicator of productivity.,growth rate over time was the best indicator of productivity.,growth rate over time was the best indicator of productivity.,growth rate over time was the best indicator of productivity.,growth rate over time was the best indicator of productivity.,growth rate over time was the best indicator of productivity.,growth rate over time was the best indicator of productivity.,growth rate over time was the best indicator of productivity.
productivity exceeding 10 tons per acre per year on a green,productivity exceeding 10 tons per acre per year on a green,productivity exceeding 10 tons per acre per year on a green,productivity exceeding 10 tons per acre per year on a green,productivity exceeding 10 tons per acre per year on a green,productivity exceeding 10 tons per acre per year on a green,productivity exceeding 10 tons per acre per year on a green,,,,,,,,
weight basis with rotations less than 25 years is biologically,weight basis with rotations less than 25 years is biologically,weight basis with rotations less than 25 years is biologically,weight basis with rotations less than 25 years is biologically,weight basis with rotations less than 25 years is biologically,weight basis with rotations less than 25 years is biologically,weight basis with rotations less than 25 years is biologically,,,,,,,,
1,"John F. Munsell, Thomas R. Fox, An analysis of the feasibility for increas-","John F. Munsell, Thomas R. Fox, An analysis of the feasibility for increas-","John F. Munsell, Thomas R. Fox, An analysis of the feasibility for increas-","John F. Munsell, Thomas R. Fox, An analysis of the feasibility for increas-","John F. Munsell, Thomas R. Fox, An analysis of the feasibility for increas-","John F. Munsell, Thomas R. Fox, An analysis of the feasibility for increas-",,,,,,,,
ing woody biomass production from pine plantations in the southern,ing woody biomass production from pine plantations in the southern,ing woody biomass production from pine plantations in the southern,ing woody biomass production from pine plantations in the southern,ing woody biomass production from pine plantations in the southern,ing woody biomass production from pine plantations in the southern,ing woody biomass production from pine plantations in the southern,,,,,,,,
"United States, Biomass and Bioenergy (2010), doi:10.1016/j.","United States, Biomass and Bioenergy (2010), doi:10.1016/j.","United States, Biomass and Bioenergy (2010), doi:10.1016/j.","United States, Biomass and Bioenergy (2010), doi:10.1016/j.","United States, Biomass and Bioenergy (2010), doi:10.1016/j.","United States, Biomass and Bioenergy (2010), doi:10.1016/j.",,,,,,,,,
biombioe.2010.05.009,biombioe.2010.05.009,,,,,,,,,,,,,
,,,,,,,,,,,,,,3
Pine Silviculture,Pine Silviculture,Pine Silviculture,Pine Silviculture,Pine Silviculture,Pine Silviculture,Pine Silviculture,Pine Silviculture,Pine Silviculture,Pine Silviculture,Pine Silviculture,,,,
Comparing Biosolids to Traditional Fertilizers,Comparing Biosolids to Traditional Fertilizers,Comparing Biosolids to Traditional Fertilizers,Comparing Biosolids to Traditional Fertilizers,Comparing Biosolids to Traditional Fertilizers,Comparing Biosolids to Traditional Fertilizers,Comparing Biosolids to Traditional Fertilizers,Comparing Biosolids to Traditional Fertilizers,Comparing Biosolids to Traditional Fertilizers,Comparing Biosolids to Traditional Fertilizers,Comparing Biosolids to Traditional Fertilizers,Comparing Biosolids to Traditional Fertilizers,Comparing Biosolids to Traditional Fertilizers,Comparing Biosolids to Traditional Fertilizers,Comparing Biosolids to Traditional Fertilizers
for Loblolly Pine,for Loblolly Pine,for Loblolly Pine,for Loblolly Pine,for Loblolly Pine,for Loblolly Pine,for Loblolly Pine,for Loblolly Pine,,,,,,,
Interest in using biosolids (solid or liquid materials,Interest in using biosolids (solid or liquid materials,Interest in using biosolids (solid or liquid materials,Interest in using biosolids (solid or liquid materials,Interest in using biosolids (solid or liquid materials,Interest in using biosolids (solid or liquid materials,Interest in using biosolids (solid or liquid materials,Interest in using biosolids (solid or liquid materials,Interest in using biosolids (solid or liquid materials,Interest in using biosolids (solid or liquid materials,"in diameter (by 40 percent in 2009 – Table 1). Statistically, all three","in diameter (by 40 percent in 2009 – Table 1). Statistically, all three","in diameter (by 40 percent in 2009 – Table 1). Statistically, all three","in diameter (by 40 percent in 2009 – Table 1). Statistically, all three","in diameter (by 40 percent in 2009 – Table 1). Statistically, all three"
produced from the treatment of municipal sewage,produced from the treatment of municipal sewage,produced from the treatment of municipal sewage,produced from the treatment of municipal sewage,produced from the treatment of municipal sewage,produced from the treatment of municipal sewage,produced from the treatment of municipal sewage,produced from the treatment of municipal sewage,produced from the treatment of municipal sewage,produced from the treatment of municipal sewage,"nutrient sources are producing similar growth responses, and all","nutrient sources are producing similar growth responses, and all","nutrient sources are producing similar growth responses, and all","nutrient sources are producing similar growth responses, and all","nutrient sources are producing similar growth responses, and all"
sludge) as fertilizers in forest stands has increased in,sludge) as fertilizers in forest stands has increased in,sludge) as fertilizers in forest stands has increased in,sludge) as fertilizers in forest stands has increased in,sludge) as fertilizers in forest stands has increased in,sludge) as fertilizers in forest stands has increased in,sludge) as fertilizers in forest stands has increased in,sludge) as fertilizers in forest stands has increased in,sludge) as fertilizers in forest stands has increased in,sludge) as fertilizers in forest stands has increased in,three are significantly outgrowing the untreated plots in terms of,three are significantly outgrowing the untreated plots in terms of,three are significantly outgrowing the untreated plots in terms of,three are significantly outgrowing the untreated plots in terms of,three are significantly outgrowing the untreated plots in terms of
"recent years. Beginning in October 2006, the VDOF","recent years. Beginning in October 2006, the VDOF","recent years. Beginning in October 2006, the VDOF","recent years. Beginning in October 2006, the VDOF","recent years. Beginning in October 2006, the VDOF","recent years. Beginning in October 2006, the VDOF","recent years. Beginning in October 2006, the VDOF","recent years. Beginning in October 2006, the VDOF","recent years. Beginning in October 2006, the VDOF","recent years. Beginning in October 2006, the VDOF",diameter. The difference has been greater with each succeeding,diameter. The difference has been greater with each succeeding,diameter. The difference has been greater with each succeeding,diameter. The difference has been greater with each succeeding,diameter. The difference has been greater with each succeeding
research team installed a study to compare the effects,research team installed a study to compare the effects,research team installed a study to compare the effects,research team installed a study to compare the effects,research team installed a study to compare the effects,research team installed a study to compare the effects,research team installed a study to compare the effects,research team installed a study to compare the effects,research team installed a study to compare the effects,research team installed a study to compare the effects,year (Figure 1). Although there is a trend of increasing height growth,year (Figure 1). Although there is a trend of increasing height growth,year (Figure 1). Although there is a trend of increasing height growth,year (Figure 1). Although there is a trend of increasing height growth,year (Figure 1). Although there is a trend of increasing height growth
of,biosolid,biosolid,applications,applications,and,traditional,traditional,inorganic,inorganic,"on the fertilized plots, the data are not statistically significant so we","on the fertilized plots, the data are not statistically significant so we","on the fertilized plots, the data are not statistically significant so we","on the fertilized plots, the data are not statistically significant so we","on the fertilized plots, the data are not statistically significant so we"
fertilizer (urea + diammonium phosphate [DAP]) on,fertilizer (urea + diammonium phosphate [DAP]) on,fertilizer (urea + diammonium phosphate [DAP]) on,fertilizer (urea + diammonium phosphate [DAP]) on,fertilizer (urea + diammonium phosphate [DAP]) on,fertilizer (urea + diammonium phosphate [DAP]) on,fertilizer (urea + diammonium phosphate [DAP]) on,fertilizer (urea + diammonium phosphate [DAP]) on,fertilizer (urea + diammonium phosphate [DAP]) on,fertilizer (urea + diammonium phosphate [DAP]) on,can say only that height has been neither harmed nor enhanced,can say only that height has been neither harmed nor enhanced,can say only that height has been neither harmed nor enhanced,can say only that height has been neither harmed nor enhanced,can say only that height has been neither harmed nor enhanced
the growth of thinned mid-rotation loblolly pine.,the growth of thinned mid-rotation loblolly pine.,the growth of thinned mid-rotation loblolly pine.,the growth of thinned mid-rotation loblolly pine.,the growth of thinned mid-rotation loblolly pine.,the growth of thinned mid-rotation loblolly pine.,the growth of thinned mid-rotation loblolly pine.,the growth of thinned mid-rotation loblolly pine.,the growth of thinned mid-rotation loblolly pine.,,"by the treatments. Taken together, the diameter and height translate","by the treatments. Taken together, the diameter and height translate","by the treatments. Taken together, the diameter and height translate","by the treatments. Taken together, the diameter and height translate","by the treatments. Taken together, the diameter and height translate"
,,,,,,,,,,into a 12 percent increase in average total volume (outside bark) of,into a 12 percent increase in average total volume (outside bark) of,into a 12 percent increase in average total volume (outside bark) of,into a 12 percent increase in average total volume (outside bark) of,into a 12 percent increase in average total volume (outside bark) of
In summary:,In summary:,In summary:,,,,,,,,the treated trees.,the treated trees.,,,
,•,Plots were installed in western Essex County,Plots were installed in western Essex County,Plots were installed in western Essex County,Plots were installed in western Essex County,Plots were installed in western Essex County,Plots were installed in western Essex County,Plots were installed in western Essex County,Plots were installed in western Essex County,"From these data, we can conclude that 1) nutrient additions as either","From these data, we can conclude that 1) nutrient additions as either","From these data, we can conclude that 1) nutrient additions as either","From these data, we can conclude that 1) nutrient additions as either","From these data, we can conclude that 1) nutrient additions as either"
,,in a mid-rotation loblolly pine stand thinned,in a mid-rotation loblolly pine stand thinned,in a mid-rotation loblolly pine stand thinned,in a mid-rotation loblolly pine stand thinned,in a mid-rotation loblolly pine stand thinned,in a mid-rotation loblolly pine stand thinned,in a mid-rotation loblolly pine stand thinned,in a mid-rotation loblolly pine stand thinned,biosolids or traditional inorganic fertilizer have been beneficial to,biosolids or traditional inorganic fertilizer have been beneficial to,biosolids or traditional inorganic fertilizer have been beneficial to,biosolids or traditional inorganic fertilizer have been beneficial to,biosolids or traditional inorganic fertilizer have been beneficial to
,,in the summer of 2006.,in the summer of 2006.,in the summer of 2006.,in the summer of 2006.,,,,,"tree growth, and 2) there is no evidence to date of any negative","tree growth, and 2) there is no evidence to date of any negative","tree growth, and 2) there is no evidence to date of any negative","tree growth, and 2) there is no evidence to date of any negative","tree growth, and 2) there is no evidence to date of any negative"
,•,The,experimental,experimental,design,is,a,randomized,randomized,effects of the biosolids on loblolly pine growth or vigor.,effects of the biosolids on loblolly pine growth or vigor.,effects of the biosolids on loblolly pine growth or vigor.,effects of the biosolids on loblolly pine growth or vigor.,effects of the biosolids on loblolly pine growth or vigor.
,,complete,complete,block,with,four,,replications,replications,,,,,
,,using 0.25-acre treatment plots; trees were,using 0.25-acre treatment plots; trees were,using 0.25-acre treatment plots; trees were,using 0.25-acre treatment plots; trees were,using 0.25-acre treatment plots; trees were,using 0.25-acre treatment plots; trees were,using 0.25-acre treatment plots; trees were,using 0.25-acre treatment plots; trees were,,,,,
,,measured on the interior 0.1 acres of each,measured on the interior 0.1 acres of each,measured on the interior 0.1 acres of each,measured on the interior 0.1 acres of each,measured on the interior 0.1 acres of each,measured on the interior 0.1 acres of each,measured on the interior 0.1 acres of each,measured on the interior 0.1 acres of each,,,,,
,,plot.,plot.,,,,,,,,,,,
