V I RGI NIA,
Forest,
Research Review,Research Review
,October 2010
"Competing hardwoods surround a 4-year-old loblolly pine on an untreated plot (left), while the pines (also","Competing hardwoods surround a 4-year-old loblolly pine on an untreated plot (left), while the pines (also"
age 4) thrive on a plot sprayed the October prior to planting with Chopper at 40 ounces/acre (right).,age 4) thrive on a plot sprayed the October prior to planting with Chopper at 40 ounces/acre (right).
In this issue...,
,Interplanting Loblolly Pine in Low-Density
Research Cooperatives,Plantations
Forest Modeling Research Cooperative,Loblolly Pine Growth for Five Years Following
Forest Nutrition Cooperative,Herbicide Release
Cooperative Tree Improvement Program,Loblolly Pine Growth Following Chemical Site
Pine Silviculture,Preparation Compared to Age Two Release
Comparing Biosolids to Traditional,Hardwood Silviculture
Fertilizers for Loblolly Pine,Effects of Establishment Methods and Initial
,Seedling Size on Early Northern Red Oak
,Performance
VDOF Research Program,VDOF Research Program,VDOF Research Program,VDOF Research Program,VDOF Research Program,VDOF Research Program,VDOF Research Program,VDOF Research Program,VDOF Research Program,,,
It’s time again for another update from the Virginia Department of Forestry’s,It’s time again for another update from the Virginia Department of Forestry’s,It’s time again for another update from the Virginia Department of Forestry’s,It’s time again for another update from the Virginia Department of Forestry’s,It’s time again for another update from the Virginia Department of Forestry’s,It’s time again for another update from the Virginia Department of Forestry’s,It’s time again for another update from the Virginia Department of Forestry’s,It’s time again for another update from the Virginia Department of Forestry’s,It’s time again for another update from the Virginia Department of Forestry’s,It’s time again for another update from the Virginia Department of Forestry’s,It’s time again for another update from the Virginia Department of Forestry’s,
Research Program – now in its 56 th,Research Program – now in its 56 th,Research Program – now in its 56 th,Research Program – now in its 56 th,Research Program – now in its 56 th,Research Program – now in its 56 th,"year. Every now and then, I pause to","year. Every now and then, I pause to","year. Every now and then, I pause to","year. Every now and then, I pause to","year. Every now and then, I pause to",
"think about all the changes in forestry over the last 50+ years, and in the","think about all the changes in forestry over the last 50+ years, and in the","think about all the changes in forestry over the last 50+ years, and in the","think about all the changes in forestry over the last 50+ years, and in the","think about all the changes in forestry over the last 50+ years, and in the","think about all the changes in forestry over the last 50+ years, and in the","think about all the changes in forestry over the last 50+ years, and in the","think about all the changes in forestry over the last 50+ years, and in the","think about all the changes in forestry over the last 50+ years, and in the","think about all the changes in forestry over the last 50+ years, and in the","think about all the changes in forestry over the last 50+ years, and in the",
years to come. How does research fit into the long-term conservation and,years to come. How does research fit into the long-term conservation and,years to come. How does research fit into the long-term conservation and,years to come. How does research fit into the long-term conservation and,years to come. How does research fit into the long-term conservation and,years to come. How does research fit into the long-term conservation and,years to come. How does research fit into the long-term conservation and,years to come. How does research fit into the long-term conservation and,years to come. How does research fit into the long-term conservation and,years to come. How does research fit into the long-term conservation and,years to come. How does research fit into the long-term conservation and,
sustainability of our forests and all the products and services we demand,sustainability of our forests and all the products and services we demand,sustainability of our forests and all the products and services we demand,sustainability of our forests and all the products and services we demand,sustainability of our forests and all the products and services we demand,sustainability of our forests and all the products and services we demand,sustainability of our forests and all the products and services we demand,sustainability of our forests and all the products and services we demand,sustainability of our forests and all the products and services we demand,sustainability of our forests and all the products and services we demand,sustainability of our forests and all the products and services we demand,
from them?,from them?,from them?,,,,,,,,,
"If anything, it seems that the emerging markets for bioenergy and carbon","If anything, it seems that the emerging markets for bioenergy and carbon","If anything, it seems that the emerging markets for bioenergy and carbon","If anything, it seems that the emerging markets for bioenergy and carbon","If anything, it seems that the emerging markets for bioenergy and carbon","If anything, it seems that the emerging markets for bioenergy and carbon","If anything, it seems that the emerging markets for bioenergy and carbon","If anything, it seems that the emerging markets for bioenergy and carbon","If anything, it seems that the emerging markets for bioenergy and carbon","If anything, it seems that the emerging markets for bioenergy and carbon","If anything, it seems that the emerging markets for bioenergy and carbon",
sequestration combined with more stringent expectations for sustainable,sequestration combined with more stringent expectations for sustainable,sequestration combined with more stringent expectations for sustainable,sequestration combined with more stringent expectations for sustainable,sequestration combined with more stringent expectations for sustainable,sequestration combined with more stringent expectations for sustainable,sequestration combined with more stringent expectations for sustainable,sequestration combined with more stringent expectations for sustainable,sequestration combined with more stringent expectations for sustainable,sequestration combined with more stringent expectations for sustainable,sequestration combined with more stringent expectations for sustainable,"Jreersreea rCcrhe ipgrhotgorn,am"
and certifiable production systems for traditional forest products will tend,and certifiable production systems for traditional forest products will tend,and certifiable production systems for traditional forest products will tend,and certifiable production systems for traditional forest products will tend,and certifiable production systems for traditional forest products will tend,and certifiable production systems for traditional forest products will tend,and certifiable production systems for traditional forest products will tend,and certifiable production systems for traditional forest products will tend,and certifiable production systems for traditional forest products will tend,and certifiable production systems for traditional forest products will tend,and certifiable production systems for traditional forest products will tend,manager
to make forest research all the more important. We will need to learn to,to make forest research all the more important. We will need to learn to,to make forest research all the more important. We will need to learn to,to make forest research all the more important. We will need to learn to,to make forest research all the more important. We will need to learn to,to make forest research all the more important. We will need to learn to,to make forest research all the more important. We will need to learn to,to make forest research all the more important. We will need to learn to,to make forest research all the more important. We will need to learn to,to make forest research all the more important. We will need to learn to,to make forest research all the more important. We will need to learn to,
further increase yields from land devoted to production as forest biomass,further increase yields from land devoted to production as forest biomass,further increase yields from land devoted to production as forest biomass,further increase yields from land devoted to production as forest biomass,further increase yields from land devoted to production as forest biomass,further increase yields from land devoted to production as forest biomass,further increase yields from land devoted to production as forest biomass,further increase yields from land devoted to production as forest biomass,further increase yields from land devoted to production as forest biomass,further increase yields from land devoted to production as forest biomass,further increase yields from land devoted to production as forest biomass,
"is removed more frequently and more completely, yet we will also need to","is removed more frequently and more completely, yet we will also need to","is removed more frequently and more completely, yet we will also need to","is removed more frequently and more completely, yet we will also need to","is removed more frequently and more completely, yet we will also need to","is removed more frequently and more completely, yet we will also need to","is removed more frequently and more completely, yet we will also need to","is removed more frequently and more completely, yet we will also need to","is removed more frequently and more completely, yet we will also need to","is removed more frequently and more completely, yet we will also need to","is removed more frequently and more completely, yet we will also need to",
better understand how to protect those sites from nutrient depletion and soil,better understand how to protect those sites from nutrient depletion and soil,better understand how to protect those sites from nutrient depletion and soil,better understand how to protect those sites from nutrient depletion and soil,better understand how to protect those sites from nutrient depletion and soil,better understand how to protect those sites from nutrient depletion and soil,better understand how to protect those sites from nutrient depletion and soil,better understand how to protect those sites from nutrient depletion and soil,better understand how to protect those sites from nutrient depletion and soil,better understand how to protect those sites from nutrient depletion and soil,better understand how to protect those sites from nutrient depletion and soil,
disturbance. We’ll need to be able to predict tree growth and site responses,disturbance. We’ll need to be able to predict tree growth and site responses,disturbance. We’ll need to be able to predict tree growth and site responses,disturbance. We’ll need to be able to predict tree growth and site responses,disturbance. We’ll need to be able to predict tree growth and site responses,disturbance. We’ll need to be able to predict tree growth and site responses,disturbance. We’ll need to be able to predict tree growth and site responses,disturbance. We’ll need to be able to predict tree growth and site responses,disturbance. We’ll need to be able to predict tree growth and site responses,disturbance. We’ll need to be able to predict tree growth and site responses,disturbance. We’ll need to be able to predict tree growth and site responses,
"to conditions and practices different from any we’ve studied in the past, and","to conditions and practices different from any we’ve studied in the past, and","to conditions and practices different from any we’ve studied in the past, and","to conditions and practices different from any we’ve studied in the past, and","to conditions and practices different from any we’ve studied in the past, and","to conditions and practices different from any we’ve studied in the past, and","to conditions and practices different from any we’ve studied in the past, and","to conditions and practices different from any we’ve studied in the past, and","to conditions and practices different from any we’ve studied in the past, and","to conditions and practices different from any we’ve studied in the past, and","to conditions and practices different from any we’ve studied in the past, and",
to translate those predictions into financial options a landowner can use to,to translate those predictions into financial options a landowner can use to,to translate those predictions into financial options a landowner can use to,to translate those predictions into financial options a landowner can use to,to translate those predictions into financial options a landowner can use to,to translate those predictions into financial options a landowner can use to,to translate those predictions into financial options a landowner can use to,to translate those predictions into financial options a landowner can use to,to translate those predictions into financial options a landowner can use to,to translate those predictions into financial options a landowner can use to,to translate those predictions into financial options a landowner can use to,
"make decisions. If we are successful, conserving forestland will continue","make decisions. If we are successful, conserving forestland will continue","make decisions. If we are successful, conserving forestland will continue","make decisions. If we are successful, conserving forestland will continue","make decisions. If we are successful, conserving forestland will continue","make decisions. If we are successful, conserving forestland will continue","make decisions. If we are successful, conserving forestland will continue","make decisions. If we are successful, conserving forestland will continue","make decisions. If we are successful, conserving forestland will continue","make decisions. If we are successful, conserving forestland will continue","make decisions. If we are successful, conserving forestland will continue",
"to be an attractive option financially, as well as philosophically. All this","to be an attractive option financially, as well as philosophically. All this","to be an attractive option financially, as well as philosophically. All this","to be an attractive option financially, as well as philosophically. All this","to be an attractive option financially, as well as philosophically. All this","to be an attractive option financially, as well as philosophically. All this","to be an attractive option financially, as well as philosophically. All this","to be an attractive option financially, as well as philosophically. All this","to be an attractive option financially, as well as philosophically. All this","to be an attractive option financially, as well as philosophically. All this","to be an attractive option financially, as well as philosophically. All this",
comes at a time when changing land ownership and economic challenges,comes at a time when changing land ownership and economic challenges,comes at a time when changing land ownership and economic challenges,comes at a time when changing land ownership and economic challenges,comes at a time when changing land ownership and economic challenges,comes at a time when changing land ownership and economic challenges,comes at a time when changing land ownership and economic challenges,comes at a time when changing land ownership and economic challenges,comes at a time when changing land ownership and economic challenges,comes at a time when changing land ownership and economic challenges,comes at a time when changing land ownership and economic challenges,
have diminished the support for ongoing research while complicating the,have diminished the support for ongoing research while complicating the,have diminished the support for ongoing research while complicating the,have diminished the support for ongoing research while complicating the,have diminished the support for ongoing research while complicating the,have diminished the support for ongoing research while complicating the,have diminished the support for ongoing research while complicating the,have diminished the support for ongoing research while complicating the,have diminished the support for ongoing research while complicating the,have diminished the support for ongoing research while complicating the,have diminished the support for ongoing research while complicating the,"Wayne Bowman,"
all-important task of communicating new information to landowners and,all-important task of communicating new information to landowners and,all-important task of communicating new information to landowners and,all-important task of communicating new information to landowners and,all-important task of communicating new information to landowners and,all-important task of communicating new information to landowners and,all-important task of communicating new information to landowners and,all-important task of communicating new information to landowners and,all-important task of communicating new information to landowners and,all-important task of communicating new information to landowners and,all-important task of communicating new information to landowners and,research forester
applying it on the land. There is much work yet ahead of us.,applying it on the land. There is much work yet ahead of us.,applying it on the land. There is much work yet ahead of us.,applying it on the land. There is much work yet ahead of us.,applying it on the land. There is much work yet ahead of us.,applying it on the land. There is much work yet ahead of us.,applying it on the land. There is much work yet ahead of us.,applying it on the land. There is much work yet ahead of us.,applying it on the land. There is much work yet ahead of us.,,,
"In this issue, you’ll find information from several ongoing studies pertaining","In this issue, you’ll find information from several ongoing studies pertaining","In this issue, you’ll find information from several ongoing studies pertaining","In this issue, you’ll find information from several ongoing studies pertaining","In this issue, you’ll find information from several ongoing studies pertaining","In this issue, you’ll find information from several ongoing studies pertaining","In this issue, you’ll find information from several ongoing studies pertaining","In this issue, you’ll find information from several ongoing studies pertaining","In this issue, you’ll find information from several ongoing studies pertaining","In this issue, you’ll find information from several ongoing studies pertaining","In this issue, you’ll find information from several ongoing studies pertaining",
to loblolly pine: effects of biosolid applications on growth; response of,to loblolly pine: effects of biosolid applications on growth; response of,to loblolly pine: effects of biosolid applications on growth; response of,to loblolly pine: effects of biosolid applications on growth; response of,to loblolly pine: effects of biosolid applications on growth; response of,to loblolly pine: effects of biosolid applications on growth; response of,to loblolly pine: effects of biosolid applications on growth; response of,to loblolly pine: effects of biosolid applications on growth; response of,to loblolly pine: effects of biosolid applications on growth; response of,to loblolly pine: effects of biosolid applications on growth; response of,to loblolly pine: effects of biosolid applications on growth; response of,
seedlings interplanted in stand gaps after the first growing season of the,seedlings interplanted in stand gaps after the first growing season of the,seedlings interplanted in stand gaps after the first growing season of the,seedlings interplanted in stand gaps after the first growing season of the,seedlings interplanted in stand gaps after the first growing season of the,seedlings interplanted in stand gaps after the first growing season of the,seedlings interplanted in stand gaps after the first growing season of the,seedlings interplanted in stand gaps after the first growing season of the,seedlings interplanted in stand gaps after the first growing season of the,seedlings interplanted in stand gaps after the first growing season of the,seedlings interplanted in stand gaps after the first growing season of the,
original stand; effects of herbicide release treatments on growth through,original stand; effects of herbicide release treatments on growth through,original stand; effects of herbicide release treatments on growth through,original stand; effects of herbicide release treatments on growth through,original stand; effects of herbicide release treatments on growth through,original stand; effects of herbicide release treatments on growth through,original stand; effects of herbicide release treatments on growth through,original stand; effects of herbicide release treatments on growth through,original stand; effects of herbicide release treatments on growth through,original stand; effects of herbicide release treatments on growth through,original stand; effects of herbicide release treatments on growth through,
"age seven, and comparative effects of hardwood control before planting","age seven, and comparative effects of hardwood control before planting","age seven, and comparative effects of hardwood control before planting","age seven, and comparative effects of hardwood control before planting","age seven, and comparative effects of hardwood control before planting","age seven, and comparative effects of hardwood control before planting","age seven, and comparative effects of hardwood control before planting","age seven, and comparative effects of hardwood control before planting","age seven, and comparative effects of hardwood control before planting","age seven, and comparative effects of hardwood control before planting","age seven, and comparative effects of hardwood control before planting",
(site prep) and two years after planting (release). We also have four-year data,(site prep) and two years after planting (release). We also have four-year data,(site prep) and two years after planting (release). We also have four-year data,(site prep) and two years after planting (release). We also have four-year data,(site prep) and two years after planting (release). We also have four-year data,(site prep) and two years after planting (release). We also have four-year data,(site prep) and two years after planting (release). We also have four-year data,(site prep) and two years after planting (release). We also have four-year data,(site prep) and two years after planting (release). We also have four-year data,(site prep) and two years after planting (release). We also have four-year data,(site prep) and two years after planting (release). We also have four-year data,
from our northern red oak establishment study.,from our northern red oak establishment study.,from our northern red oak establishment study.,from our northern red oak establishment study.,from our northern red oak establishment study.,from our northern red oak establishment study.,from our northern red oak establishment study.,from our northern red oak establishment study.,,,,
As,"usual,",we’ll,start,with,some,recent,reports,from,our,research,"Onesphore Bitoki, tree"
"cooperatives. These groups, with their extensive field trial networks, have","cooperatives. These groups, with their extensive field trial networks, have","cooperatives. These groups, with their extensive field trial networks, have","cooperatives. These groups, with their extensive field trial networks, have","cooperatives. These groups, with their extensive field trial networks, have","cooperatives. These groups, with their extensive field trial networks, have","cooperatives. These groups, with their extensive field trial networks, have","cooperatives. These groups, with their extensive field trial networks, have","cooperatives. These groups, with their extensive field trial networks, have","cooperatives. These groups, with their extensive field trial networks, have","cooperatives. These groups, with their extensive field trial networks, have",improvement forester
probably done more to advance our knowledge of forest responses and,probably done more to advance our knowledge of forest responses and,probably done more to advance our knowledge of forest responses and,probably done more to advance our knowledge of forest responses and,probably done more to advance our knowledge of forest responses and,probably done more to advance our knowledge of forest responses and,probably done more to advance our knowledge of forest responses and,probably done more to advance our knowledge of forest responses and,probably done more to advance our knowledge of forest responses and,probably done more to advance our knowledge of forest responses and,probably done more to advance our knowledge of forest responses and,
