"with the Piedmont and Coastal Plain, the mountains","with the Piedmont and Coastal Plain, the mountains","with the Piedmont and Coastal Plain, the mountains","with the Piedmont and Coastal Plain, the mountains","with the Piedmont and Coastal Plain, the mountains","with the Piedmont and Coastal Plain, the mountains","with the Piedmont and Coastal Plain, the mountains","with the Piedmont and Coastal Plain, the mountains",are also fully capable of spreading well into lowland,are also fully capable of spreading well into lowland,are also fully capable of spreading well into lowland,are also fully capable of spreading well into lowland,are also fully capable of spreading well into lowland,are also fully capable of spreading well into lowland,are also fully capable of spreading well into lowland,are also fully capable of spreading well into lowland
bear the brunt of the impacts from gypsy moth,bear the brunt of the impacts from gypsy moth,bear the brunt of the impacts from gypsy moth,bear the brunt of the impacts from gypsy moth,bear the brunt of the impacts from gypsy moth,bear the brunt of the impacts from gypsy moth,bear the brunt of the impacts from gypsy moth,bear the brunt of the impacts from gypsy moth,areas and affecting those forests and tree species.,areas and affecting those forests and tree species.,areas and affecting those forests and tree species.,areas and affecting those forests and tree species.,areas and affecting those forests and tree species.,areas and affecting those forests and tree species.,areas and affecting those forests and tree species.,areas and affecting those forests and tree species.
,,for a number of reasons: 1) large areas,for a number of reasons: 1) large areas,for a number of reasons: 1) large areas,for a number of reasons: 1) large areas,for a number of reasons: 1) large areas,for a number of reasons: 1) large areas,,,,,,,,
,,,of contiguous forest that are,of contiguous forest that are,of contiguous forest that are,of contiguous forest that are,of contiguous forest that are,"This brings us to the concept of tree decline, which","This brings us to the concept of tree decline, which","This brings us to the concept of tree decline, which","This brings us to the concept of tree decline, which","This brings us to the concept of tree decline, which","This brings us to the concept of tree decline, which","This brings us to the concept of tree decline, which","This brings us to the concept of tree decline, which"
,,,,,unbroken,unbroken,for,is defined as a gradual failure in the health of a tree,is defined as a gradual failure in the health of a tree,is defined as a gradual failure in the health of a tree,is defined as a gradual failure in the health of a tree,is defined as a gradual failure in the health of a tree,is defined as a gradual failure in the health of a tree,is defined as a gradual failure in the health of a tree,is defined as a gradual failure in the health of a tree
“The mind is,“The mind is,,,,,,many,"or stand of trees, eventually resulting in death from","or stand of trees, eventually resulting in death from","or stand of trees, eventually resulting in death from","or stand of trees, eventually resulting in death from","or stand of trees, eventually resulting in death from","or stand of trees, eventually resulting in death from","or stand of trees, eventually resulting in death from","or stand of trees, eventually resulting in death from"
but a barren soil; a soil which,but a barren soil; a soil which,but a barren soil; a soil which,but a barren soil; a soil which,,,,,a combination of abiotic and biotic factors. The key,a combination of abiotic and biotic factors. The key,a combination of abiotic and biotic factors. The key,a combination of abiotic and biotic factors. The key,a combination of abiotic and biotic factors. The key,a combination of abiotic and biotic factors. The key,a combination of abiotic and biotic factors. The key,a combination of abiotic and biotic factors. The key
"is soon exhausted, and will produce no crop,","is soon exhausted, and will produce no crop,","is soon exhausted, and will produce no crop,","is soon exhausted, and will produce no crop,","is soon exhausted, and will produce no crop,","is soon exhausted, and will produce no crop,","is soon exhausted, and will produce no crop,","is soon exhausted, and will produce no crop,",,point with any decline syndrome is that,point with any decline syndrome is that,point with any decline syndrome is that,point with any decline syndrome is that,point with any decline syndrome is that,point with any decline syndrome is that,point with any decline syndrome is that
"or only one, unless it becomes continually","or only one, unless it becomes continually","or only one, unless it becomes continually","or only one, unless it becomes continually","or only one, unless it becomes continually","or only one, unless it becomes continually","or only one, unless it becomes continually",,,,,,,,,
fertilized and enriched with foreign matter.”,fertilized and enriched with foreign matter.”,fertilized and enriched with foreign matter.”,fertilized and enriched with foreign matter.”,fertilized and enriched with foreign matter.”,fertilized and enriched with foreign matter.”,fertilized and enriched with foreign matter.”,fertilized and enriched with foreign matter.”,,,,,,,,
"Joshuah Reynolds, 1774","Joshuah Reynolds, 1774","Joshuah Reynolds, 1774","Joshuah Reynolds, 1774",,,,,,,,,,,,
2,,,,,,,,,,,,,,,
