pine spacing trials established in 1983 at four site-,pine spacing trials established in 1983 at four site-,pine spacing trials established in 1983 at four site-,pine spacing trials established in 1983 at four site-,pine spacing trials established in 1983 at four site-,pine spacing trials established in 1983 at four site-,pine spacing trials established in 1983 at four site-,pine spacing trials established in 1983 at four site-,planting,"density,",the,two,levels,of,nutrient,addition
prepared areas in the Piedmont and Coastal Plain of,prepared areas in the Piedmont and Coastal Plain of,prepared areas in the Piedmont and Coastal Plain of,prepared areas in the Piedmont and Coastal Plain of,prepared areas in the Piedmont and Coastal Plain of,prepared areas in the Piedmont and Coastal Plain of,prepared areas in the Piedmont and Coastal Plain of,prepared areas in the Piedmont and Coastal Plain of,improved the basal area over the controls but to the,improved the basal area over the controls but to the,improved the basal area over the controls but to the,improved the basal area over the controls but to the,improved the basal area over the controls but to the,improved the basal area over the controls but to the,improved the basal area over the controls but to the,improved the basal area over the controls but to the
Virginia and North Carolina. [One of these locations is on,Virginia and North Carolina. [One of these locations is on,Virginia and North Carolina. [One of these locations is on,Virginia and North Carolina. [One of these locations is on,Virginia and North Carolina. [One of these locations is on,Virginia and North Carolina. [One of these locations is on,Virginia and North Carolina. [One of these locations is on,Virginia and North Carolina. [One of these locations is on,same extent. Basal areas in the higher stand density,same extent. Basal areas in the higher stand density,same extent. Basal areas in the higher stand density,same extent. Basal areas in the higher stand density,same extent. Basal areas in the higher stand density,same extent. Basal areas in the higher stand density,same extent. Basal areas in the higher stand density,same extent. Basal areas in the higher stand density
the Appomattox-Buckingham State Forest.] Analysis of,the Appomattox-Buckingham State Forest.] Analysis of,the Appomattox-Buckingham State Forest.] Analysis of,the Appomattox-Buckingham State Forest.] Analysis of,the Appomattox-Buckingham State Forest.] Analysis of,the Appomattox-Buckingham State Forest.] Analysis of,the Appomattox-Buckingham State Forest.] Analysis of,the Appomattox-Buckingham State Forest.] Analysis of,treatment ranged from 92.9 to 107.2 ft. 2/acre and will,treatment ranged from 92.9 to 107.2 ft. 2/acre and will,treatment ranged from 92.9 to 107.2 ft. 2/acre and will,treatment ranged from 92.9 to 107.2 ft. 2/acre and will,treatment ranged from 92.9 to 107.2 ft. 2/acre and will,treatment ranged from 92.9 to 107.2 ft. 2/acre and will,treatment ranged from 92.9 to 107.2 ft. 2/acre and will,treatment ranged from 92.9 to 107.2 ft. 2/acre and will
covariance methods were applied to the long-term data,covariance methods were applied to the long-term data,covariance methods were applied to the long-term data,covariance methods were applied to the long-term data,covariance methods were applied to the long-term data,covariance methods were applied to the long-term data,covariance methods were applied to the long-term data,covariance methods were applied to the long-term data,require a thinning within the next couple of years to,require a thinning within the next couple of years to,require a thinning within the next couple of years to,require a thinning within the next couple of years to,require a thinning within the next couple of years to,require a thinning within the next couple of years to,require a thinning within the next couple of years to,require a thinning within the next couple of years to
and showed that the orientation of rows with regard to a,and showed that the orientation of rows with regard to a,and showed that the orientation of rows with regard to a,and showed that the orientation of rows with regard to a,and showed that the orientation of rows with regard to a,and showed that the orientation of rows with regard to a,and showed that the orientation of rows with regard to a,and showed that the orientation of rows with regard to a,"prevent density dependent mortality. However, projected","prevent density dependent mortality. However, projected","prevent density dependent mortality. However, projected","prevent density dependent mortality. However, projected","prevent density dependent mortality. However, projected","prevent density dependent mortality. However, projected","prevent density dependent mortality. However, projected","prevent density dependent mortality. However, projected"
particular azimuth direction had no significant impact on,particular azimuth direction had no significant impact on,particular azimuth direction had no significant impact on,particular azimuth direction had no significant impact on,particular azimuth direction had no significant impact on,particular azimuth direction had no significant impact on,particular azimuth direction had no significant impact on,particular azimuth direction had no significant impact on,tree sizes within the next two years indicate that thinning,tree sizes within the next two years indicate that thinning,tree sizes within the next two years indicate that thinning,tree sizes within the next two years indicate that thinning,tree sizes within the next two years indicate that thinning,tree sizes within the next two years indicate that thinning,tree sizes within the next two years indicate that thinning,tree sizes within the next two years indicate that thinning
either basal area or dominant height growth through age,either basal area or dominant height growth through age,either basal area or dominant height growth through age,either basal area or dominant height growth through age,either basal area or dominant height growth through age,either basal area or dominant height growth through age,either basal area or dominant height growth through age,either basal area or dominant height growth through age,will not be economical even within the 726 trees per acre,will not be economical even within the 726 trees per acre,will not be economical even within the 726 trees per acre,will not be economical even within the 726 trees per acre,will not be economical even within the 726 trees per acre,will not be economical even within the 726 trees per acre,will not be economical even within the 726 trees per acre,will not be economical even within the 726 trees per acre
20. Results were consistent for a wide range of planting,20. Results were consistent for a wide range of planting,20. Results were consistent for a wide range of planting,20. Results were consistent for a wide range of planting,20. Results were consistent for a wide range of planting,20. Results were consistent for a wide range of planting,20. Results were consistent for a wide range of planting,20. Results were consistent for a wide range of planting,"treatment, as merchantable volumes range from 356 to","treatment, as merchantable volumes range from 356 to","treatment, as merchantable volumes range from 356 to","treatment, as merchantable volumes range from 356 to","treatment, as merchantable volumes range from 356 to","treatment, as merchantable volumes range from 356 to","treatment, as merchantable volumes range from 356 to","treatment, as merchantable volumes range from 356 to"
"densities, spacings and across a range of ages that","densities, spacings and across a range of ages that","densities, spacings and across a range of ages that","densities, spacings and across a range of ages that","densities, spacings and across a range of ages that","densities, spacings and across a range of ages that","densities, spacings and across a range of ages that","densities, spacings and across a range of ages that",726 ft.3/acre depending on the fertilization regime.,726 ft.3/acre depending on the fertilization regime.,726 ft.3/acre depending on the fertilization regime.,726 ft.3/acre depending on the fertilization regime.,726 ft.3/acre depending on the fertilization regime.,726 ft.3/acre depending on the fertilization regime.,726 ft.3/acre depending on the fertilization regime.,
included very young ages prior to crown closure. These,included very young ages prior to crown closure. These,included very young ages prior to crown closure. These,included very young ages prior to crown closure. These,included very young ages prior to crown closure. These,included very young ages prior to crown closure. These,included very young ages prior to crown closure. These,included very young ages prior to crown closure. These,,,,,,,,
results suggest that the selection of row orientation at,results suggest that the selection of row orientation at,results suggest that the selection of row orientation at,results suggest that the selection of row orientation at,results suggest that the selection of row orientation at,results suggest that the selection of row orientation at,results suggest that the selection of row orientation at,results suggest that the selection of row orientation at,,,,,,,,
plantation establishment can be made based on criteria,plantation establishment can be made based on criteria,plantation establishment can be made based on criteria,plantation establishment can be made based on criteria,plantation establishment can be made based on criteria,plantation establishment can be made based on criteria,plantation establishment can be made based on criteria,plantation establishment can be made based on criteria,,,,,,,,
other than growth.,other than growth.,other than growth.,other than growth.,,,,,,,,,,,,
,,,,,,,,,,,,,,,
