"honeydew, which is basically","honeydew, which is basically","honeydew, which is basically","honeydew, which is basically","honeydew, which is basically","honeydew, which is basically",,,,,,,,,,,,
sugar water but also contains,sugar water but also contains,sugar water but also contains,sugar water but also contains,sugar water but also contains,sugar water but also contains,,,,,,,,,,,,
a complex mixture of amino,a complex mixture of amino,a complex mixture of amino,a complex mixture of amino,a complex mixture of amino,a complex mixture of amino,Beech aphid fungus after turning black during the fall.,Beech aphid fungus after turning black during the fall.,Beech aphid fungus after turning black during the fall.,Beech aphid fungus after turning black during the fall.,Beech aphid fungus after turning black during the fall.,Beech aphid fungus after turning black during the fall.,Beech aphid fungus after turning black during the fall.,,,,,
"acids, proteins, other organic","acids, proteins, other organic","acids, proteins, other organic","acids, proteins, other organic","acids, proteins, other organic","acids, proteins, other organic",,,,,,,,,,,,
substances,substances,substances,and,minerals.,minerals.,,,,,,,,,,,,
These insects need to ingest,These insects need to ingest,These insects need to ingest,These insects need to ingest,These insects need to ingest,These insects need to ingest,,,,,,,,,,,,
large amounts (relative to their,large amounts (relative to their,large amounts (relative to their,large amounts (relative to their,large amounts (relative to their,large amounts (relative to their,,,,,,,,,,,,
,,,,,,,,,,,,,,,,,15
