has trained several of its staff who are ISA-certified,has trained several of its staff who are ISA-certified,has trained several of its staff who are ISA-certified,has trained several of its staff who are ISA-certified,has trained several of its staff who are ISA-certified,has trained several of its staff who are ISA-certified,has trained several of its staff who are ISA-certified,has trained several of its staff who are ISA-certified,has trained several of its staff who are ISA-certified,,,,,,,
arborists to become members of urban forest storm,arborists to become members of urban forest storm,arborists to become members of urban forest storm,arborists to become members of urban forest storm,arborists to become members of urban forest storm,arborists to become members of urban forest storm,arborists to become members of urban forest storm,arborists to become members of urban forest storm,arborists to become members of urban forest storm,,,,,,,
damage response teams. These teams are trained to,damage response teams. These teams are trained to,damage response teams. These teams are trained to,damage response teams. These teams are trained to,damage response teams. These teams are trained to,damage response teams. These teams are trained to,damage response teams. These teams are trained to,damage response teams. These teams are trained to,damage response teams. These teams are trained to,,,,,,,
assist storm-damaged communities by coordinating,assist storm-damaged communities by coordinating,assist storm-damaged communities by coordinating,assist storm-damaged communities by coordinating,assist storm-damaged communities by coordinating,assist storm-damaged communities by coordinating,assist storm-damaged communities by coordinating,assist storm-damaged communities by coordinating,assist storm-damaged communities by coordinating,,,,,,,
with FEMA and state emergency response agencies,with FEMA and state emergency response agencies,with FEMA and state emergency response agencies,with FEMA and state emergency response agencies,with FEMA and state emergency response agencies,with FEMA and state emergency response agencies,with FEMA and state emergency response agencies,with FEMA and state emergency response agencies,with FEMA and state emergency response agencies,,,,,,,
to provide estimates of tree debris as well as,to provide estimates of tree debris as well as,to provide estimates of tree debris as well as,to provide estimates of tree debris as well as,to provide estimates of tree debris as well as,to provide estimates of tree debris as well as,to provide estimates of tree debris as well as,,,,,,,,,
assess the condition and safety of the,assess the condition and safety of the,assess the condition and safety of the,assess the condition and safety of the,assess the condition and safety of the,assess the condition and safety of the,,,,,,,,,,
,,,,,,,,,,,,,,,23
