V I RG I N I A,
,Forest
,Health Review
,May 2007
"Emergent leaves of tree of heaven, left, and hickory were hard hit by a late frost during the second week",
of April.,
In this issue...,European Woodwasp
,Hemlock Woolly Adelgid
Climate Change and,Sudden Oak Death
Forest Health,Tree of Heaven
Updates:,Invasive Plant Interpretive Trail
Weather,Fall Cankerworm
Late Freeze,Outbreaks in Virginia
Eastern Tent Caterpillar,Emerald Ash Borer Rears
Southern Pine Beetle,Its Ugly Green Head in
Gypsy Moth,Maryland
,Greetings,Greetings,Greetings,Greetings,Greetings,,,,,,,,,
,"More and more these days, I am asked to give an opinion on the","More and more these days, I am asked to give an opinion on the","More and more these days, I am asked to give an opinion on the","More and more these days, I am asked to give an opinion on the","More and more these days, I am asked to give an opinion on the","More and more these days, I am asked to give an opinion on the","More and more these days, I am asked to give an opinion on the","More and more these days, I am asked to give an opinion on the","More and more these days, I am asked to give an opinion on the",,,,,
,impacts of global warming on forest health. Along with the monthly,impacts of global warming on forest health. Along with the monthly,impacts of global warming on forest health. Along with the monthly,impacts of global warming on forest health. Along with the monthly,impacts of global warming on forest health. Along with the monthly,impacts of global warming on forest health. Along with the monthly,impacts of global warming on forest health. Along with the monthly,impacts of global warming on forest health. Along with the monthly,impacts of global warming on forest health. Along with the monthly,,,,,
,"weather, a discussion of climate change may become a regular","weather, a discussion of climate change may become a regular","weather, a discussion of climate change may become a regular","weather, a discussion of climate change may become a regular","weather, a discussion of climate change may become a regular","weather, a discussion of climate change may become a regular","weather, a discussion of climate change may become a regular","weather, a discussion of climate change may become a regular","weather, a discussion of climate change may become a regular",,,,,
,"part of the ‘Updates’ column given its recent media attention and,","part of the ‘Updates’ column given its recent media attention and,","part of the ‘Updates’ column given its recent media attention and,","part of the ‘Updates’ column given its recent media attention and,","part of the ‘Updates’ column given its recent media attention and,","part of the ‘Updates’ column given its recent media attention and,","part of the ‘Updates’ column given its recent media attention and,","part of the ‘Updates’ column given its recent media attention and,","part of the ‘Updates’ column given its recent media attention and,",,,,,
,"more importantly, its potential implications. No, I’m not an expert","more importantly, its potential implications. No, I’m not an expert","more importantly, its potential implications. No, I’m not an expert","more importantly, its potential implications. No, I’m not an expert","more importantly, its potential implications. No, I’m not an expert","more importantly, its potential implications. No, I’m not an expert","more importantly, its potential implications. No, I’m not an expert","more importantly, its potential implications. No, I’m not an expert","more importantly, its potential implications. No, I’m not an expert",,,,,
,on the topic; who really is? But a rapidly changing climate will,on the topic; who really is? But a rapidly changing climate will,on the topic; who really is? But a rapidly changing climate will,on the topic; who really is? But a rapidly changing climate will,on the topic; who really is? But a rapidly changing climate will,on the topic; who really is? But a rapidly changing climate will,on the topic; who really is? But a rapidly changing climate will,on the topic; who really is? But a rapidly changing climate will,on the topic; who really is? But a rapidly changing climate will,,,,,
,"clearly have an impact on forest health, a fact that is probably","clearly have an impact on forest health, a fact that is probably","clearly have an impact on forest health, a fact that is probably","clearly have an impact on forest health, a fact that is probably","clearly have an impact on forest health, a fact that is probably","clearly have an impact on forest health, a fact that is probably","clearly have an impact on forest health, a fact that is probably","clearly have an impact on forest health, a fact that is probably","clearly have an impact on forest health, a fact that is probably",,,,,
,obvious to most people who give it some thought. While I rely on,obvious to most people who give it some thought. While I rely on,obvious to most people who give it some thought. While I rely on,obvious to most people who give it some thought. While I rely on,obvious to most people who give it some thought. While I rely on,obvious to most people who give it some thought. While I rely on,obvious to most people who give it some thought. While I rely on,obvious to most people who give it some thought. While I rely on,obvious to most people who give it some thought. While I rely on,,,,,
,"the climatologists and modelers to forecast the extent, speed and","the climatologists and modelers to forecast the extent, speed and","the climatologists and modelers to forecast the extent, speed and","the climatologists and modelers to forecast the extent, speed and","the climatologists and modelers to forecast the extent, speed and","the climatologists and modelers to forecast the extent, speed and","the climatologists and modelers to forecast the extent, speed and","the climatologists and modelers to forecast the extent, speed and","the climatologists and modelers to forecast the extent, speed and",,,,,
,"dynamics of this change (an inexact science to be sure), natural","dynamics of this change (an inexact science to be sure), natural","dynamics of this change (an inexact science to be sure), natural","dynamics of this change (an inexact science to be sure), natural","dynamics of this change (an inexact science to be sure), natural","dynamics of this change (an inexact science to be sure), natural","dynamics of this change (an inexact science to be sure), natural","dynamics of this change (an inexact science to be sure), natural","dynamics of this change (an inexact science to be sure), natural",,,,,
,resource professionals are in a position to speculate on what impact,resource professionals are in a position to speculate on what impact,resource professionals are in a position to speculate on what impact,resource professionals are in a position to speculate on what impact,resource professionals are in a position to speculate on what impact,resource professionals are in a position to speculate on what impact,resource professionals are in a position to speculate on what impact,resource professionals are in a position to speculate on what impact,resource professionals are in a position to speculate on what impact,,,,,
,"such changes will have on forest ecology and health. Notice, I said ‘speculate.’ I suppose the other","such changes will have on forest ecology and health. Notice, I said ‘speculate.’ I suppose the other","such changes will have on forest ecology and health. Notice, I said ‘speculate.’ I suppose the other","such changes will have on forest ecology and health. Notice, I said ‘speculate.’ I suppose the other","such changes will have on forest ecology and health. Notice, I said ‘speculate.’ I suppose the other","such changes will have on forest ecology and health. Notice, I said ‘speculate.’ I suppose the other","such changes will have on forest ecology and health. Notice, I said ‘speculate.’ I suppose the other","such changes will have on forest ecology and health. Notice, I said ‘speculate.’ I suppose the other","such changes will have on forest ecology and health. Notice, I said ‘speculate.’ I suppose the other","such changes will have on forest ecology and health. Notice, I said ‘speculate.’ I suppose the other","such changes will have on forest ecology and health. Notice, I said ‘speculate.’ I suppose the other","such changes will have on forest ecology and health. Notice, I said ‘speculate.’ I suppose the other","such changes will have on forest ecology and health. Notice, I said ‘speculate.’ I suppose the other","such changes will have on forest ecology and health. Notice, I said ‘speculate.’ I suppose the other"
,"impetus for this writing was that, like most of you, I noticed that we didn’t have much of a winter","impetus for this writing was that, like most of you, I noticed that we didn’t have much of a winter","impetus for this writing was that, like most of you, I noticed that we didn’t have much of a winter","impetus for this writing was that, like most of you, I noticed that we didn’t have much of a winter","impetus for this writing was that, like most of you, I noticed that we didn’t have much of a winter","impetus for this writing was that, like most of you, I noticed that we didn’t have much of a winter","impetus for this writing was that, like most of you, I noticed that we didn’t have much of a winter","impetus for this writing was that, like most of you, I noticed that we didn’t have much of a winter","impetus for this writing was that, like most of you, I noticed that we didn’t have much of a winter","impetus for this writing was that, like most of you, I noticed that we didn’t have much of a winter","impetus for this writing was that, like most of you, I noticed that we didn’t have much of a winter","impetus for this writing was that, like most of you, I noticed that we didn’t have much of a winter","impetus for this writing was that, like most of you, I noticed that we didn’t have much of a winter","impetus for this writing was that, like most of you, I noticed that we didn’t have much of a winter"
,"this year. One cold month, February, and that was about it (the current cold spell in April not","this year. One cold month, February, and that was about it (the current cold spell in April not","this year. One cold month, February, and that was about it (the current cold spell in April not","this year. One cold month, February, and that was about it (the current cold spell in April not","this year. One cold month, February, and that was about it (the current cold spell in April not","this year. One cold month, February, and that was about it (the current cold spell in April not","this year. One cold month, February, and that was about it (the current cold spell in April not","this year. One cold month, February, and that was about it (the current cold spell in April not","this year. One cold month, February, and that was about it (the current cold spell in April not","this year. One cold month, February, and that was about it (the current cold spell in April not","this year. One cold month, February, and that was about it (the current cold spell in April not","this year. One cold month, February, and that was about it (the current cold spell in April not","this year. One cold month, February, and that was about it (the current cold spell in April not","this year. One cold month, February, and that was about it (the current cold spell in April not"
,withstanding). What is shocking to me is that this pattern is starting to feel ‘normal.’ I just don’t,withstanding). What is shocking to me is that this pattern is starting to feel ‘normal.’ I just don’t,withstanding). What is shocking to me is that this pattern is starting to feel ‘normal.’ I just don’t,withstanding). What is shocking to me is that this pattern is starting to feel ‘normal.’ I just don’t,withstanding). What is shocking to me is that this pattern is starting to feel ‘normal.’ I just don’t,withstanding). What is shocking to me is that this pattern is starting to feel ‘normal.’ I just don’t,withstanding). What is shocking to me is that this pattern is starting to feel ‘normal.’ I just don’t,withstanding). What is shocking to me is that this pattern is starting to feel ‘normal.’ I just don’t,withstanding). What is shocking to me is that this pattern is starting to feel ‘normal.’ I just don’t,withstanding). What is shocking to me is that this pattern is starting to feel ‘normal.’ I just don’t,withstanding). What is shocking to me is that this pattern is starting to feel ‘normal.’ I just don’t,withstanding). What is shocking to me is that this pattern is starting to feel ‘normal.’ I just don’t,withstanding). What is shocking to me is that this pattern is starting to feel ‘normal.’ I just don’t,withstanding). What is shocking to me is that this pattern is starting to feel ‘normal.’ I just don’t
,"expect it to stay cold (as in, below freezing) for very long any more. It’s not really surprising then","expect it to stay cold (as in, below freezing) for very long any more. It’s not really surprising then","expect it to stay cold (as in, below freezing) for very long any more. It’s not really surprising then","expect it to stay cold (as in, below freezing) for very long any more. It’s not really surprising then","expect it to stay cold (as in, below freezing) for very long any more. It’s not really surprising then","expect it to stay cold (as in, below freezing) for very long any more. It’s not really surprising then","expect it to stay cold (as in, below freezing) for very long any more. It’s not really surprising then","expect it to stay cold (as in, below freezing) for very long any more. It’s not really surprising then","expect it to stay cold (as in, below freezing) for very long any more. It’s not really surprising then","expect it to stay cold (as in, below freezing) for very long any more. It’s not really surprising then","expect it to stay cold (as in, below freezing) for very long any more. It’s not really surprising then","expect it to stay cold (as in, below freezing) for very long any more. It’s not really surprising then","expect it to stay cold (as in, below freezing) for very long any more. It’s not really surprising then","expect it to stay cold (as in, below freezing) for very long any more. It’s not really surprising then"
,that the National Arbor Day Foundation recently changed its plant hardiness zone map to reflect the,that the National Arbor Day Foundation recently changed its plant hardiness zone map to reflect the,that the National Arbor Day Foundation recently changed its plant hardiness zone map to reflect the,that the National Arbor Day Foundation recently changed its plant hardiness zone map to reflect the,that the National Arbor Day Foundation recently changed its plant hardiness zone map to reflect the,that the National Arbor Day Foundation recently changed its plant hardiness zone map to reflect the,that the National Arbor Day Foundation recently changed its plant hardiness zone map to reflect the,that the National Arbor Day Foundation recently changed its plant hardiness zone map to reflect the,that the National Arbor Day Foundation recently changed its plant hardiness zone map to reflect the,that the National Arbor Day Foundation recently changed its plant hardiness zone map to reflect the,that the National Arbor Day Foundation recently changed its plant hardiness zone map to reflect the,that the National Arbor Day Foundation recently changed its plant hardiness zone map to reflect the,that the National Arbor Day Foundation recently changed its plant hardiness zone map to reflect the,that the National Arbor Day Foundation recently changed its plant hardiness zone map to reflect the
,recent warming trend. Check out the updated map on its Web site; large portions of many states,recent warming trend. Check out the updated map on its Web site; large portions of many states,recent warming trend. Check out the updated map on its Web site; large portions of many states,recent warming trend. Check out the updated map on its Web site; large portions of many states,recent warming trend. Check out the updated map on its Web site; large portions of many states,recent warming trend. Check out the updated map on its Web site; large portions of many states,recent warming trend. Check out the updated map on its Web site; large portions of many states,recent warming trend. Check out the updated map on its Web site; large portions of many states,recent warming trend. Check out the updated map on its Web site; large portions of many states,recent warming trend. Check out the updated map on its Web site; large portions of many states,recent warming trend. Check out the updated map on its Web site; large portions of many states,recent warming trend. Check out the updated map on its Web site; large portions of many states,recent warming trend. Check out the updated map on its Web site; large portions of many states,recent warming trend. Check out the updated map on its Web site; large portions of many states
,"have warmed one full hardiness zone, two zones in some areas. This suggests that the warmer","have warmed one full hardiness zone, two zones in some areas. This suggests that the warmer","have warmed one full hardiness zone, two zones in some areas. This suggests that the warmer","have warmed one full hardiness zone, two zones in some areas. This suggests that the warmer","have warmed one full hardiness zone, two zones in some areas. This suggests that the warmer","have warmed one full hardiness zone, two zones in some areas. This suggests that the warmer","have warmed one full hardiness zone, two zones in some areas. This suggests that the warmer","have warmed one full hardiness zone, two zones in some areas. This suggests that the warmer","have warmed one full hardiness zone, two zones in some areas. This suggests that the warmer","have warmed one full hardiness zone, two zones in some areas. This suggests that the warmer","have warmed one full hardiness zone, two zones in some areas. This suggests that the warmer","have warmed one full hardiness zone, two zones in some areas. This suggests that the warmer","have warmed one full hardiness zone, two zones in some areas. This suggests that the warmer","have warmed one full hardiness zone, two zones in some areas. This suggests that the warmer"
,"weather is here to stay. The world has started talking about it, and so will I. I trust you will find this","weather is here to stay. The world has started talking about it, and so will I. I trust you will find this","weather is here to stay. The world has started talking about it, and so will I. I trust you will find this","weather is here to stay. The world has started talking about it, and so will I. I trust you will find this","weather is here to stay. The world has started talking about it, and so will I. I trust you will find this","weather is here to stay. The world has started talking about it, and so will I. I trust you will find this","weather is here to stay. The world has started talking about it, and so will I. I trust you will find this","weather is here to stay. The world has started talking about it, and so will I. I trust you will find this","weather is here to stay. The world has started talking about it, and so will I. I trust you will find this","weather is here to stay. The world has started talking about it, and so will I. I trust you will find this","weather is here to stay. The world has started talking about it, and so will I. I trust you will find this","weather is here to stay. The world has started talking about it, and so will I. I trust you will find this","weather is here to stay. The world has started talking about it, and so will I. I trust you will find this","weather is here to stay. The world has started talking about it, and so will I. I trust you will find this"
,issue of Forest Health Review to be useful and informative.,issue of Forest Health Review to be useful and informative.,issue of Forest Health Review to be useful and informative.,issue of Forest Health Review to be useful and informative.,issue of Forest Health Review to be useful and informative.,issue of Forest Health Review to be useful and informative.,issue of Forest Health Review to be useful and informative.,issue of Forest Health Review to be useful and informative.,issue of Forest Health Review to be useful and informative.,,,,,
,"Chris Asaro, forest health specialist","Chris Asaro, forest health specialist","Chris Asaro, forest health specialist","Chris Asaro, forest health specialist","Chris Asaro, forest health specialist",,,,,,,,,
Climate Change and Forest Health,Climate Change and Forest Health,Climate Change and Forest Health,Climate Change and Forest Health,Climate Change and Forest Health,Climate Change and Forest Health,Climate Change and Forest Health,Climate Change and Forest Health,Climate Change and Forest Health,Climate Change and Forest Health,Climate Change and Forest Health,Climate Change and Forest Health,Climate Change and Forest Health,Climate Change and Forest Health,Climate Change and Forest Health
We,all,know,it’s,been,getting,warmer.,Global,"today, and 25 years of age was probably considered","today, and 25 years of age was probably considered","today, and 25 years of age was probably considered","today, and 25 years of age was probably considered","today, and 25 years of age was probably considered","today, and 25 years of age was probably considered","today, and 25 years of age was probably considered"
temperatures during the last 10 years are the warmest,temperatures during the last 10 years are the warmest,temperatures during the last 10 years are the warmest,temperatures during the last 10 years are the warmest,temperatures during the last 10 years are the warmest,temperatures during the last 10 years are the warmest,temperatures during the last 10 years are the warmest,temperatures during the last 10 years are the warmest,‘old’ back then. Nor were they crowded into cities and,‘old’ back then. Nor were they crowded into cities and,‘old’ back then. Nor were they crowded into cities and,‘old’ back then. Nor were they crowded into cities and,‘old’ back then. Nor were they crowded into cities and,‘old’ back then. Nor were they crowded into cities and,‘old’ back then. Nor were they crowded into cities and
"they’ve been in 12,000 years. Ice is rapidly melting","they’ve been in 12,000 years. Ice is rapidly melting","they’ve been in 12,000 years. Ice is rapidly melting","they’ve been in 12,000 years. Ice is rapidly melting","they’ve been in 12,000 years. Ice is rapidly melting","they’ve been in 12,000 years. Ice is rapidly melting","they’ve been in 12,000 years. Ice is rapidly melting","they’ve been in 12,000 years. Ice is rapidly melting","coastlines by the millions, dependent on technology","coastlines by the millions, dependent on technology","coastlines by the millions, dependent on technology","coastlines by the millions, dependent on technology","coastlines by the millions, dependent on technology","coastlines by the millions, dependent on technology","coastlines by the millions, dependent on technology"
"the world over, from the Arctic to the Antarctic to the","the world over, from the Arctic to the Antarctic to the","the world over, from the Arctic to the Antarctic to the","the world over, from the Arctic to the Antarctic to the","the world over, from the Arctic to the Antarctic to the","the world over, from the Arctic to the Antarctic to the","the world over, from the Arctic to the Antarctic to the","the world over, from the Arctic to the Antarctic to the","and the labor of others for food and water. So, the","and the labor of others for food and water. So, the","and the labor of others for food and water. So, the","and the labor of others for food and water. So, the","and the labor of others for food and water. So, the","and the labor of others for food and water. So, the","and the labor of others for food and water. So, the"
glaciers in Glacier National Park in Montana and the,glaciers in Glacier National Park in Montana and the,glaciers in Glacier National Park in Montana and the,glaciers in Glacier National Park in Montana and the,glaciers in Glacier National Park in Montana and the,glaciers in Glacier National Park in Montana and the,glaciers in Glacier National Park in Montana and the,glaciers in Glacier National Park in Montana and the,prospect of rapid climate change is a serious matter,prospect of rapid climate change is a serious matter,prospect of rapid climate change is a serious matter,prospect of rapid climate change is a serious matter,prospect of rapid climate change is a serious matter,prospect of rapid climate change is a serious matter,prospect of rapid climate change is a serious matter
snows of Mount Kilimanjaro in Africa. If the average,snows of Mount Kilimanjaro in Africa. If the average,snows of Mount Kilimanjaro in Africa. If the average,snows of Mount Kilimanjaro in Africa. If the average,snows of Mount Kilimanjaro in Africa. If the average,snows of Mount Kilimanjaro in Africa. If the average,snows of Mount Kilimanjaro in Africa. If the average,snows of Mount Kilimanjaro in Africa. If the average,that gives us much to be concerned about.,that gives us much to be concerned about.,that gives us much to be concerned about.,that gives us much to be concerned about.,that gives us much to be concerned about.,that gives us much to be concerned about.,
