are other elements operating in the environment that,are other elements operating in the environment that,are other elements operating in the environment that,are other elements operating in the environment that,are other elements operating in the environment that,are other elements operating in the environment that,are other elements operating in the environment that,are other elements operating in the environment that,are other elements operating in the environment that,are other elements operating in the environment that,"harvest and destruction of tropical rainforests, that","harvest and destruction of tropical rainforests, that","harvest and destruction of tropical rainforests, that","harvest and destruction of tropical rainforests, that","harvest and destruction of tropical rainforests, that","harvest and destruction of tropical rainforests, that","harvest and destruction of tropical rainforests, that","harvest and destruction of tropical rainforests, that"
may produce the same effect without global warming.,may produce the same effect without global warming.,may produce the same effect without global warming.,may produce the same effect without global warming.,may produce the same effect without global warming.,may produce the same effect without global warming.,may produce the same effect without global warming.,may produce the same effect without global warming.,may produce the same effect without global warming.,may produce the same effect without global warming.,release carbon dioxide. Other future changes in land,release carbon dioxide. Other future changes in land,release carbon dioxide. Other future changes in land,release carbon dioxide. Other future changes in land,release carbon dioxide. Other future changes in land,release carbon dioxide. Other future changes in land,release carbon dioxide. Other future changes in land,release carbon dioxide. Other future changes in land
"For example, oak decline occurs in many locations","For example, oak decline occurs in many locations","For example, oak decline occurs in many locations","For example, oak decline occurs in many locations","For example, oak decline occurs in many locations","For example, oak decline occurs in many locations","For example, oak decline occurs in many locations","For example, oak decline occurs in many locations","For example, oak decline occurs in many locations","For example, oak decline occurs in many locations",use,"patterns,",pollution,pollution,"levels,",forest,management,management
in Virginia due to a variety of insect and disease,in Virginia due to a variety of insect and disease,in Virginia due to a variety of insect and disease,in Virginia due to a variety of insect and disease,in Virginia due to a variety of insect and disease,in Virginia due to a variety of insect and disease,in Virginia due to a variety of insect and disease,in Virginia due to a variety of insect and disease,in Virginia due to a variety of insect and disease,in Virginia due to a variety of insect and disease,practices and timber demand will interact with climate,practices and timber demand will interact with climate,practices and timber demand will interact with climate,practices and timber demand will interact with climate,practices and timber demand will interact with climate,practices and timber demand will interact with climate,practices and timber demand will interact with climate,practices and timber demand will interact with climate
"problems, some of them exotic pests. In addition, oak","problems, some of them exotic pests. In addition, oak","problems, some of them exotic pests. In addition, oak","problems, some of them exotic pests. In addition, oak","problems, some of them exotic pests. In addition, oak","problems, some of them exotic pests. In addition, oak","problems, some of them exotic pests. In addition, oak","problems, some of them exotic pests. In addition, oak","problems, some of them exotic pests. In addition, oak","problems, some of them exotic pests. In addition, oak",change to produce unpredictable results. While some,change to produce unpredictable results. While some,change to produce unpredictable results. While some,change to produce unpredictable results. While some,change to produce unpredictable results. While some,change to produce unpredictable results. While some,change to produce unpredictable results. While some,change to produce unpredictable results. While some
regeneration has been poor in many locations due to,regeneration has been poor in many locations due to,regeneration has been poor in many locations due to,regeneration has been poor in many locations due to,regeneration has been poor in many locations due to,regeneration has been poor in many locations due to,regeneration has been poor in many locations due to,regeneration has been poor in many locations due to,regeneration has been poor in many locations due to,regeneration has been poor in many locations due to,"areas become drier, others may become wetter. Where","areas become drier, others may become wetter. Where","areas become drier, others may become wetter. Where","areas become drier, others may become wetter. Where","areas become drier, others may become wetter. Where","areas become drier, others may become wetter. Where","areas become drier, others may become wetter. Where","areas become drier, others may become wetter. Where"
"heavy deer browse, fire suppression and competition","heavy deer browse, fire suppression and competition","heavy deer browse, fire suppression and competition","heavy deer browse, fire suppression and competition","heavy deer browse, fire suppression and competition","heavy deer browse, fire suppression and competition","heavy deer browse, fire suppression and competition","heavy deer browse, fire suppression and competition","heavy deer browse, fire suppression and competition","heavy deer browse, fire suppression and competition",some,areas,become,less,"productive,","productive,",others,may
"from invasive weeds. In the short term, it will not","from invasive weeds. In the short term, it will not","from invasive weeds. In the short term, it will not","from invasive weeds. In the short term, it will not","from invasive weeds. In the short term, it will not","from invasive weeds. In the short term, it will not","from invasive weeds. In the short term, it will not","from invasive weeds. In the short term, it will not","from invasive weeds. In the short term, it will not","from invasive weeds. In the short term, it will not",become more productive. While we can place some,become more productive. While we can place some,become more productive. While we can place some,become more productive. While we can place some,become more productive. While we can place some,become more productive. While we can place some,become more productive. While we can place some,become more productive. While we can place some
be easy to separate out all of these environmental,be easy to separate out all of these environmental,be easy to separate out all of these environmental,be easy to separate out all of these environmental,be easy to separate out all of these environmental,be easy to separate out all of these environmental,be easy to separate out all of these environmental,be easy to separate out all of these environmental,be easy to separate out all of these environmental,be easy to separate out all of these environmental,confidence in humankind’s proven ability to adjust and,confidence in humankind’s proven ability to adjust and,confidence in humankind’s proven ability to adjust and,confidence in humankind’s proven ability to adjust and,confidence in humankind’s proven ability to adjust and,confidence in humankind’s proven ability to adjust and,confidence in humankind’s proven ability to adjust and,confidence in humankind’s proven ability to adjust and
"influences from the effects of climate change, as they","influences from the effects of climate change, as they","influences from the effects of climate change, as they","influences from the effects of climate change, as they","influences from the effects of climate change, as they","influences from the effects of climate change, as they","influences from the effects of climate change, as they","influences from the effects of climate change, as they","influences from the effects of climate change, as they","influences from the effects of climate change, as they","adapt, the fear is that these changes are occurring so","adapt, the fear is that these changes are occurring so","adapt, the fear is that these changes are occurring so","adapt, the fear is that these changes are occurring so","adapt, the fear is that these changes are occurring so","adapt, the fear is that these changes are occurring so","adapt, the fear is that these changes are occurring so","adapt, the fear is that these changes are occurring so"
are likely to interact in very complex ways.,are likely to interact in very complex ways.,are likely to interact in very complex ways.,are likely to interact in very complex ways.,are likely to interact in very complex ways.,are likely to interact in very complex ways.,are likely to interact in very complex ways.,are likely to interact in very complex ways.,,,rapidly that the results could be catastrophic.,rapidly that the results could be catastrophic.,rapidly that the results could be catastrophic.,rapidly that the results could be catastrophic.,rapidly that the results could be catastrophic.,rapidly that the results could be catastrophic.,rapidly that the results could be catastrophic.,
Based on a number of carbon dioxide enrichment,Based on a number of carbon dioxide enrichment,Based on a number of carbon dioxide enrichment,Based on a number of carbon dioxide enrichment,Based on a number of carbon dioxide enrichment,Based on a number of carbon dioxide enrichment,Based on a number of carbon dioxide enrichment,Based on a number of carbon dioxide enrichment,Based on a number of carbon dioxide enrichment,Based on a number of carbon dioxide enrichment,While changes in populations of long-lived trees may be,While changes in populations of long-lived trees may be,While changes in populations of long-lived trees may be,While changes in populations of long-lived trees may be,While changes in populations of long-lived trees may be,While changes in populations of long-lived trees may be,While changes in populations of long-lived trees may be,While changes in populations of long-lived trees may be
"studies,",increased,increased,carbon,,dioxide,dioxide,levels,in,the,"difficult to measure in the short term, with short-lived,","difficult to measure in the short term, with short-lived,","difficult to measure in the short term, with short-lived,","difficult to measure in the short term, with short-lived,","difficult to measure in the short term, with short-lived,","difficult to measure in the short term, with short-lived,","difficult to measure in the short term, with short-lived,","difficult to measure in the short term, with short-lived,"
atmosphere are likely to increase tree growth rates in,atmosphere are likely to increase tree growth rates in,atmosphere are likely to increase tree growth rates in,atmosphere are likely to increase tree growth rates in,atmosphere are likely to increase tree growth rates in,atmosphere are likely to increase tree growth rates in,atmosphere are likely to increase tree growth rates in,atmosphere are likely to increase tree growth rates in,atmosphere are likely to increase tree growth rates in,atmosphere are likely to increase tree growth rates in,"more rapidly reproducing organisms such as insects,","more rapidly reproducing organisms such as insects,","more rapidly reproducing organisms such as insects,","more rapidly reproducing organisms such as insects,","more rapidly reproducing organisms such as insects,","more rapidly reproducing organisms such as insects,","more rapidly reproducing organisms such as insects,","more rapidly reproducing organisms such as insects,"
"the short term, but in the long term, forest communities","the short term, but in the long term, forest communities","the short term, but in the long term, forest communities","the short term, but in the long term, forest communities","the short term, but in the long term, forest communities","the short term, but in the long term, forest communities","the short term, but in the long term, forest communities","the short term, but in the long term, forest communities","the short term, but in the long term, forest communities","the short term, but in the long term, forest communities",we,are,already,seeing,observable,observable,,
will become saturated with carbon dioxide as they,will become saturated with carbon dioxide as they,will become saturated with carbon dioxide as they,will become saturated with carbon dioxide as they,will become saturated with carbon dioxide as they,will become saturated with carbon dioxide as they,will become saturated with carbon dioxide as they,will become saturated with carbon dioxide as they,will become saturated with carbon dioxide as they,will become saturated with carbon dioxide as they,,,,,,,,
adjust to the increased levels in the atmosphere.,adjust to the increased levels in the atmosphere.,adjust to the increased levels in the atmosphere.,adjust to the increased levels in the atmosphere.,adjust to the increased levels in the atmosphere.,adjust to the increased levels in the atmosphere.,adjust to the increased levels in the atmosphere.,adjust to the increased levels in the atmosphere.,adjust to the increased levels in the atmosphere.,adjust to the increased levels in the atmosphere.,Continued on page 12,Continued on page 12,Continued on page 12,,,,,
"Over the next 100 years, climate change is likely to","Over the next 100 years, climate change is likely to","Over the next 100 years, climate change is likely to","Over the next 100 years, climate change is likely to","Over the next 100 years, climate change is likely to","Over the next 100 years, climate change is likely to","Over the next 100 years, climate change is likely to","Over the next 100 years, climate change is likely to","Over the next 100 years, climate change is likely to","Over the next 100 years, climate change is likely to",,,,,,,,
increase the geographic extent and productivity,increase the geographic extent and productivity,increase the geographic extent and productivity,increase the geographic extent and productivity,increase the geographic extent and productivity,increase the geographic extent and productivity,increase the geographic extent and productivity,increase the geographic extent and productivity,increase the geographic extent and productivity,increase the geographic extent and productivity,,,,,,,,
"of forests. For example, the boreal forests","of forests. For example, the boreal forests","of forests. For example, the boreal forests","of forests. For example, the boreal forests","of forests. For example, the boreal forests","of forests. For example, the boreal forests","of forests. For example, the boreal forests","of forests. For example, the boreal forests",,,,,,,,,,
of,Canada,and,Russia,are,likely,likely,,,,,“The art of being wise is the art of knowing,“The art of being wise is the art of knowing,“The art of being wise is the art of knowing,“The art of being wise is the art of knowing,“The art of being wise is the art of knowing,“The art of being wise is the art of knowing,“The art of being wise is the art of knowing
,,,,,,,,,,,,,,what to overlook.”,what to overlook.”,what to overlook.”,what to overlook.”
,,,,,,,,,,,,,,"William James, 1890","William James, 1890","William James, 1890","William James, 1890"
,,,,,,,,,,,,,,,,,
UPDATES,UPDATES,UPDATES,UPDATES,UPDATES,UPDATES,UPDATES,UPDATES,,,,,,,,,,,
,,,,,,Weather,Weather,Weather,Weather,,,,,,,,,
,,In,the,last,"issue,",we,left,off,in,,,,,,,,,
,September where we saw cooler than average,September where we saw cooler than average,September where we saw cooler than average,September where we saw cooler than average,September where we saw cooler than average,September where we saw cooler than average,September where we saw cooler than average,September where we saw cooler than average,September where we saw cooler than average,,,,,,,,,
temperatures and above average monthly precipitation,temperatures and above average monthly precipitation,temperatures and above average monthly precipitation,temperatures and above average monthly precipitation,temperatures and above average monthly precipitation,temperatures and above average monthly precipitation,temperatures and above average monthly precipitation,temperatures and above average monthly precipitation,temperatures and above average monthly precipitation,temperatures and above average monthly precipitation,,,,,,,,,
thanks,to,Tropical,Storm,Storm,Ernesto’s,Ernesto’s,arrival,at,the,,,,,,,,,
"beginning of the month. In October, temperatures","beginning of the month. In October, temperatures","beginning of the month. In October, temperatures","beginning of the month. In October, temperatures","beginning of the month. In October, temperatures","beginning of the month. In October, temperatures","beginning of the month. In October, temperatures","beginning of the month. In October, temperatures","beginning of the month. In October, temperatures","beginning of the month. In October, temperatures",,,,,,,,,
remained slightly below average while precipitation,remained slightly below average while precipitation,remained slightly below average while precipitation,remained slightly below average while precipitation,remained slightly below average while precipitation,remained slightly below average while precipitation,remained slightly below average while precipitation,remained slightly below average while precipitation,remained slightly below average while precipitation,remained slightly below average while precipitation,,,,,,,,,
continued to be well above normal (150 to 300+,continued to be well above normal (150 to 300+,continued to be well above normal (150 to 300+,continued to be well above normal (150 to 300+,continued to be well above normal (150 to 300+,continued to be well above normal (150 to 300+,continued to be well above normal (150 to 300+,continued to be well above normal (150 to 300+,continued to be well above normal (150 to 300+,continued to be well above normal (150 to 300+,,,,,,,,,
percent of monthly average) for just about everyone.,percent of monthly average) for just about everyone.,percent of monthly average) for just about everyone.,percent of monthly average) for just about everyone.,percent of monthly average) for just about everyone.,percent of monthly average) for just about everyone.,percent of monthly average) for just about everyone.,percent of monthly average) for just about everyone.,percent of monthly average) for just about everyone.,percent of monthly average) for just about everyone.,,,,,,,,,
Warmer,than,average,average,temperatures,temperatures,temperatures,returned,returned,in,,,,,,,,,
"November, with most locations being within a few","November, with most locations being within a few","November, with most locations being within a few","November, with most locations being within a few","November, with most locations being within a few","November, with most locations being within a few","November, with most locations being within a few","November, with most locations being within a few","November, with most locations being within a few","November, with most locations being within a few",,,,,,,,,
"degrees above average, while areas centered around","degrees above average, while areas centered around","degrees above average, while areas centered around","degrees above average, while areas centered around","degrees above average, while areas centered around","degrees above average, while areas centered around","degrees above average, while areas centered around","degrees above average, while areas centered around","degrees above average, while areas centered around","degrees above average, while areas centered around",,,,,,,,,
"Appomattox, Richmond and Culpeper averaged about","Appomattox, Richmond and Culpeper averaged about","Appomattox, Richmond and Culpeper averaged about","Appomattox, Richmond and Culpeper averaged about","Appomattox, Richmond and Culpeper averaged about","Appomattox, Richmond and Culpeper averaged about","Appomattox, Richmond and Culpeper averaged about","Appomattox, Richmond and Culpeper averaged about","Appomattox, Richmond and Culpeper averaged about","Appomattox, Richmond and Culpeper averaged about","was highly variable, slightly above average in the","was highly variable, slightly above average in the","was highly variable, slightly above average in the","was highly variable, slightly above average in the","was highly variable, slightly above average in the","was highly variable, slightly above average in the","was highly variable, slightly above average in the","was highly variable, slightly above average in the","was highly variable, slightly above average in the"
five,degrees,above,normal.,normal.,Only,Only,Buchanan,Buchanan,and,"Roanoke valley and to the north and south, along","Roanoke valley and to the north and south, along","Roanoke valley and to the north and south, along","Roanoke valley and to the north and south, along","Roanoke valley and to the north and south, along","Roanoke valley and to the north and south, along","Roanoke valley and to the north and south, along","Roanoke valley and to the north and south, along","Roanoke valley and to the north and south, along"
Dickinson counties in the Southwest showed slightly,Dickinson counties in the Southwest showed slightly,Dickinson counties in the Southwest showed slightly,Dickinson counties in the Southwest showed slightly,Dickinson counties in the Southwest showed slightly,Dickinson counties in the Southwest showed slightly,Dickinson counties in the Southwest showed slightly,Dickinson counties in the Southwest showed slightly,Dickinson counties in the Southwest showed slightly,Dickinson counties in the Southwest showed slightly,with the south-central piedmont to Richmond. Most,with the south-central piedmont to Richmond. Most,with the south-central piedmont to Richmond. Most,with the south-central piedmont to Richmond. Most,with the south-central piedmont to Richmond. Most,with the south-central piedmont to Richmond. Most,with the south-central piedmont to Richmond. Most,with the south-central piedmont to Richmond. Most,with the south-central piedmont to Richmond. Most
below,average,temperatures.,temperatures.,temperatures.,Precipitation,Precipitation,Precipitation,during,during,other areas averaged 50 to 90 percent of normal,other areas averaged 50 to 90 percent of normal,other areas averaged 50 to 90 percent of normal,other areas averaged 50 to 90 percent of normal,other areas averaged 50 to 90 percent of normal,other areas averaged 50 to 90 percent of normal,other areas averaged 50 to 90 percent of normal,other areas averaged 50 to 90 percent of normal,other areas averaged 50 to 90 percent of normal
November was highly variable; the eastern two thirds,November was highly variable; the eastern two thirds,November was highly variable; the eastern two thirds,November was highly variable; the eastern two thirds,November was highly variable; the eastern two thirds,November was highly variable; the eastern two thirds,November was highly variable; the eastern two thirds,November was highly variable; the eastern two thirds,November was highly variable; the eastern two thirds,November was highly variable; the eastern two thirds,precipitation. February brought with it significantly,precipitation. February brought with it significantly,precipitation. February brought with it significantly,precipitation. February brought with it significantly,precipitation. February brought with it significantly,precipitation. February brought with it significantly,precipitation. February brought with it significantly,precipitation. February brought with it significantly,precipitation. February brought with it significantly
"of the state were 150 to 300 percent above average,","of the state were 150 to 300 percent above average,","of the state were 150 to 300 percent above average,","of the state were 150 to 300 percent above average,","of the state were 150 to 300 percent above average,","of the state were 150 to 300 percent above average,","of the state were 150 to 300 percent above average,","of the state were 150 to 300 percent above average,","of the state were 150 to 300 percent above average,","of the state were 150 to 300 percent above average,","colder weather and, indeed, was the only month","colder weather and, indeed, was the only month","colder weather and, indeed, was the only month","colder weather and, indeed, was the only month","colder weather and, indeed, was the only month","colder weather and, indeed, was the only month","colder weather and, indeed, was the only month","colder weather and, indeed, was the only month","colder weather and, indeed, was the only month"
