"beetle larvae, suggesting a successful establishment.","beetle larvae, suggesting a successful establishment.","beetle larvae, suggesting a successful establishment.","beetle larvae, suggesting a successful establishment.","beetle larvae, suggesting a successful establishment.","beetle larvae, suggesting a successful establishment.","beetle larvae, suggesting a successful establishment.",,,,,,,,,
It can take several years for populations to build up,It can take several years for populations to build up,It can take several years for populations to build up,It can take several years for populations to build up,It can take several years for populations to build up,It can take several years for populations to build up,It can take several years for populations to build up,"We continue to monitor for sudden oak death (SOD),","We continue to monitor for sudden oak death (SOD),","We continue to monitor for sudden oak death (SOD),","We continue to monitor for sudden oak death (SOD),","We continue to monitor for sudden oak death (SOD),","We continue to monitor for sudden oak death (SOD),","We continue to monitor for sudden oak death (SOD),","We continue to monitor for sudden oak death (SOD),","We continue to monitor for sudden oak death (SOD),"
to numbers that are detectable from sampling. It is,to numbers that are detectable from sampling. It is,to numbers that are detectable from sampling. It is,to numbers that are detectable from sampling. It is,to numbers that are detectable from sampling. It is,to numbers that are detectable from sampling. It is,to numbers that are detectable from sampling. It is,which has not been found in a natural forest anywhere,which has not been found in a natural forest anywhere,which has not been found in a natural forest anywhere,which has not been found in a natural forest anywhere,which has not been found in a natural forest anywhere,which has not been found in a natural forest anywhere,which has not been found in a natural forest anywhere,which has not been found in a natural forest anywhere,which has not been found in a natural forest anywhere
"discouraging, however, that the condition of some","discouraging, however, that the condition of some","discouraging, however, that the condition of some","discouraging, however, that the condition of some","discouraging, however, that the condition of some","discouraging, however, that the condition of some","discouraging, however, that the condition of some",in,Virginia,or,the,eastern,U.S.,In,the,previous
hemlock,trees,continue,to,"deteriorate,",while,the,"issue (November 2006), I described a new stream","issue (November 2006), I described a new stream","issue (November 2006), I described a new stream","issue (November 2006), I described a new stream","issue (November 2006), I described a new stream","issue (November 2006), I described a new stream","issue (November 2006), I described a new stream","issue (November 2006), I described a new stream","issue (November 2006), I described a new stream"
HWA population continues to expand to previously,HWA population continues to expand to previously,HWA population continues to expand to previously,HWA population continues to expand to previously,HWA population continues to expand to previously,HWA population continues to expand to previously,HWA population continues to expand to previously,sampling scheme for SOD that has now replaced the,sampling scheme for SOD that has now replaced the,sampling scheme for SOD that has now replaced the,sampling scheme for SOD that has now replaced the,sampling scheme for SOD that has now replaced the,sampling scheme for SOD that has now replaced the,sampling scheme for SOD that has now replaced the,sampling scheme for SOD that has now replaced the,sampling scheme for SOD that has now replaced the
uninfested trees. Although many trees in the park still,uninfested trees. Although many trees in the park still,uninfested trees. Although many trees in the park still,uninfested trees. Although many trees in the park still,uninfested trees. Although many trees in the park still,uninfested trees. Although many trees in the park still,uninfested trees. Although many trees in the park still,collecting of terrestrial leaf samples exhibiting suspect,collecting of terrestrial leaf samples exhibiting suspect,collecting of terrestrial leaf samples exhibiting suspect,collecting of terrestrial leaf samples exhibiting suspect,collecting of terrestrial leaf samples exhibiting suspect,collecting of terrestrial leaf samples exhibiting suspect,collecting of terrestrial leaf samples exhibiting suspect,collecting of terrestrial leaf samples exhibiting suspect,collecting of terrestrial leaf samples exhibiting suspect
"appear healthy and are putting out new growth, some","appear healthy and are putting out new growth, some","appear healthy and are putting out new growth, some","appear healthy and are putting out new growth, some","appear healthy and are putting out new growth, some","appear healthy and are putting out new growth, some","appear healthy and are putting out new growth, some",symptoms. This new sampling scheme is based on the,symptoms. This new sampling scheme is based on the,symptoms. This new sampling scheme is based on the,symptoms. This new sampling scheme is based on the,symptoms. This new sampling scheme is based on the,symptoms. This new sampling scheme is based on the,symptoms. This new sampling scheme is based on the,symptoms. This new sampling scheme is based on the,symptoms. This new sampling scheme is based on the
of them are now so infested that they are unlikely to,of them are now so infested that they are unlikely to,of them are now so infested that they are unlikely to,of them are now so infested that they are unlikely to,of them are now so infested that they are unlikely to,of them are now so infested that they are unlikely to,of them are now so infested that they are unlikely to,"biology of the SOD pathogen, Phytophthora ramorum,","biology of the SOD pathogen, Phytophthora ramorum,","biology of the SOD pathogen, Phytophthora ramorum,","biology of the SOD pathogen, Phytophthora ramorum,","biology of the SOD pathogen, Phytophthora ramorum,","biology of the SOD pathogen, Phytophthora ramorum,","biology of the SOD pathogen, Phytophthora ramorum,","biology of the SOD pathogen, Phytophthora ramorum,","biology of the SOD pathogen, Phytophthora ramorum,"
remain in this condition for long. Even if the beetles,remain in this condition for long. Even if the beetles,remain in this condition for long. Even if the beetles,remain in this condition for long. Even if the beetles,remain in this condition for long. Even if the beetles,remain in this condition for long. Even if the beetles,remain in this condition for long. Even if the beetles,which has spores that swim and are spread by water.,which has spores that swim and are spread by water.,which has spores that swim and are spread by water.,which has spores that swim and are spread by water.,which has spores that swim and are spread by water.,which has spores that swim and are spread by water.,which has spores that swim and are spread by water.,which has spores that swim and are spread by water.,which has spores that swim and are spread by water.
"successfully establish themselves there, the prognosis","successfully establish themselves there, the prognosis","successfully establish themselves there, the prognosis","successfully establish themselves there, the prognosis","successfully establish themselves there, the prognosis","successfully establish themselves there, the prognosis","successfully establish themselves there, the prognosis",There are many native species of Phytophthora that,There are many native species of Phytophthora that,There are many native species of Phytophthora that,There are many native species of Phytophthora that,There are many native species of Phytophthora that,There are many native species of Phytophthora that,There are many native species of Phytophthora that,There are many native species of Phytophthora that,There are many native species of Phytophthora that
,,,,,,,also have waterborne spores; one notable example,also have waterborne spores; one notable example,also have waterborne spores; one notable example,also have waterborne spores; one notable example,also have waterborne spores; one notable example,also have waterborne spores; one notable example,also have waterborne spores; one notable example,also have waterborne spores; one notable example,also have waterborne spores; one notable example
,,,,,,,"is Phytophthora cinnamomi, which causes little leaf","is Phytophthora cinnamomi, which causes little leaf","is Phytophthora cinnamomi, which causes little leaf","is Phytophthora cinnamomi, which causes little leaf","is Phytophthora cinnamomi, which causes little leaf","is Phytophthora cinnamomi, which causes little leaf","is Phytophthora cinnamomi, which causes little leaf","is Phytophthora cinnamomi, which causes little leaf","is Phytophthora cinnamomi, which causes little leaf"
,,,,,,,disease in shortleaf and loblolly pines. It was discovered,disease in shortleaf and loblolly pines. It was discovered,disease in shortleaf and loblolly pines. It was discovered,disease in shortleaf and loblolly pines. It was discovered,disease in shortleaf and loblolly pines. It was discovered,disease in shortleaf and loblolly pines. It was discovered,disease in shortleaf and loblolly pines. It was discovered,disease in shortleaf and loblolly pines. It was discovered,disease in shortleaf and loblolly pines. It was discovered
,,,,,,,that these species can be detected by baiting a stream,that these species can be detected by baiting a stream,that these species can be detected by baiting a stream,that these species can be detected by baiting a stream,that these species can be detected by baiting a stream,that these species can be detected by baiting a stream,that these species can be detected by baiting a stream,that these species can be detected by baiting a stream,that these species can be detected by baiting a stream
,,,,,,,with rhododendron leaves. These leaves are placed in,with rhododendron leaves. These leaves are placed in,with rhododendron leaves. These leaves are placed in,with rhododendron leaves. These leaves are placed in,with rhododendron leaves. These leaves are placed in,with rhododendron leaves. These leaves are placed in,with rhododendron leaves. These leaves are placed in,with rhododendron leaves. These leaves are placed in,with rhododendron leaves. These leaves are placed in
,,,,,,,mesh bags and left in a stream for a couple of weeks.,mesh bags and left in a stream for a couple of weeks.,mesh bags and left in a stream for a couple of weeks.,mesh bags and left in a stream for a couple of weeks.,mesh bags and left in a stream for a couple of weeks.,mesh bags and left in a stream for a couple of weeks.,mesh bags and left in a stream for a couple of weeks.,mesh bags and left in a stream for a couple of weeks.,mesh bags and left in a stream for a couple of weeks.
,,,,,,,"When the leaves are collected, they often contain","When the leaves are collected, they often contain","When the leaves are collected, they often contain","When the leaves are collected, they often contain","When the leaves are collected, they often contain","When the leaves are collected, they often contain","When the leaves are collected, they often contain","When the leaves are collected, they often contain","When the leaves are collected, they often contain"
,,,,,,,black spots about 1⁄4 inch in diameter that indicate an,black spots about 1⁄4 inch in diameter that indicate an,black spots about 1⁄4 inch in diameter that indicate an,black spots about 1⁄4 inch in diameter that indicate an,black spots about 1⁄4 inch in diameter that indicate an,black spots about 1⁄4 inch in diameter that indicate an,black spots about 1⁄4 inch in diameter that indicate an,black spots about 1⁄4 inch in diameter that indicate an,black spots about 1⁄4 inch in diameter that indicate an
,,,,,,,infection site. It’s not possible to tell what species of,infection site. It’s not possible to tell what species of,infection site. It’s not possible to tell what species of,infection site. It’s not possible to tell what species of,infection site. It’s not possible to tell what species of,infection site. It’s not possible to tell what species of,infection site. It’s not possible to tell what species of,infection site. It’s not possible to tell what species of,infection site. It’s not possible to tell what species of
,,,,,,,Phtyophthora caused the infection by simply looking,Phtyophthora caused the infection by simply looking,Phtyophthora caused the infection by simply looking,Phtyophthora caused the infection by simply looking,Phtyophthora caused the infection by simply looking,Phtyophthora caused the infection by simply looking,Phtyophthora caused the infection by simply looking,Phtyophthora caused the infection by simply looking,Phtyophthora caused the infection by simply looking
,,,,,,,"at the spots, but the leaf tissue can be isolated in","at the spots, but the leaf tissue can be isolated in","at the spots, but the leaf tissue can be isolated in","at the spots, but the leaf tissue can be isolated in","at the spots, but the leaf tissue can be isolated in","at the spots, but the leaf tissue can be isolated in","at the spots, but the leaf tissue can be isolated in","at the spots, but the leaf tissue can be isolated in","at the spots, but the leaf tissue can be isolated in"
,,,,,,,a laboratory and the species can be identified by,a laboratory and the species can be identified by,a laboratory and the species can be identified by,a laboratory and the species can be identified by,a laboratory and the species can be identified by,a laboratory and the species can be identified by,a laboratory and the species can be identified by,a laboratory and the species can be identified by,a laboratory and the species can be identified by
,,,,,,,DNA analysis. This procedure will work equally well,DNA analysis. This procedure will work equally well,DNA analysis. This procedure will work equally well,DNA analysis. This procedure will work equally well,DNA analysis. This procedure will work equally well,DNA analysis. This procedure will work equally well,DNA analysis. This procedure will work equally well,DNA analysis. This procedure will work equally well,DNA analysis. This procedure will work equally well
,,,,,,,if Phytophthora ramorum is present in our streams. If,if Phytophthora ramorum is present in our streams. If,if Phytophthora ramorum is present in our streams. If,if Phytophthora ramorum is present in our streams. If,if Phytophthora ramorum is present in our streams. If,if Phytophthora ramorum is present in our streams. If,if Phytophthora ramorum is present in our streams. If,if Phytophthora ramorum is present in our streams. If,if Phytophthora ramorum is present in our streams. If
,,,,,,,"it is present in the streams, that means it is present","it is present in the streams, that means it is present","it is present in the streams, that means it is present","it is present in the streams, that means it is present","it is present in the streams, that means it is present","it is present in the streams, that means it is present","it is present in the streams, that means it is present","it is present in the streams, that means it is present","it is present in the streams, that means it is present"
,,,,,,,in the woods. By sampling downstream of a large,in the woods. By sampling downstream of a large,in the woods. By sampling downstream of a large,in the woods. By sampling downstream of a large,in the woods. By sampling downstream of a large,in the woods. By sampling downstream of a large,in the woods. By sampling downstream of a large,in the woods. By sampling downstream of a large,in the woods. By sampling downstream of a large
,,,,,,,"watershed, samples taken in this way can represent","watershed, samples taken in this way can represent","watershed, samples taken in this way can represent","watershed, samples taken in this way can represent","watershed, samples taken in this way can represent","watershed, samples taken in this way can represent","watershed, samples taken in this way can represent","watershed, samples taken in this way can represent","watershed, samples taken in this way can represent"
,,,,,,,"5,000 to 10,000 acres each, which is a more efficient","5,000 to 10,000 acres each, which is a more efficient","5,000 to 10,000 acres each, which is a more efficient","5,000 to 10,000 acres each, which is a more efficient","5,000 to 10,000 acres each, which is a more efficient","5,000 to 10,000 acres each, which is a more efficient","5,000 to 10,000 acres each, which is a more efficient","5,000 to 10,000 acres each, which is a more efficient","5,000 to 10,000 acres each, which is a more efficient"
,,,,,,,way to sample a large area for the presence of this,way to sample a large area for the presence of this,way to sample a large area for the presence of this,way to sample a large area for the presence of this,way to sample a large area for the presence of this,way to sample a large area for the presence of this,way to sample a large area for the presence of this,way to sample a large area for the presence of this,way to sample a large area for the presence of this
,,,,,,,pathogen.,,,,,,,,
,,,,,,,,,"“Every man, wherever he goes, is","“Every man, wherever he goes, is","“Every man, wherever he goes, is","“Every man, wherever he goes, is","“Every man, wherever he goes, is","“Every man, wherever he goes, is","“Every man, wherever he goes, is"
,,,,,,,,encompassed by a cloud of comforting,encompassed by a cloud of comforting,encompassed by a cloud of comforting,encompassed by a cloud of comforting,encompassed by a cloud of comforting,encompassed by a cloud of comforting,encompassed by a cloud of comforting,encompassed by a cloud of comforting
,,,,,,,"convictions, which move with him like flies on","convictions, which move with him like flies on","convictions, which move with him like flies on","convictions, which move with him like flies on","convictions, which move with him like flies on","convictions, which move with him like flies on","convictions, which move with him like flies on","convictions, which move with him like flies on","convictions, which move with him like flies on"
,,,,,,,,,,,,a summer day.”,a summer day.”,a summer day.”,a summer day.”
,,,,,,,,,,,"Bertrand Russell, 1928","Bertrand Russell, 1928","Bertrand Russell, 1928","Bertrand Russell, 1928","Bertrand Russell, 1928"
,,,,,,,,,,,,,,,
UPDATES,UPDATES,UPDATES,
,,,Invasive Plant
,,,Interpretive Trail
,,,As a follow up to some of the Ailanthus control work
,,Tree of Heaven,"around the Central Office, we are going to need to"
,,,combat some other encroaching invasive weeds before
"In the April 2006 issue of the Forest Health Review,","In the April 2006 issue of the Forest Health Review,","In the April 2006 issue of the Forest Health Review,",restoring these sites to a more natural condition. These
I talked about some of the work we are doing with,I talked about some of the work we are doing with,I talked about some of the work we are doing with,"weeds include multiflora rose, Japanese honeysuckle,"
Ailanthus altissima – potential uses and markets for,Ailanthus altissima – potential uses and markets for,Ailanthus altissima – potential uses and markets for,"oriental bittersweet and autumn olive, among others."
the wood and control strategies. We will continue with,the wood and control strategies. We will continue with,the wood and control strategies. We will continue with,"In addition, we are planning on establishing an invasive"
"that work this year. In particular, we will continue to","that work this year. In particular, we will continue to","that work this year. In particular, we will continue to",species interpretive trail in the woods surrounding
kill and remove Ailanthus from locations surrounding,kill and remove Ailanthus from locations surrounding,kill and remove Ailanthus from locations surrounding,Central Office. This trail will overlap a pre-existing
"our Central Office in Charlottesville, as well as some","our Central Office in Charlottesville, as well as some","our Central Office in Charlottesville, as well as some",interpretive trail that highlights different facets of the
other locations. Some of the wood from these trees,other locations. Some of the wood from these trees,other locations. Some of the wood from these trees,forest and its ecology. Because we have an abundance
will be sawn into boards and sent to Virginia Tech,will be sawn into boards and sent to Virginia Tech,will be sawn into boards and sent to Virginia Tech,of about 12 to 15 very common invasive plants all
for study of wood properties and optimum kiln drying,for study of wood properties and optimum kiln drying,for study of wood properties and optimum kiln drying,"along the trail, this provides an excellent opportunity"
"schedules. Last year, we treated Ailanthus with Garlon","schedules. Last year, we treated Ailanthus with Garlon","schedules. Last year, we treated Ailanthus with Garlon",to educate the public on recognizing these weeds
"IV during June and July, with very little re-sprouting","IV during June and July, with very little re-sprouting","IV during June and July, with very little re-sprouting",and understanding their impacts on Virginia’s forests.
"apparent (see Forest Research Review, March 2007),","apparent (see Forest Research Review, March 2007),","apparent (see Forest Research Review, March 2007),","The trail will consist of red wooden posts with letters,"
although a final resprouting check will occur in May.,although a final resprouting check will occur in May.,although a final resprouting check will occur in May.,each post associated with a different weed species or
"This year, we treated some trees during March. Garlon","This year, we treated some trees during March. Garlon","This year, we treated some trees during March. Garlon",the same weed at varying stages of encroachment.
has already been established as effective when applied,has already been established as effective when applied,has already been established as effective when applied,A trail guide will be available containing a narrative
during the winter. It will be interesting and significant to,during the winter. It will be interesting and significant to,during the winter. It will be interesting and significant to,and photographs to go along with each lettered post.
see whether effective,see whether effective,see whether effective,People hiking the trail with the guide will quickly
control,with,Garlon,learn to recognize these weeds and see how truly
can be achieved during,can be achieved during,can be achieved during,ubiquitous they are. The goal is to provide the public
ANY time of year.,ANY time of year.,ANY time of year.,with an understanding of the detrimental effects these
,,,invasive plants have on the health of our forests and
,,,to perhaps encourage them to manage or eliminate
,,,these weeds from their own property. It might also
,,,discourage them from purchasing and propagating
,,,"some popular gardening plants, such as English Ivy,"
,,,which has become a significant problem.
"“No one means all he says, and yet very few","“No one means all he says, and yet very few","“No one means all he says, and yet very few",
"say all they mean, for words are slippery and","say all they mean, for words are slippery and","say all they mean, for words are slippery and",A forest floor near Charlottesville carpeted with periwinkle
thought is viscous.”,thought is viscous.”,thought is viscous.”,"(Vinca minor), a non-native invasive weed."
"Henry Brooks Adams, 1907","Henry Brooks Adams, 1907","Henry Brooks Adams, 1907",
,,,
Fall Cankerworm,Fall Cankerworm,Fall Cankerworm,Fall Cankerworm,Fall Cankerworm,Fall Cankerworm,Fall Cankerworm,,,,,,,
Outbreaks in Virginia,Outbreaks in Virginia,Outbreaks in Virginia,Outbreaks in Virginia,Outbreaks in Virginia,Outbreaks in Virginia,Outbreaks in Virginia,Outbreaks in Virginia,Outbreaks in Virginia,,,,,
The fall cankerworm (Alsophila pometaria) is a very,The fall cankerworm (Alsophila pometaria) is a very,The fall cankerworm (Alsophila pometaria) is a very,The fall cankerworm (Alsophila pometaria) is a very,The fall cankerworm (Alsophila pometaria) is a very,The fall cankerworm (Alsophila pometaria) is a very,The fall cankerworm (Alsophila pometaria) is a very,"same locations, perhaps due in part to the tendency","same locations, perhaps due in part to the tendency","same locations, perhaps due in part to the tendency","same locations, perhaps due in part to the tendency","same locations, perhaps due in part to the tendency","same locations, perhaps due in part to the tendency","same locations, perhaps due in part to the tendency"
"common spring defoliator. Next to the gypsy moth, it is","common spring defoliator. Next to the gypsy moth, it is","common spring defoliator. Next to the gypsy moth, it is","common spring defoliator. Next to the gypsy moth, it is","common spring defoliator. Next to the gypsy moth, it is","common spring defoliator. Next to the gypsy moth, it is","common spring defoliator. Next to the gypsy moth, it is",of females to lay eggs on the same trees on which,of females to lay eggs on the same trees on which,of females to lay eggs on the same trees on which,of females to lay eggs on the same trees on which,of females to lay eggs on the same trees on which,of females to lay eggs on the same trees on which,of females to lay eggs on the same trees on which
