Annual Report at http://www.pinemap.org/reports/,Annual Report at http://www.pinemap.org/reports/,Annual Report at http://www.pinemap.org/reports/,Annual Report at http://www.pinemap.org/reports/,Annual Report at http://www.pinemap.org/reports/,Annual Report at http://www.pinemap.org/reports/,Annual Report at http://www.pinemap.org/reports/,"sulfur, polymers or other products that release the urea slowly - either","sulfur, polymers or other products that release the urea slowly - either","sulfur, polymers or other products that release the urea slowly - either","sulfur, polymers or other products that release the urea slowly - either","sulfur, polymers or other products that release the urea slowly - either","sulfur, polymers or other products that release the urea slowly - either","sulfur, polymers or other products that release the urea slowly - either","sulfur, polymers or other products that release the urea slowly - either","sulfur, polymers or other products that release the urea slowly - either"
annual-reports/PINEMAP_Year_2_Annual_Report_,annual-reports/PINEMAP_Year_2_Annual_Report_,annual-reports/PINEMAP_Year_2_Annual_Report_,annual-reports/PINEMAP_Year_2_Annual_Report_,annual-reports/PINEMAP_Year_2_Annual_Report_,annual-reports/PINEMAP_Year_2_Annual_Report_,annual-reports/PINEMAP_Year_2_Annual_Report_,when penetrated by water or when broken down. This test compares,when penetrated by water or when broken down. This test compares,when penetrated by water or when broken down. This test compares,when penetrated by water or when broken down. This test compares,when penetrated by water or when broken down. This test compares,when penetrated by water or when broken down. This test compares,when penetrated by water or when broken down. This test compares,when penetrated by water or when broken down. This test compares,when penetrated by water or when broken down. This test compares
FINAL.pdf.,FINAL.pdf.,,,,,,"urea, CUF, NBPT and CUF+ NBPT.","urea, CUF, NBPT and CUF+ NBPT.","urea, CUF, NBPT and CUF+ NBPT.","urea, CUF, NBPT and CUF+ NBPT.",We are also investigating the,We are also investigating the,We are also investigating the,We are also investigating the,We are also investigating the
,,,,,,,"seasonal timing of fertilization, which is traditionally conducted in","seasonal timing of fertilization, which is traditionally conducted in","seasonal timing of fertilization, which is traditionally conducted in","seasonal timing of fertilization, which is traditionally conducted in","seasonal timing of fertilization, which is traditionally conducted in","seasonal timing of fertilization, which is traditionally conducted in","seasonal timing of fertilization, which is traditionally conducted in","seasonal timing of fertilization, which is traditionally conducted in","seasonal timing of fertilization, which is traditionally conducted in"
The first update reveals nitrogen applied in fertilizer is,The first update reveals nitrogen applied in fertilizer is,The first update reveals nitrogen applied in fertilizer is,The first update reveals nitrogen applied in fertilizer is,The first update reveals nitrogen applied in fertilizer is,The first update reveals nitrogen applied in fertilizer is,The first update reveals nitrogen applied in fertilizer is,late winter or early spring when plant-available nitrogen may not,late winter or early spring when plant-available nitrogen may not,late winter or early spring when plant-available nitrogen may not,late winter or early spring when plant-available nitrogen may not,late winter or early spring when plant-available nitrogen may not,late winter or early spring when plant-available nitrogen may not,late winter or early spring when plant-available nitrogen may not,late winter or early spring when plant-available nitrogen may not,late winter or early spring when plant-available nitrogen may not
being taken up by trees throughout the growing season,being taken up by trees throughout the growing season,being taken up by trees throughout the growing season,being taken up by trees throughout the growing season,being taken up by trees throughout the growing season,being taken up by trees throughout the growing season,being taken up by trees throughout the growing season,"be as limiting as during summer months. Finally, we are examining","be as limiting as during summer months. Finally, we are examining","be as limiting as during summer months. Finally, we are examining","be as limiting as during summer months. Finally, we are examining","be as limiting as during summer months. Finally, we are examining","be as limiting as during summer months. Finally, we are examining","be as limiting as during summer months. Finally, we are examining","be as limiting as during summer months. Finally, we are examining","be as limiting as during summer months. Finally, we are examining"
(primarily into the leaves) and that more is available,(primarily into the leaves) and that more is available,(primarily into the leaves) and that more is available,(primarily into the leaves) and that more is available,(primarily into the leaves) and that more is available,(primarily into the leaves) and that more is available,(primarily into the leaves) and that more is available,how much fertilizer-derived nitrogen is retained by understory,how much fertilizer-derived nitrogen is retained by understory,how much fertilizer-derived nitrogen is retained by understory,how much fertilizer-derived nitrogen is retained by understory,how much fertilizer-derived nitrogen is retained by understory,how much fertilizer-derived nitrogen is retained by understory,how much fertilizer-derived nitrogen is retained by understory,how much fertilizer-derived nitrogen is retained by understory,how much fertilizer-derived nitrogen is retained by understory
when fertilizer is applied in the winter instead of the,when fertilizer is applied in the winter instead of the,when fertilizer is applied in the winter instead of the,when fertilizer is applied in the winter instead of the,when fertilizer is applied in the winter instead of the,when fertilizer is applied in the winter instead of the,when fertilizer is applied in the winter instead of the,competition.,These research initiatives are collectively trying to,These research initiatives are collectively trying to,These research initiatives are collectively trying to,These research initiatives are collectively trying to,These research initiatives are collectively trying to,These research initiatives are collectively trying to,These research initiatives are collectively trying to,These research initiatives are collectively trying to
summer. The results from the second - if verified –,summer. The results from the second - if verified –,summer. The results from the second - if verified –,summer. The results from the second - if verified –,summer. The results from the second - if verified –,summer. The results from the second - if verified –,summer. The results from the second - if verified –,allow more nitrogen derived from fertilizer to enter crop trees while,allow more nitrogen derived from fertilizer to enter crop trees while,allow more nitrogen derived from fertilizer to enter crop trees while,allow more nitrogen derived from fertilizer to enter crop trees while,allow more nitrogen derived from fertilizer to enter crop trees while,allow more nitrogen derived from fertilizer to enter crop trees while,allow more nitrogen derived from fertilizer to enter crop trees while,allow more nitrogen derived from fertilizer to enter crop trees while,allow more nitrogen derived from fertilizer to enter crop trees while
tell us we have been significantly overestimating the,tell us we have been significantly overestimating the,tell us we have been significantly overestimating the,tell us we have been significantly overestimating the,tell us we have been significantly overestimating the,tell us we have been significantly overestimating the,tell us we have been significantly overestimating the,reducing overall losses from the system.,reducing overall losses from the system.,reducing overall losses from the system.,reducing overall losses from the system.,reducing overall losses from the system.,,,,
,impacts of forests on carbon sequestration.,impacts of forests on carbon sequestration.,impacts of forests on carbon sequestration.,impacts of forests on carbon sequestration.,impacts of forests on carbon sequestration.,impacts of forests on carbon sequestration.,,,,,,,,,
,,,,,,,Eighteen sites were established in 2011 and 2012 across the entire,Eighteen sites were established in 2011 and 2012 across the entire,Eighteen sites were established in 2011 and 2012 across the entire,Eighteen sites were established in 2011 and 2012 across the entire,Eighteen sites were established in 2011 and 2012 across the entire,Eighteen sites were established in 2011 and 2012 across the entire,Eighteen sites were established in 2011 and 2012 across the entire,Eighteen sites were established in 2011 and 2012 across the entire,Eighteen sites were established in 2011 and 2012 across the entire
,,,,,,,region of loblolly pine plantations in the southern United States.,region of loblolly pine plantations in the southern United States.,region of loblolly pine plantations in the southern United States.,region of loblolly pine plantations in the southern United States.,region of loblolly pine plantations in the southern United States.,region of loblolly pine plantations in the southern United States.,region of loblolly pine plantations in the southern United States.,region of loblolly pine plantations in the southern United States.,region of loblolly pine plantations in the southern United States.
,,,,,,,Five fertilizer treatments (including a control with no fertilizer,Five fertilizer treatments (including a control with no fertilizer,Five fertilizer treatments (including a control with no fertilizer,Five fertilizer treatments (including a control with no fertilizer,Five fertilizer treatments (including a control with no fertilizer,Five fertilizer treatments (including a control with no fertilizer,Five fertilizer treatments (including a control with no fertilizer,Five fertilizer treatments (including a control with no fertilizer,Five fertilizer treatments (including a control with no fertilizer
,,,,,,,application) were administered at two different times (late winter,application) were administered at two different times (late winter,application) were administered at two different times (late winter,application) were administered at two different times (late winter,application) were administered at two different times (late winter,application) were administered at two different times (late winter,application) were administered at two different times (late winter,application) were administered at two different times (late winter,application) were administered at two different times (late winter
,,,,,,,"and summer) in 2011, and once in 2012 (late winter) in","and summer) in 2011, and once in 2012 (late winter) in","and summer) in 2011, and once in 2012 (late winter) in","and summer) in 2011, and once in 2012 (late winter) in","and summer) in 2011, and once in 2012 (late winter) in","and summer) in 2011, and once in 2012 (late winter) in","and summer) in 2011, and once in 2012 (late winter) in","and summer) in 2011, and once in 2012 (late winter) in","and summer) in 2011, and once in 2012 (late winter) in"
,,,,,,,,,100 sq. meter circular plots having similar,100 sq. meter circular plots having similar,100 sq. meter circular plots having similar,100 sq. meter circular plots having similar,100 sq. meter circular plots having similar,100 sq. meter circular plots having similar,100 sq. meter circular plots having similar
,,,,,,,,,,,,characteristics.,characteristics.,characteristics.,The
4,,,,,,,,,,,,,,,
