,Figure 2. A root exclusion core being excavated,Figure 2. A root exclusion core being excavated,Figure 2. A root exclusion core being excavated,Figure 2. A root exclusion core being excavated,Figure 2. A root exclusion core being excavated,Figure 2. A root exclusion core being excavated,Figure 2. A root exclusion core being excavated,adjacent to the cores. This suggests that the assumed partitioning,adjacent to the cores. This suggests that the assumed partitioning,adjacent to the cores. This suggests that the assumed partitioning,adjacent to the cores. This suggests that the assumed partitioning,adjacent to the cores. This suggests that the assumed partitioning,adjacent to the cores. This suggests that the assumed partitioning,adjacent to the cores. This suggests that the assumed partitioning,adjacent to the cores. This suggests that the assumed partitioning,adjacent to the cores. This suggests that the assumed partitioning
,after a 90-day installation so that roots can be,after a 90-day installation so that roots can be,after a 90-day installation so that roots can be,after a 90-day installation so that roots can be,after a 90-day installation so that roots can be,after a 90-day installation so that roots can be,after a 90-day installation so that roots can be,of RS into equal proportions of RH and RA may overestimate the,of RS into equal proportions of RH and RA may overestimate the,of RS into equal proportions of RH and RA may overestimate the,of RS into equal proportions of RH and RA may overestimate the,of RS into equal proportions of RH and RA may overestimate the,of RS into equal proportions of RH and RA may overestimate the,of RS into equal proportions of RH and RA may overestimate the,of RS into equal proportions of RH and RA may overestimate the,of RS into equal proportions of RH and RA may overestimate the
,collected for analysis. Photo by Brett Heim.,collected for analysis. Photo by Brett Heim.,collected for analysis. Photo by Brett Heim.,collected for analysis. Photo by Brett Heim.,collected for analysis. Photo by Brett Heim.,collected for analysis. Photo by Brett Heim.,,amount of carbon stored in these systems. It will be important to,amount of carbon stored in these systems. It will be important to,amount of carbon stored in these systems. It will be important to,amount of carbon stored in these systems. It will be important to,amount of carbon stored in these systems. It will be important to,amount of carbon stored in these systems. It will be important to,amount of carbon stored in these systems. It will be important to,amount of carbon stored in these systems. It will be important to,amount of carbon stored in these systems. It will be important to
,,,,,,,,"monitor changes in this partitioning, however, to better understand","monitor changes in this partitioning, however, to better understand","monitor changes in this partitioning, however, to better understand","monitor changes in this partitioning, however, to better understand","monitor changes in this partitioning, however, to better understand","monitor changes in this partitioning, however, to better understand","monitor changes in this partitioning, however, to better understand","monitor changes in this partitioning, however, to better understand","monitor changes in this partitioning, however, to better understand"
,,,,,,,,how forest management can optimize ecosystem carbon storage,how forest management can optimize ecosystem carbon storage,how forest management can optimize ecosystem carbon storage,how forest management can optimize ecosystem carbon storage,how forest management can optimize ecosystem carbon storage,how forest management can optimize ecosystem carbon storage,how forest management can optimize ecosystem carbon storage,how forest management can optimize ecosystem carbon storage,how forest management can optimize ecosystem carbon storage
,,,,,,,,under predicted increases in climate variability.,under predicted increases in climate variability.,under predicted increases in climate variability.,under predicted increases in climate variability.,under predicted increases in climate variability.,under predicted increases in climate variability.,,,
6,,,,,,,,,,,,,,,,
