Name: “Table 1 of 1 on page 16 of 74”,Name: “Table 1 of 1 on page 16 of 74”,Name: “Table 1 of 1 on page 16 of 74”,Name: “Table 1 of 1 on page 16 of 74”,Name: “Table 1 of 1 on page 16 of 74”,Name: “Table 1 of 1 on page 16 of 74”,Name: “Table 1 of 1 on page 16 of 74”,Name: “Table 1 of 1 on page 16 of 74”,Name: “Table 1 of 1 on page 16 of 74”,Name: “Table 1 of 1 on page 16 of 74”,Name: “Table 1 of 1 on page 16 of 74”,Name: “Table 1 of 1 on page 16 of 74”,Name: “Table 1 of 1 on page 16 of 74”,Name: “Table 1 of 1 on page 16 of 74”,Name: “Table 1 of 1 on page 16 of 74”,Name: “Table 1 of 1 on page 16 of 74”,Name: “Table 1 of 1 on page 16 of 74”,Name: “Table 1 of 1 on page 16 of 74”,Name: “Table 1 of 1 on page 16 of 74”,Name: “Table 1 of 1 on page 16 of 74”,Name: “Table 1 of 1 on page 16 of 74”,Name: “Table 1 of 1 on page 16 of 74”,Name: “Table 1 of 1 on page 16 of 74”,Name: “Table 1 of 1 on page 16 of 74”,Name: “Table 1 of 1 on page 16 of 74”,Name: “Table 1 of 1 on page 16 of 74”,Name: “Table 1 of 1 on page 16 of 74”,Name: “Table 1 of 1 on page 16 of 74”,Name: “Table 1 of 1 on page 16 of 74”
Table: 16,Table: 16,Table: 16,Table: 16,Table: 16,Table: 16,Table: 16,Table: 16,Table: 16,Table: 16,Table: 16,Table: 16,Table: 16,Table: 16,Table: 16,Table: 16,Table: 16,Table: 16,Table: 16,Table: 16,Table: 16,Table: 16,Table: 16,Table: 16,Table: 16,Table: 16,Table: 16,Table: 16,Table: 16
,,,,,,,,,,,,,,,,,,,,,,,,,,,,
Growing-stock,Growing-stock,Growing-stock,Growing-stock,,t r e e s .,t r e e s .,,L i v e,L i v e,s a w t i m b e r -,s a w t i m b e r -,s a w t i m b e r -,s a w t i m b e r -,,S o f t,,hardwoods.,hardwoods.,hardwoods.,hardwoods.,,S o f r - t e x t u r e d,S o f r - t e x t u r e d,S o f r - t e x t u r e d,S o f r - t e x t u r e d,h a r d -,h a r d -,
s i z e,t r e e s,t r e e s,o f,,commercial,commercial,commercial,commercial,commercial,s p e c i e s,s p e c i e s,s p e c i e s,con-,con-,woods,woods,s u c h,s u c h,s u c h,a s,"b o x e l d e r ,","b o x e l d e r ,","b o x e l d e r ,",r e d,,and,,
t a i n i n g,t a i n i n g,a t,l e a s t,l e a s t,l e a s t,a,1 2 - f o o t,1 2 - f o o t,1 2 - f o o t,,"l o g ,",,o r,two,s i l v e r,s i l v e r,,"maples,","maples,","maples,","hackberry,","hackberry,","hackberry,","hackberry,",l o b l o l l y -,l o b l o l l y -,l o b l o l l y -,
n o n c o n t i g u o u s,n o n c o n t i g u o u s,n o n c o n t i g u o u s,n o n c o n t i g u o u s,,saw,,l o g s,l o g s,e a c h,e a c h,8,f e e t,f e e t,o r,"b a y ,",,"sweetgum,","sweetgum,","sweetgum,","sweetgum,",y e l l o w - p o p l a r,y e l l o w - p o p l a r,y e l l o w - p o p l a r,y e l l o w - p o p l a r,,", magno-",", magno-",", magno-"
"l o n g e r ,","l o n g e r ,",m e e t i n g,m e e t i n g,m e e t i n g,,mininum,mininum,mininum,,g r a d e,g r a d e,r e q u i r e -,r e q u i r e -,r e q u i r e -,"l i a ,",,"s r e e t b a y ,","s r e e t b a y ,","s r e e t b a y ,","s r e e t b a y ,",water,water,water,"t u p e l o ,","t u p e l o ,",black-,black-,
m e n t s,,(hardwoods,(hardwoods,(hardwoods,(hardwoods,must,must,,q u a l i f y,q u a l i f y,q u a l i f y,a s,a,l o g,"gum,",,"s y c a m o r e ,","s y c a m o r e ,","s y c a m o r e ,","s y c a m o r e ,","c o t t o n w o o d ,","c o t t o n w o o d ,","c o t t o n w o o d ,","c o t t o n w o o d ,",b l a c k,b l a c k,,
g r a d e,,o f,e i t h e r,e i t h e r,e i t h e r,3,o r,4 ;,,s o f t w o o d s,s o f t w o o d s,s o f t w o o d s,,must,"c h e r r y ,","c h e r r y ,","c h e r r y ,",,"w i l ? o w ,","w i l ? o w ,",,"basswood,","basswood,","basswood,",and,e l m .,e l m .,
q u a l i f y,q u a l i f y,a s,a,log,log,,grade,grade,3 ),w i t h,w i t h,,a t,l e a s t,,,,,,,,,,,,,,
one-third,one-third,,o f,the,the,,g r o s s,g r o s s,board-foot,board-foot,board-foot,board-foot,,,Hard,,hardwoods.,hardwoods.,hardwoods.,hardwoods.,,H a r d - t s x t u r e d,H a r d - t s x t u r e d,H a r d - t s x t u r e d,H a r d - t s x t u r e d,h a r d -,h a r d -,
volume,volume,( I n t e r n a t i o n a l,( I n t e r n a t i o n a l,( I n t e r n a t i o n a l,( I n t e r n a t i o n a l,( I n t e r n a t i o n a l,( I n t e r n a t i o n a l,,1 1 4 - i n c h,1 1 4 - i n c h,1 1 4 - i n c h,,r u l e ),,wcods,wcods,s u c h,s u c h,s u c h,a s,s u g a r,s u g a r,,"m a p l e ,","b i r c h ,","b i r c h ,",,
between,between,a,1 - f o o t,1 - f o o t,1 - f o o t,,stump,stump,and,,t h e,minimum,minimum,minimum,"h i c k o r y ,","h i c k o r y ,","h i c k o r y ,","h i c k o r y ,","dogwood,","dogwood,","dogwood,",,p e r s i m o n,p e r s i m o n,,( f o r e s t,( f o r e s t,
saw-log,saw-log,t o p,,b e i n g,b e i n g,,"s o u n d ,","s o u n d ,","s o u n d ,",o r,a,l i v e,l i v e,,"grcwnf,","grcwnf,","grcwnf,",,b l a c k,,"l o c u s t ,","l o c u s t ,","l o c u s t ,","b e e c h ,","b e e c h ,","a s h ,",,
t r e e,below,below,s a w t i m b e r,s a w t i m b e r,s a w t i m b e r,s a w t i m b e r,s a w t i m b e r,s i z e,s i z e,t h a t,t h a t,w i l l,w i l l,,"honeylocust,","honeylocust,","honeylocust,","honeylocust,","honeylocust,","hol?y,","hol?y,","hol?y,",,black,"walnut,","walnut,",,
p r o s p e c t i v e l y,p r o s p e c t i v e l y,p r o s p e c t i v e l y,p r o s p e c t i v e l y,,q u a l i f y,q u a l i f y,q u a l i f y,u n d e r,u n d e r,u n d e r,t h e,,above,above,"m u l b e r r y ,","m u l b e r r y ,","m u l b e r r y ,","m u l b e r r y ,",and,,a l l,,c o r m e r c i a l,c o r m e r c i a l,c o r m e r c i a l,o a k s .,o a k s .,
standards.,standards.,standards.,,,,,,,,,,,,,,,,,,,,,,,,,,
,,,,,,,,,,,,,,,I d l e,f a r m l a n d .,f a r m l a n d .,f a r m l a n d .,f a r m l a n d .,Land,Land,,i n c l u d i n g,i n c l u d i n g,,f o r m e r,f o r m e r,
Desirable,Desirable,Desirable,,tree.,tree.,,A,tree,tree,t h a t,t h a t,qualifies,qualifies,qualifies,"c r o p l a n d ,","c r o p l a n d ,","c r o p l a n d ,",,"o r c h a r d ,","o r c h a r d ,","o r c h a r d ,",improved,improved,improved,"p a s t u r e ,","p a s t u r e ,","p a s t u r e ,",
a s,g r o w i n g,g r o w i n g,g r o w i n g,s t o c k,s t o c k,s t o c k,and,and,h a s,,n o,s e r i o u s,s e r i o u s,s e r i o u s,and,f a r m,,s i t e s,s i t e s,n o t,n o t,t e n d e d,t e n d e d,w i t h i n,w i t h i n,t h e,t h e,
defects,defects,defects,i n,quality,quality,quality,quality,limiting,limiting,limiting,limiting,present,present,present,p a s t,2,"y e a r s ,","y e a r s ,","y e a r s ,",and,,c u r r e n t l y,c u r r e n t l y,c u r r e n t l y,l e s s,t h a n,t h a n,
o r,p r o s p e c t i v e,p r o s p e c t i v e,p r o s p e c t i v e,p r o s p e c t i v e,p r o s p e c t i v e,u s e ;,u s e ;,,i s,of,r e l a t i v e l y,r e l a t i v e l y,r e l a t i v e l y,r e l a t i v e l y,16.7,p e r c e n t,p e r c e n t,p e r c e n t,p e r c e n t,stocked,stocked,stocked,w i t h,l i v e,l i v e,t r e e s .,t r e e s .,
h i g h,h i g h,v i g o r,v i g o r,( 3 0,( 3 0,,p e r c e n t,p e r c e n t,p e r c e n t,o r,more,more,l i v e,l i v e,,,,,,,,,,,,,,
crown,crown,r a t i o ) ;,r a t i o ) ;,r a t i o ) ;,,i s,c o m p a t i b l e,c o m p a t i b l e,c o m p a t i b l e,c o m p a t i b l e,c o m p a t i b l e,w i t h,w i t h,t h e,Improved,Improved,,p a s t u r e .,p a s t u r e .,p a s t u r e .,,Land,Land,c u r r e n t l y,c u r r e n t l y,,,
s i t e,s i t e,and,p h y s i o g r a p h i c,p h y s i o g r a p h i c,p h y s i o g r a p h i c,p h y s i o g r a p h i c,p h y s i o g r a p h i c,p h y s i o g r a p h i c,p h y s i o g r a p h i c,c l a s s ;,c l a s s ;,,h a s,a,improved,improved,,f o r,f o r,g r a z i n g,g r a z i n g,g r a z i n g,by,"c u l t i v a t i o n ,","c u l t i v a t i o n ,","c u l t i v a t i o n ,","c u l t i v a t i o n ,",
t o t a l,t o t a l,board-fooc,board-fooc,board-fooc,board-fooc,board-fooc,l o s s,l o s s,,n o t,t o,,exceed,exceed,"seeding,","seeding,",,"i r r i g a t i o n ,","i r r i g a t i o n ,","i r r i g a t i o n ,","i r r i g a t i o n ,","i r r i g a t i o n ,",o r,c l e a r i n g,c l e a r i n g,of,,
1 5,p e r c e n t,p e r c e n t,p e r c e n t,i n,,s o f t w o o d s,s o f t w o o d s,s o f t w o o d s,s o f t w o o d s,o r,,25,p e r c e n t,p e r c e n t,trees,or,,brush.,brush.,,,,,,,,,
i n,hardwoods,hardwoods,hardwoods,hardwoods,a s,,a,r e s u l t,r e s u l t,,o f,s e v e r e,s e v e r e,,,,,,,,,,,,,,,
"sweep,","sweep,",,"c r o o k ,","c r o o k ,",,o r,l e a n ;,l e a n ;,l e a n ;,and,,h a s,a,,I n d i a n,,l a n d .,l a n d .,l a n d .,A l l,l a n d s,l a n d s,l a n d s,h e l d,i n,t r u s t,t r u s t,by
r e l a t i v e l y,r e l a t i v e l y,r e l a t i v e l y,r e l a t i v e l y,c l e a r,c l e a r,c l e a r,bole.,bole.,,,,,,,t h e,United,United,United,S t a t e s,S t a t e s,,f o r,,individual,individual,Indi-,Indi-,Indi-
,,,,,,,,,,,,,,,ans,o r,"t r i b e s ,","t r i b e s ,","t r i b e s ,",o r,,a l l,,"l a n d s ,",t i t l e s,t i t l e s,,t o
Acceptable,Acceptable,Acceptable,Acceptable,t r e e .,t r e e .,t r e e .,A,t r e e,t r e e,t h a t,t h a t,,q u a l i -,q u a l i -,which,a r e,a r e,,h e l d,by,,i n d i v i d u a l,i n d i v i d u a l,i n d i v i d u a l,I n d i a n s,I n d i a n s,I n d i a n s,o r
f i e s,f i e s,a s,growing,growing,growing,,s t o c k,s t o c k,,b u t,d o e s,d o e s,n o t,,"t r i b e s ,","t r i b e s ,",subject,subject,subject,,t o,Federal,Federal,Federal,r e a t r i c t i o n s,r e a t r i c t i o n s,r e a t r i c t i o n s,r e a t r i c t i o n s
meet,meet,t h e,minimum,minimum,minimum,minimum,r e q u i r e m e n t s,r e q u i r e m e n t s,r e q u i r e m e n t s,r e q u i r e m e n t s,r e q u i r e m e n t s,,t o,,a g a i n s t,a g a i n s t,"alienation ,","alienation ,","alienation ,","alienation ,","alienation ,",,,,,,,
q u a l i f y,q u a l i f y,q u a l i f y,a s,a,d e s i r a b l e,d e s i r a b l e,d e s i r a b l e,d e s i r a b l e,d e s i r a b l e,t r e e .,t r e e .,,Included,Included,,,,,,,,,,,,,,
a r e,,s a w t i m b e r - s i z e,s a w t i m b e r - s i z e,s a w t i m b e r - s i z e,s a w t i m b e r - s i z e,s a w t i m b e r - s i z e,,t r e e s,t r e e s,,t h a t,,do,n o t,I n d u s t r i a l,I n d u s t r i a l,I n d u s t r i a l,I n d u s t r i a l,wood.,wood.,A l l,A l l,roundwood,roundwood,roundwood,p r o d u c t s,p r o d u c t s,p r o d u c t s
c o n t a i n,c o n t a i n,c o n t a i n,a,1 2 - f o o t,1 2 - f o o t,1 2 - f o o t,,saw,,l o g,b e c a u s e,b e c a u s e,b e c a u s e,o f,e x c e p t,,fuelwood.,fuelwood.,fuelwood.,fuelwood.,,,,,,,,
"excessive,","excessive,","excessive,","excessive,",natural,natural,natural,natural,taper,taper,,i n,the,,b u t t,,,,,,,,,,,,,,
l o g,,b u t,have,have,t h e,t h e,p o t e n t i a l,p o t e n t i a l,p o t e n t i a l,p o t e n t i a l,,t o,pro-,,I n g r o w t h .,I n g r o w t h .,I n g r o w t h .,,The,number,number,number,o r,n e t,volume,volume,o f,
d u c e,d u c e,a,1 2 - f o o t,1 2 - f o o t,1 2 - f o o t,,saw,l o g,l o g,a s,d i a m e t e r,d i a m e t e r,d i a m e t e r,,t r e e s,t,h,a,~grow,,l a r g e,l a r g e,enough,enough,d u r i n g,d u r i n g,a,
increases.,increases.,increases.,increases.,,,,,,,,,,,,specified,specified,specified,,year,t o,,qualify,qualify,a s,"saplings,","saplings,","saplings,","saplings,"
,,,,,,,,,,,,,,,"poletimber,","poletimber,","poletimber,","poletimber,",o r,sawtimber.,sawtimber.,sawtimber.,sawtimber.,,,,,
Growing-stock,Growing-stock,Growing-stock,Growing-stock,,volume.,volume.,volume.,Volume,Volume,Volume,,( c u b i c,( c u b i c,,,,,,,,,,,,,,,
f e e t ),,o f,s o l i d,s o l i d,wood,wood,,i n,g r o w i n g - s t o c k,g r o w i n g - s t o c k,g r o w i n g - s t o c k,g r o w i n g - s t o c k,g r o w i n g - s t o c k,,I n h i b i t i n g,I n h i b i t i n g,I n h i b i t i n g,I n h i b i t i n g,v e g e t a t i o n .,v e g e t a t i o n .,v e g e t a t i o n .,v e g e t a t i o n .,,Cover,s u f f i -,s u f f i -,,
t r e e s,,5.0,i n c h e s,i n c h e s,i n c h e s,d . b . h .,d . b . h .,d . b . h .,,and,"l a r g e r ,","l a r g e r ,","l a r g e r ,",,c i e n t l y,c i e n t l y,dense,dense,dense,t o,prevent,prevent,prevent,t h e,e s t a b l i s h -,e s t a b l i s h -,e s t a b l i s h -,e s t a b l i s h -
from,a,1 - f o o t,1 - f o o t,,stump,stump,,t o,a,minimum,minimum,minimum,,,ment,o f,t r e e,t r e e,t r e e,s e e d l i n g s .,s e e d l i n g s .,s e e d l i n g s .,s e e d l i n g s .,,,,,
4 . 0 - i n c h,4 . 0 - i n c h,,t o p,"d i a m e t e r ,","d i a m e t e r ,","d i a m e t e r ,","d i a m e t e r ,","d i a m e t e r ,",o u t s i d e,o u t s i d e,o u t s i d e,,"b a r k ,",on,,,,,,,,,,,,,,
t h e,c e n t r a l,c e n t r a l,,s t e m .,s t e m .,,Vo1un.e,Vo1un.e,Vo1un.e,o f,s o l i d,s o l i d,,wood,Land,a r e a .,a r e a .,,The,a r e a,a r e a,,o f,d r y,l a n d,and,,
i n,p r i m a r y,p r i m a r y,f o r k s,f o r k s,f o r k s,,from,,t h e,p o i n t,p o i n t,,o f,,l a n d,t e m p c r a r i l y,t e m p c r a r i l y,t e m p c r a r i l y,t e m p c r a r i l y,t e m p c r a r i l y,o r,,p a r t l y,p a r t l y,c o v e r e d,c o v e r e d,by,
o c c u r r e n c e,o c c u r r e n c e,o c c u r r e n c e,t o,,a,minimum,minimum,minimum,,4 . 0 - i n c h,4 . 0 - i n c h,4 . 0 - i n c h,t o p,,w a t e r,s u c h,s u c h,s u c h,a s,"m a r s h e s ,","m a r s h e s ,","m a r s h e s ,",,"swamps,",,and,,
diameter,diameter,,outside,outside,outside,,bark,,i s,included.,included.,included.,included.,,r i v e r,flood,flood,flood,plains,plains,plains,(omitting,(omitting,(omitting,t i d a l,t i d a l,,
,,,,,,,,,,,,,,,f l a t s,below,below,below,mean,mean,h i g h,h i g h,"t i d e ) ,","t i d e ) ,","s t r e a m s ,","s t r e a m s ,","s t r e a m s ,",
Hardwoods.,Hardwoods.,Hardwoods.,Angiosperms;,Angiosperms;,Angiosperms;,Angiosperms;,Angiosperms;,Angiosperms;,,d i c o t y l e d o n o u s,d i c o t y l e d o n o u s,d i c o t y l e d o n o u s,d i c o t y l e d o n o u s,d i c o t y l e d o n o u s,"s l o u g h s ,","s l o u g h s ,",,"e s t u a r i e s ,","e s t u a r i e s ,","e s t u a r i e s ,","e s t u a r i e s ,",,and,c a n a l s,c a n a l s,l e s s,,
t r e e s,,( i n c l u d i n g,( i n c l u d i n g,( i n c l u d i n g,( i n c l u d i n g,,a l l,palm,palm,s p e c i e s,s p e c i e s,s p e c i e s,,which,than,one-eighth,one-eighth,one-eighth,one-eighth,,o f,a,s t a t u t e,s t a t u t e,mile,mile,i n,
a r e,"m o n o c o t y l e d o n o u s ) ,","m o n o c o t y l e d o n o u s ) ,","m o n o c o t y l e d o n o u s ) ,","m o n o c o t y l e d o n o u s ) ,","m o n o c o t y l e d o n o u s ) ,","m o n o c o t y l e d o n o u s ) ,","m o n o c o t y l e d o n o u s ) ,",,u s u a l l y,u s u a l l y,u s u a l l y,,broad-,broad-,"w i d t h ,",,and,and,"l a k e s ,","l a k e s ,",,"r e s e r v o i r s ,","r e s e r v o i r s ,","r e s e r v o i r s ,",and,and,ponds,ponds
l e a f,and,,d e c i d u o u s .,d e c i d u o u s .,d e c i d u o u s .,d e c i d u o u s .,,,,,,,,,l e s s,t h a n,t h a n,,40,a c r e s,a c r e s,i n,a r e a .,a r e a .,,,,
