Name: “Table 1 of 1 on page 22 of 74”,Name: “Table 1 of 1 on page 22 of 74”,Name: “Table 1 of 1 on page 22 of 74”,Name: “Table 1 of 1 on page 22 of 74”,Name: “Table 1 of 1 on page 22 of 74”,Name: “Table 1 of 1 on page 22 of 74”,Name: “Table 1 of 1 on page 22 of 74”,Name: “Table 1 of 1 on page 22 of 74”,Name: “Table 1 of 1 on page 22 of 74”,Name: “Table 1 of 1 on page 22 of 74”,Name: “Table 1 of 1 on page 22 of 74”,Name: “Table 1 of 1 on page 22 of 74”,Name: “Table 1 of 1 on page 22 of 74”,Name: “Table 1 of 1 on page 22 of 74”,Name: “Table 1 of 1 on page 22 of 74”,Name: “Table 1 of 1 on page 22 of 74”,Name: “Table 1 of 1 on page 22 of 74”,Name: “Table 1 of 1 on page 22 of 74”,Name: “Table 1 of 1 on page 22 of 74”,Name: “Table 1 of 1 on page 22 of 74”
Table: 22,Table: 22,Table: 22,Table: 22,Table: 22,Table: 22,Table: 22,Table: 22,Table: 22,Table: 22,Table: 22,Table: 22,Table: 22,Table: 22,Table: 22,Table: 22,Table: 22,Table: 22,Table: 22,Table: 22
,,,,,,,,,,,,,,,,,,,
,,,,,,,,TABLES,TABLES,TABLES,,,,,,,,,
,,,,,,,,County,T a b l e s,T a b l e s,T a b l e s,,,,,,,,I
,The,c o u n t y,,t a b l e s,t a b l e s,a r e,i n t e n d e d,i n t e n d e d,f o r,u s e,u s e,i n,c o m p i l i n g,c o m p i l i n g,f o r e s t,f o r e s t,r e s o u r c e,r e s o u r c e,
e s t i m a t e s,e s t i m a t e s,f o r,g r o u p s,g r o u p s,o f,c o u n t i e s .,c o u n t i e s .,c o u n t i e s .,Because,Because,,t h e,s a m p l i n g,s a m p l i n g,p r o c e d u r e,p r o c e d u r e,u s e d,u s e d,by
t h e,F o r e s t,S u r v e y,S u r v e y,was,i n t e n d e d,i n t e n d e d,i n t e n d e d,p r i m a r i l y,p r i m a r i l y,p r i m a r i l y,t o,f u r n i s h,f u r n i s h,i n v e n t o r y,i n v e n t o r y,d a t a,f o r,f o r,t h e
s u r v e y,u n i t,a s,a,"w h o l e ,","w h o l e ,",i n d i v i d u a l,i n d i v i d u a l,i n d i v i d u a l,c o u n t y,c o u n t y,e s t i m a t e s,e s t i m a t e s,e s t i m a t e s,h a v e,l i m i t e d,l i m i t e d,and,v a r i -,
a b l e,a c c u r a c y .,a c c u r a c y .,,A s,c o u n t y,t o t a l s,t o t a l s,a r e,b r o k e n,b r o k e n,b r o k e n,down,by,v a r i o u s,v a r i o u s,"s u b d i v i s i o n s ,","s u b d i v i s i o n s ,","s u b d i v i s i o n s ,",
t h e,p o s s i b i l i t y,p o s s i b i l i t y,,o f,e r r o r,i n c r e a s e s,i n c r e a s e s,i n c r e a s e s,and,i s,g r e a t e s t,g r e a t e s t,g r e a t e s t,f o r,t h e,s m a l l e s t,s m a l l e s t,i t e m s .,
The,o r d e r,of,t h i s,,i n c r e a s e,i n c r e a s e,c a n,be,computed,computed,w i t h,w i t h,t h e,f o r m u l a,f o r m u l a,on,page,7.,
