,,,2011
,,ANNUAL REPORT,ANNUAL REPORT
,,Holiday Lake 4-H Educational Center Inc.,Holiday Lake 4-H Educational Center Inc.
,,Appomattox-Buckingham State Forest,Appomattox-Buckingham State Forest
,2011 Highlights,2011 Highlights,2011 Highlights
,"These days, there is a lot of talk about “being green.” That’s nothing new","These days, there is a lot of talk about “being green.” That’s nothing new","These days, there is a lot of talk about “being green.” That’s nothing new"
,"in the field of forestry, which has been green for a long time! Conservation","in the field of forestry, which has been green for a long time! Conservation","in the field of forestry, which has been green for a long time! Conservation"
,of natural resources was woven through the 65th annual Holiday Lake,of natural resources was woven through the 65th annual Holiday Lake,of natural resources was woven through the 65th annual Holiday Lake
,"Forestry Camp, which brought Virginia teens to the Appomattox-Buckingham","Forestry Camp, which brought Virginia teens to the Appomattox-Buckingham","Forestry Camp, which brought Virginia teens to the Appomattox-Buckingham"
,"State Forest for a weeklong, field-based learning adventure. The campers’","State Forest for a weeklong, field-based learning adventure. The campers’","State Forest for a weeklong, field-based learning adventure. The campers’"
,experiences prepared them for further study in natural resource conservation,experiences prepared them for further study in natural resource conservation,experiences prepared them for further study in natural resource conservation
,"and, hopefully, nurtured what will be a lifelong love of the woods.","and, hopefully, nurtured what will be a lifelong love of the woods.","and, hopefully, nurtured what will be a lifelong love of the woods."
,This year’s 52 campers represented 33 Virginia counties and cities. Their,This year’s 52 campers represented 33 Virginia counties and cities. Their,This year’s 52 campers represented 33 Virginia counties and cities. Their
,"core classes were tree identification, forest measurements, sustainable","core classes were tree identification, forest measurements, sustainable","core classes were tree identification, forest measurements, sustainable"
,"forestry and wildlife management, tree improvement, forest ecology, forest","forestry and wildlife management, tree improvement, forest ecology, forest","forestry and wildlife management, tree improvement, forest ecology, forest"
,"management, environmental protection and reproducing the forest. Other","management, environmental protection and reproducing the forest. Other","management, environmental protection and reproducing the forest. Other"
,"experiences included a field trip to Greif Packaging’s paper mill, an afternoon","experiences included a field trip to Greif Packaging’s paper mill, an afternoon","experiences included a field trip to Greif Packaging’s paper mill, an afternoon"
,"of arboriculture demonstrations, exploratory classes, and sports and","of arboriculture demonstrations, exploratory classes, and sports and","of arboriculture demonstrations, exploratory classes, and sports and"
,Lumberjack competitions. Evening programs featured a map and compass,Lumberjack competitions. Evening programs featured a map and compass,Lumberjack competitions. Evening programs featured a map and compass
,"treasure hunt, an arson dog tracking demonstration, wildlife research and","treasure hunt, an arson dog tracking demonstration, wildlife research and","treasure hunt, an arson dog tracking demonstration, wildlife research and"
,"law enforcement presentations, and even a talent show. By week’s end,","law enforcement presentations, and even a talent show. By week’s end,","law enforcement presentations, and even a talent show. By week’s end,"
,"the campers had attained not only new knowledge, skills and friends, but","the campers had attained not only new knowledge, skills and friends, but","the campers had attained not only new knowledge, skills and friends, but"
,also an excellent introduction to diverse career fields in natural resources.,also an excellent introduction to diverse career fields in natural resources.,also an excellent introduction to diverse career fields in natural resources.
,Comments on camper evaluations indicated that most campers significantly,Comments on camper evaluations indicated that most campers significantly,Comments on camper evaluations indicated that most campers significantly
,improved their knowledge of the core subjects taught at camp. As in,improved their knowledge of the core subjects taught at camp. As in,improved their knowledge of the core subjects taught at camp. As in
,"previous years, skill confidence was highest in tree identification, and many","previous years, skill confidence was highest in tree identification, and many","previous years, skill confidence was highest in tree identification, and many"
,campers planned to share their new skills with others. The campers took,campers planned to share their new skills with others. The campers took,campers planned to share their new skills with others. The campers took
,"home excellent resource materials, and the top 10 campers (as scored","home excellent resource materials, and the top 10 campers (as scored","home excellent resource materials, and the top 10 campers (as scored"
,academically throughout the week) received awards of outdoor recreation,academically throughout the week) received awards of outdoor recreation,academically throughout the week) received awards of outdoor recreation
,supplies and reference books. This year’s top-scoring camper was Gus,supplies and reference books. This year’s top-scoring camper was Gus,supplies and reference books. This year’s top-scoring camper was Gus
,Hollberg from Staunton.,Hollberg from Staunton.,
Arborist,"For the fifth year, Monday’s program included a forestry field day for campers’","For the fifth year, Monday’s program included a forestry field day for campers’","For the fifth year, Monday’s program included a forestry field day for campers’"
,parents. Participating parents experienced short versions of tree identification and,parents. Participating parents experienced short versions of tree identification and,parents. Participating parents experienced short versions of tree identification and
Tree Climbing,forest measurement classes and toured Appomattox-Buckingham State Forest to,forest measurement classes and toured Appomattox-Buckingham State Forest to,forest measurement classes and toured Appomattox-Buckingham State Forest to
,see forest management in action. They took home information to use on their own,see forest management in action. They took home information to use on their own,see forest management in action. They took home information to use on their own
,property and to share with neighbors.,property and to share with neighbors.,
,,The Virginia Department of Forestry gratefully acknowledges,The Virginia Department of Forestry gratefully acknowledges
,,the contributions and services of the many groups and,the contributions and services of the many groups and
,“I found this experience,individuals whose generous support makes Holiday Lake,individuals whose generous support makes Holiday Lake
VIRGI NIA,"fun, entertaining and",Forestry Camp possible. Donations to the scholarship program,Forestry Camp possible. Donations to the scholarship program
,,allow campers to attend at a minimal personal cost. The 34,allow campers to attend at a minimal personal cost. The 34
,life changing.”,staff members and presenters served as “in-kind” contributors,staff members and presenters served as “in-kind” contributors
,"– Rick P., Alexandria, VA",who were paid by their employers or truly volunteered their,who were paid by their employers or truly volunteered their
,,time.,
,,"For more information, please contact:","For more information, please contact:"
,Visit us on the Web:,Visit us on the Web:,"Ellen Powell, 2011 Camp Coordinator"
,www.dof.virginia.gov/edu/camp.htm,www.dof.virginia.gov/edu/camp.htm,ellen.powell@dof.virginia.gov;
,,,(434)220-9083
,Page 1,Page 1,
HOLIDAY LAKE FORESTRY CAMP,2011 Annual Report
What Do We Do At Camp...,
We Do It ALL!,
,Tree Planting
Tree Identification,
Wood Turning,Firefighting
,Forest Management
Tree,
Measurements,
,Cross-Cut Saw Competition
Page 2,
HOLIDAY LAKE FORESTRY CAMP,,,,,2011 Annual Report
2011 CAMP STAFF,,,,,
Administration,,,,,
CAMP DIRECTORS,,CAMP MEDICS,CAMP MEDICS,CAMP MEDICS,
,"Drew Arnn – VDOF, Pittsylvania County",,"Paul Reier – VDOF, New Kent, Charles City and Peninsula","Paul Reier – VDOF, New Kent, Charles City and Peninsula","Paul Reier – VDOF, New Kent, Charles City and Peninsula"
,"Gale Washburn – VDOF, Lunenburg County",,"Chris Clayton – VDOF, Fauquier County","Chris Clayton – VDOF, Fauquier County","Chris Clayton – VDOF, Fauquier County"
CAMP COORDINATOR,,CAMP PHOTOGRAPHER,CAMP PHOTOGRAPHER,CAMP PHOTOGRAPHER,
,"Ellen Powell – VDOF, Charlottesville",,"Janet Muncy – VDOF, Charlottesville","Janet Muncy – VDOF, Charlottesville","Janet Muncy – VDOF, Charlottesville"
CAMP REGISTRAR,,4-H CENTER LIAISON,4-H CENTER LIAISON,4-H CENTER LIAISON,
,"Becky Woodson – VDOF, Charlottesville",,Nate Mahanes – Holiday Lake 4-H Center,Nate Mahanes – Holiday Lake 4-H Center,Nate Mahanes – Holiday Lake 4-H Center
Instructors,,,,,
Environmental Protection......................... Hylton Haynes – Volunteer,Environmental Protection......................... Hylton Haynes – Volunteer,Environmental Protection......................... Hylton Haynes – Volunteer,Environmental Protection......................... Hylton Haynes – Volunteer,Environmental Protection......................... Hylton Haynes – Volunteer,
"Reproducing the Forest............................ Shannon Lewis – VDOF, Appomattox County","Reproducing the Forest............................ Shannon Lewis – VDOF, Appomattox County","Reproducing the Forest............................ Shannon Lewis – VDOF, Appomattox County","Reproducing the Forest............................ Shannon Lewis – VDOF, Appomattox County","Reproducing the Forest............................ Shannon Lewis – VDOF, Appomattox County",
Tree Identification................................... Amy Bigger – RockTenn,Tree Identification................................... Amy Bigger – RockTenn,Tree Identification................................... Amy Bigger – RockTenn,Tree Identification................................... Amy Bigger – RockTenn,,
Forest Measurements.............................. Wayne Harris – RockTenn,Forest Measurements.............................. Wayne Harris – RockTenn,Forest Measurements.............................. Wayne Harris – RockTenn,Forest Measurements.............................. Wayne Harris – RockTenn,Forest Measurements.............................. Wayne Harris – RockTenn,
"Timber Harvesting................................... Billy Newman – EnviroFor LLC, Nelson County","Timber Harvesting................................... Billy Newman – EnviroFor LLC, Nelson County","Timber Harvesting................................... Billy Newman – EnviroFor LLC, Nelson County","Timber Harvesting................................... Billy Newman – EnviroFor LLC, Nelson County","Timber Harvesting................................... Billy Newman – EnviroFor LLC, Nelson County",
Wildlife Management............................... Dan Lovelace – VDGIF,Wildlife Management............................... Dan Lovelace – VDGIF,Wildlife Management............................... Dan Lovelace – VDGIF,Wildlife Management............................... Dan Lovelace – VDGIF,,
"Tree Improvement, Nursery Mgmt............ Paul Reier – VDOF, New Kent, Charles City","Tree Improvement, Nursery Mgmt............ Paul Reier – VDOF, New Kent, Charles City","Tree Improvement, Nursery Mgmt............ Paul Reier – VDOF, New Kent, Charles City","Tree Improvement, Nursery Mgmt............ Paul Reier – VDOF, New Kent, Charles City","Tree Improvement, Nursery Mgmt............ Paul Reier – VDOF, New Kent, Charles City",
.............................................................,.............................................................,and Peninsula,and Peninsula,and Peninsula,
"Forest Ecology and Management.............. Karen Snape – VDOF, King George County","Forest Ecology and Management.............. Karen Snape – VDOF, King George County","Forest Ecology and Management.............. Karen Snape – VDOF, King George County","Forest Ecology and Management.............. Karen Snape – VDOF, King George County","Forest Ecology and Management.............. Karen Snape – VDOF, King George County",
"............................................................. Kathleen Ogilvy – VDOF, Hanover County","............................................................. Kathleen Ogilvy – VDOF, Hanover County","............................................................. Kathleen Ogilvy – VDOF, Hanover County","............................................................. Kathleen Ogilvy – VDOF, Hanover County","............................................................. Kathleen Ogilvy – VDOF, Hanover County",
Archery.................................................. Holiday Lake 4-H Center staff,Archery.................................................. Holiday Lake 4-H Center staff,Archery.................................................. Holiday Lake 4-H Center staff,Archery.................................................. Holiday Lake 4-H Center staff,Archery.................................................. Holiday Lake 4-H Center staff,
Wilderness Survival................................. Derek Mays – Amherst County Schools,Wilderness Survival................................. Derek Mays – Amherst County Schools,Wilderness Survival................................. Derek Mays – Amherst County Schools,Wilderness Survival................................. Derek Mays – Amherst County Schools,Wilderness Survival................................. Derek Mays – Amherst County Schools,
Canoeing................................................ Holiday Lake 4-H Center staff,Canoeing................................................ Holiday Lake 4-H Center staff,Canoeing................................................ Holiday Lake 4-H Center staff,Canoeing................................................ Holiday Lake 4-H Center staff,Canoeing................................................ Holiday Lake 4-H Center staff,
Skeet Shooting........................................ Art Kasson – Volunteer,Skeet Shooting........................................ Art Kasson – Volunteer,Skeet Shooting........................................ Art Kasson – Volunteer,Skeet Shooting........................................ Art Kasson – Volunteer,,
Low Ropes Initiatives............................... Holiday Lake 4-H Center staff,Low Ropes Initiatives............................... Holiday Lake 4-H Center staff,Low Ropes Initiatives............................... Holiday Lake 4-H Center staff,Low Ropes Initiatives............................... Holiday Lake 4-H Center staff,Low Ropes Initiatives............................... Holiday Lake 4-H Center staff,
Stream Analysis...................................... Holiday Lake 4-H Center staff,Stream Analysis...................................... Holiday Lake 4-H Center staff,Stream Analysis...................................... Holiday Lake 4-H Center staff,Stream Analysis...................................... Holiday Lake 4-H Center staff,Stream Analysis...................................... Holiday Lake 4-H Center staff,
"Wildfire Tactics and Equipment................. Jim Jarvis – VDOF, Campbell County","Wildfire Tactics and Equipment................. Jim Jarvis – VDOF, Campbell County","Wildfire Tactics and Equipment................. Jim Jarvis – VDOF, Campbell County","Wildfire Tactics and Equipment................. Jim Jarvis – VDOF, Campbell County","Wildfire Tactics and Equipment................. Jim Jarvis – VDOF, Campbell County",
"............................................................. Rick Butler – VDOF, Appomattox County","............................................................. Rick Butler – VDOF, Appomattox County","............................................................. Rick Butler – VDOF, Appomattox County","............................................................. Rick Butler – VDOF, Appomattox County","............................................................. Rick Butler – VDOF, Appomattox County",
"............................................................. Mike Womack – VDOF, State Forests","............................................................. Mike Womack – VDOF, State Forests","............................................................. Mike Womack – VDOF, State Forests","............................................................. Mike Womack – VDOF, State Forests","............................................................. Mike Womack – VDOF, State Forests",
Reptiles and Amphibians.......................... Holiday Lake 4-H Center staff,Reptiles and Amphibians.......................... Holiday Lake 4-H Center staff,Reptiles and Amphibians.......................... Holiday Lake 4-H Center staff,Reptiles and Amphibians.......................... Holiday Lake 4-H Center staff,Reptiles and Amphibians.......................... Holiday Lake 4-H Center staff,
"Furbearers and Trapping.............................Jay Bassett – VDOF, Sussex County","Furbearers and Trapping.............................Jay Bassett – VDOF, Sussex County","Furbearers and Trapping.............................Jay Bassett – VDOF, Sussex County","Furbearers and Trapping.............................Jay Bassett – VDOF, Sussex County","Furbearers and Trapping.............................Jay Bassett – VDOF, Sussex County",
Wood Turning......................................... Ray Deyo and Richmond Woodturners,Wood Turning......................................... Ray Deyo and Richmond Woodturners,Wood Turning......................................... Ray Deyo and Richmond Woodturners,Wood Turning......................................... Ray Deyo and Richmond Woodturners,Wood Turning......................................... Ray Deyo and Richmond Woodturners,Tree Measurements
Program Presenters,,,,,
Urban Forestry Day................................. Bartlett Tree Experts,Urban Forestry Day................................. Bartlett Tree Experts,Urban Forestry Day................................. Bartlett Tree Experts,Urban Forestry Day................................. Bartlett Tree Experts,,
............................................................. Neil Clark – VCE,............................................................. Neil Clark – VCE,............................................................. Neil Clark – VCE,,,
Bear Research......................................... Cale Godfrey – VDGIF,Bear Research......................................... Cale Godfrey – VDGIF,Bear Research......................................... Cale Godfrey – VDGIF,Bear Research......................................... Cale Godfrey – VDGIF,,
"Lumberjack Field Day.............................. Gale Washburn – VDOF, Lunenburg County","Lumberjack Field Day.............................. Gale Washburn – VDOF, Lunenburg County","Lumberjack Field Day.............................. Gale Washburn – VDOF, Lunenburg County","Lumberjack Field Day.............................. Gale Washburn – VDOF, Lunenburg County","Lumberjack Field Day.............................. Gale Washburn – VDOF, Lunenburg County",
"Arson Dog Demonstration........................ Brad Whittington and Summer – VDOF, Mecklenburg County","Arson Dog Demonstration........................ Brad Whittington and Summer – VDOF, Mecklenburg County","Arson Dog Demonstration........................ Brad Whittington and Summer – VDOF, Mecklenburg County","Arson Dog Demonstration........................ Brad Whittington and Summer – VDOF, Mecklenburg County","Arson Dog Demonstration........................ Brad Whittington and Summer – VDOF, Mecklenburg County","Arson Dog Demonstration........................ Brad Whittington and Summer – VDOF, Mecklenburg County"
Forest Products....................................... Jason Fisher – VCE,Forest Products....................................... Jason Fisher – VCE,Forest Products....................................... Jason Fisher – VCE,,,
............................................................. Ray Deyo and Lee Scarbrough – Richmond Woodturners,............................................................. Ray Deyo and Lee Scarbrough – Richmond Woodturners,............................................................. Ray Deyo and Lee Scarbrough – Richmond Woodturners,............................................................. Ray Deyo and Lee Scarbrough – Richmond Woodturners,............................................................. Ray Deyo and Lee Scarbrough – Richmond Woodturners,............................................................. Ray Deyo and Lee Scarbrough – Richmond Woodturners
Conservation Police................................. Zach Adams – VDGIF,Conservation Police................................. Zach Adams – VDGIF,Conservation Police................................. Zach Adams – VDGIF,Conservation Police................................. Zach Adams – VDGIF,,
Paper Mill Tour........................................ Jay Phaup – Greif-Riverville LLC,Paper Mill Tour........................................ Jay Phaup – Greif-Riverville LLC,Paper Mill Tour........................................ Jay Phaup – Greif-Riverville LLC,Paper Mill Tour........................................ Jay Phaup – Greif-Riverville LLC,Paper Mill Tour........................................ Jay Phaup – Greif-Riverville LLC,
"Parents’ Program..................................... Rick Butler – VDOF, Appomattox County","Parents’ Program..................................... Rick Butler – VDOF, Appomattox County","Parents’ Program..................................... Rick Butler – VDOF, Appomattox County","Parents’ Program..................................... Rick Butler – VDOF, Appomattox County","Parents’ Program..................................... Rick Butler – VDOF, Appomattox County",“I think all nature
"............................................................. Mike Womack – VDOF, State Forests","............................................................. Mike Womack – VDOF, State Forests","............................................................. Mike Womack – VDOF, State Forests","............................................................. Mike Womack – VDOF, State Forests","............................................................. Mike Womack – VDOF, State Forests",
,,,,,enthusiasts will
Counselors,,,,,love this camp.”
"Jay Bassett – VDOF, Sussex County","Tom Snoddy – VDOF, Spotsylvania County","Tom Snoddy – VDOF, Spotsylvania County","Tom Snoddy – VDOF, Spotsylvania County","Tom Snoddy – VDOF, Spotsylvania County","– Gavin B.,"
"Carl Belew – VDOF, Charlottesville",Chris Wargo – Fauquier County Public Schools,Chris Wargo – Fauquier County Public Schools,Chris Wargo – Fauquier County Public Schools,Chris Wargo – Fauquier County Public Schools,"Staunton, VA"
"Chris Clayton – VDOF, Culpeper County",,,,,
"Hylton Haynes – VDMA, Fort Pickett",,,,,
"Shannon Lewis – VDOF, Appomattox County","Shannon Lewis – VDOF, Appomattox County",,“Now I’m positive I want to,“Now I’m positive I want to,
Derek Mays – Amherst County Public Schools,Derek Mays – Amherst County Public Schools,,,go into this career.”,
"Billy Newman – EnviroFor LLC, Nelson County","Billy Newman – EnviroFor LLC, Nelson County",,,,
"Kathleen Ogilvy – VDOF, Hanover County",,,–,Madison,"G., Crewe, VA"
"Elizabeth Smith – Volunteer, Tazewell County","Elizabeth Smith – Volunteer, Tazewell County",,,,
"Karen Snape – VDOF, King George County","Karen Snape – VDOF, King George County",,,,
,,Page 3,Page 3,,
HOLIDAY LAKE FORESTRY CAMP,,,2011 Annual Report
2011 Holiday Lake Forestry Camp Sponsors,2011 Holiday Lake Forestry Camp Sponsors,2011 Holiday Lake Forestry Camp Sponsors,
We gratefully acknowledge the contributions and services of the many groups and individuals whose generous,We gratefully acknowledge the contributions and services of the many groups and individuals whose generous,We gratefully acknowledge the contributions and services of the many groups and individuals whose generous,We gratefully acknowledge the contributions and services of the many groups and individuals whose generous
support makes Holiday Lake Forestry Camp possible. Donations to the scholarship program enable campers,support makes Holiday Lake Forestry Camp possible. Donations to the scholarship program enable campers,support makes Holiday Lake Forestry Camp possible. Donations to the scholarship program enable campers,support makes Holiday Lake Forestry Camp possible. Donations to the scholarship program enable campers
to attend at a minimal personal cost.,to attend at a minimal personal cost.,,
Agencies & Institutions Organizations &,Agencies & Institutions Organizations &,Agencies & Institutions Organizations &,Soil & Water
Virginia Department of Forestry,Individuals,,Conservation Districts
Virginia Department of Game & Inland,,,
